,Unnamed: 0,song_name,song_id,song_genre,url,artist,artist_id,artist_genre,release_date,duration_ms,popularity,danceability,energy,key,loudness,mode,speechiness,acousticness,instrumentalness,liveness,valence,tempo,duration_ms_,time_signature,lyrics
412,412,Blended Family (What You Do For Love) (feat. A$AP Rocky),5FOAptZGxeMAO0BJSQh2fc,r-n-b,https://open.spotify.com/track/5FOAptZGxeMAO0BJSQh2fc,"['Alicia Keys', 'A$AP Rocky']","['3DiDSECUqqY1AuBP8qtaIa', '13ubrt8QOOCPljQ2FL1Kca']","[['hip pop', 'neo soul', 'pop', 'r&b', 'urban contemporary'], ['east coast hip hop', 'hip hop', 'rap', 'trap']]",2016-11-04,211546,48,0.721,0.518,9,-7.619,1,0.0719,0.0658,0.000113,0.069,0.231,96.988,211547,4,"Hey, I might not really be your mother
That don't mean that I don't really love ya
And even though I married your father
That's not the only reason I'm here for ya

I think you're beautiful
I think you're perfect
I know how hard it gets
But I swear it's worth it, worth it

That's what you do, what you do
What you do, what you do for love
There ain't nothing, there ain't nothing
There ain't nothing I won't do for us
It may not be easy
This blended family, but baby
That's what you do, what you do
What you do, what you do for love, love

I know it started with a little drama
I hate you had to read it in the paper
But everything's alright with me and your mama
Baby everyone here you know adores ya
...

******* This Lyrics is NOT for Commercial use *******
(1409622095821)"
413,413,7/11,02M6vucOvmRfMxTXDUwRXu,r-n-b,https://open.spotify.com/track/02M6vucOvmRfMxTXDUwRXu,Beyoncé,6vWDO969PvNqNYHIOW5v0m,"['dance pop', 'pop', 'post-teen pop', 'r&b']",2014-11-24,213506,71,0.747,0.705,9,-5.1370000000000005,0,0.126,0.0128,0.0,0.126,0.56,136.024,213507,4,"Shoulders sideways, smack it, smack it in the air
Legs movin' side to side, smack it in the air
Legs movin' side to side, smack you in the air
Shoulders sideways, smack it, smack it in the air

Smack it, smack it in the air
Legs movin' side to side
Smack it, smack it in the air
Smack it, smack it in the air

Wave your hands side to side, put it in the air
Wave your hands side to side, put it in the air
Clap, clap, clap like you don't care
Smack that, clap, clap, clap like you don't care (I know you care)

Clap, clap, clap, clap, clap it
Foot up, my foot up
Hold up now, my foot up
I'm spinnin', my foot up
Foot up, yeah, my foot up

I'm spinnin', my foot up
Put my foot down, yeah, my hands up
My hands up, my hands up (flexin')
Flexin' while my hands up

My hands up, my hands up
I stand up with my hands up
Then I put up, my hands up
I put up, my hands up

I put up, my hands up
Then I'm spinnin' all my hands up (spinnin')
Spinnin' while my hands up (spinnin')
Spinnin' while my hands up (spinnin')
...

******* This Lyrics is NOT for Commercial use *******
(1409622095821)"
414,414,La Di Da,5IIq5uEYpUZoSjTEjqn7q1,r-n-b,https://open.spotify.com/track/5IIq5uEYpUZoSjTEjqn7q1,The Internet,7GN9PivdemQRKjDt4z5Zv8,"['alternative r&b', 'escape room', 'indie soul', 'lgbtq+ hip hop', 'neo soul', 'r&b']",2018-07-20,207013,46,0.685,0.745,1,-6.659,1,0.11699999999999999,0.259,3.11e-05,0.107,0.8340000000000001,103.119,207013,4,"I move like the silent g in designer
Real talk, something to say
My groove right, I might snatch up your wife
Smooth like it's nothin' to me
Get out my way, talk if you wanna
Me, Imma gonna preach
I'm a hard act to follow, keep up your animal
Move your feet, enjoy my sweet soirée
Look at me, I'm so suave
Dancing like your name shawty
Hey, why you so worried 'bout me?
No, no, no sir, not today

I just came to dance
Wanna move
I can't with you
Sayin' la di da, la di da
Said, I'm try'na dance
Catch your groove
Not with you
We go la di da, la di da
...

******* This Lyrics is NOT for Commercial use *******
(1409622095821)"
415,415,Thinking ‘Bout You (Sleepless In Cairo),6FmswdEnn2WK6T8GV5fFKS,r-n-b,https://open.spotify.com/track/6FmswdEnn2WK6T8GV5fFKS,"['Sufyvn', 'BJ The Chicago Kid']","['5uO9QrR5mvPdJ7uPIESbr6', '07d5etnpjriczFBB8pxmRe']","[['african electronic', 'african experimental', 'sudanese pop'], ['alternative r&b', 'chicago rap', 'hip hop', 'indie r&b', 'indie soul', 'neo soul', 'pop r&b', 'r&b', 'underground hip hop']]",2017-07-06,181595,26,0.612,0.5579999999999999,6,-8.855,0,0.11800000000000001,0.49,3.21e-05,0.0913,0.55,137.961,181596,4,"I'm mad as hell, don't know what to do
I'm tryna get through
I'ma turn around and get right back to you
Shit, what they gon' do?

Feels like they're holding me as a prisoner
Only thing in my head, baby, is us laying together
Laying right here in my bed
Right here, baby, next to me
This can't be my destiny

'Cause, baby, desperately
I need you next to me 'cause I can't stop
Thinkin' 'bout ya, thinkin' 'bout ya
Thinkin' 'bout ya, thinkin' 'bout ya
'Bout ya, 'bout ya
All night and I think I'll still be thinkin' 'bout ya
...

******* This Lyrics is NOT for Commercial use *******
(1409622095821)"
416,416,Drunk in Love (feat. Jay-Z),6jG2YzhxptolDzLHTGLt7S,r-n-b,https://open.spotify.com/track/6jG2YzhxptolDzLHTGLt7S,"['Beyoncé', 'JAY-Z']","['6vWDO969PvNqNYHIOW5v0m', '3nFkdlSjzX9mRTtwJOzDYB']","[['dance pop', 'pop', 'post-teen pop', 'r&b'], ['east coast hip hop', 'hip hop', 'pop rap', 'rap']]",2014-11-24,323480,70,0.589,0.621,5,-6.902,0,0.0468,0.00969,0.0010400000000000001,0.18100000000000002,0.401,140.03,323480,4,"I've been drinking, I've been drinking

I get filthy when that liquor get into me
I've been thinking, I've been thinking

Why can't I keep my fingers off it, baby
I want you, na-na
Why can't I keep my fingers off it, baby
I want you, na-na

Cigars on ice, cigars on ice
Feeling like an animal with these cameras all in my grill
Flashing lights, flashing lights

You got me faded, faded, faded, baby
I want you, na-na
Can't keep your eyes off my fatty daddy
I want you, na-na

Drunk in love, I want you

We woke up in the kitchen
Saying, ""How the hell did this shit happen
Oh baby
Drunk in love
We be all night

Last thing I remember is our beautiful bodies grinding up in that club
Drunk in love

We be all night, love, love
We be all night, love, love

We be all night, and everything alright
No complaints from my body
So fluorescent under these lights

...

******* This Lyrics is NOT for Commercial use *******
(1409622095821)"
417,417,Floating (feat. Khalid),2vLWF4yFhTHQZVwrPTjH1s,r-n-b,https://open.spotify.com/track/2vLWF4yFhTHQZVwrPTjH1s,"['Alina Baraz', 'Khalid']","['6hfwwpXqZPRC9CsKI7qtv1', '6LuN9FCkKOj5PcnpouEgny']","[['alternative r&b', 'etherpop', 'pop', 'post-teen pop', 'r&b'], ['pop']]",2018-04-06,174489,68,0.66,0.447,1,-9.026,0,0.0482,0.81,2.15e-06,0.11,0.578,84.95,174490,4,
418,418,Tyrant (feat. Jorja Smith),4FZOSDwALdWxcGcRbwXWJ8,r-n-b,https://open.spotify.com/track/4FZOSDwALdWxcGcRbwXWJ8,"['Kali Uchis', 'Jorja Smith']","['1U1el3k54VvEUzo3ybLPlM', '1CoZyIx7UvdxT5c8UkMzHd']","[['colombian pop', 'pop'], ['alternative r&b', 'pop', 'r&b', 'uk contemporary r&b']]",2018-04-06,204289,61,0.42200000000000004,0.47100000000000003,3,-8.783999999999999,0,0.18,0.142,0.0,0.11199999999999999,0.62,82.43299999999999,204290,4,"Baby dímelo
Dímelo, dímelo, dímelo

All I hear is sirens
In a world so violent
Would you be a tyrant
If I gave you power
Would you take it out
Look me in my iris
I can read your silence
When everything is a riot
You're my peace and quiet

All around we go
Your lovin' is like a kaleidoscope
I don't wanna come down
Keep spinnin' me 'round and 'round
And 'round and 'round and 'round
Wanna seize the throne
But what would you do if I have control
I don't wanna come down
Keep spinnin' me 'round and 'round
And 'round and 'round and 'round

...

******* This Lyrics is NOT for Commercial use *******
(1409622095821)"
419,419,I Smile,0UQDSP8cz6WmLJckO5jqUQ,r-n-b,https://open.spotify.com/track/0UQDSP8cz6WmLJckO5jqUQ,Kirk Franklin,4akybxRTGHJZ1DXjLhJ1qu,"['gospel', 'gospel r&b']",2011-03-21,307973,56,0.745,0.753,1,-2.408,1,0.16399999999999998,0.223,0.0,0.705,0.589,144.05700000000002,307973,4,"I dedicate this song to recession
Depression and unemployment
This song's for you
Today's a new day, and there is no sunshine
Nothing but clouds, and it's dark in my heart
And it feels like a cold night
Today's a new day, where are my blue skies
Where is the love and the joy that you promised me
You tell me it's alright
I'll be honest with you

I almost gave up, but a power that I can't explain
Fell from heaven like a shower
(When I think how much better I'm gonna be when this is over)

I smile, even though I'm hurt, see I smile
I know God is working so I smile
Even though I've been here for a while (what do you do?)
I smile, smile (come on)
It's so hard to look up when you look down
I sure would hate to see you give up now (god's people)
You look so much better when you smile, so smile
(Now everyday ain't gon' be perfect
But still don't mean today don't have purpose, c'mon)

Today's a new day, but there is no sunshine
Nothing but clouds, and it's dark in my heart
And it feels like a cold night
Today's a new day, tell me where are my blue skies (where is that love, y'all?)
...

******* This Lyrics is NOT for Commercial use *******
(1409622095821)"
420,420,Walking Trophy,4hGHcdD5IwjAkftalZm5an,r-n-b,https://open.spotify.com/track/4hGHcdD5IwjAkftalZm5an,HoodCelebrityy,5t6cgFa6vbJbNuxUTgT1L9,"['dancehall', 'trap queen']",2018-03-23,215112,55,0.691,0.604,0,-6.358,1,0.341,0.129,0.00494,0.10800000000000001,0.44,125.55,215112,5,"Yea, yea, yea, yea, yea, yea
You a walking trophy
Girl, you a walking trophy
You a walking trophy
My girl you a walking trophy
You an yuh friends dem a walking trophy
Tell a gal seh

Gal yuh know seh yuh pretty from yuh born
Walk out gal
Yuh nah try hard
Dem girl dem nuh pretty inna real life
You pretty pon di gram
An yuh pretty inna real life
Yuh body look good set right
Yuh ting tun up pussy well tight
Batty clean naugh nuh cellulite
An yuh skin jus a glow like peppa lite
Smile show yuh pretty dimple yuh teeth white
Yuh nah fi wear na me brand fi yuh look right
Fashion nova jeans grip di ass tight
Yuh pretty pon di gram
An yuh pretty inna real life

You a walking trophy
You a walking trophy
My girl you a walking trophy
You an yuh friends dem a walking trophy
Gal yuh know seh yuh pretty from yuh born
Walk out gal yuh nah try hard
Dem gal deh nuh pretty inna real life
Yuh pretty pon di gram
...

******* This Lyrics is NOT for Commercial use *******
(1409622095821)"
421,421,Barbie Dreams,6Poyf51k7W3NKnsGwAI90B,r-n-b,https://open.spotify.com/track/6Poyf51k7W3NKnsGwAI90B,Nicki Minaj,0hCNtLu0JehylgoiP8L4Gh,"['dance pop', 'hip pop', 'pop', 'pop rap', 'post-teen pop', 'queens hip hop']",2018-08-10,279866,65,0.85,0.787,8,-4.1339999999999995,0,0.33799999999999997,0.313,0.0,0.19399999999999998,0.7,87.98299999999999,279867,4,"Uh
R.I.P. to B.I.G.
Classic shit

I'm looking for a nigga to give some babies
A hand full of Weezy, sprinkle of Dave East
Man, I ain't got no type, like Jxmmi and Swae Lees
But if he can't fuck three times a night, peace
I tried to fuck 50 for a powerful hour
But all the nigga wanna do is talk Power for hours
B-beat the pussy up, make sure it's a K-O
Step your banks up like you're moving that ya-yo

Somebody go and make sure Karrueche okay though
I heard she think I'm tryna give the coochie to Quavo
They always wanna beat it up, goon up the pussy
Man, maybe I should let him autotune up the pussy
All these Bow Wow challenge niggas lying and shit
Man, these Fetty Wap niggas stay eyeing my shit
Drake worth a hundred milli, always buying me shit

But I don't know if the pussy wet or if he crying and shit
Meek still be in my DMs, I be having to duck him
""I used to pray for times like this""
Face ass when I fuck him
Man, Uzi is my baby, he ain't takin' an L
But he took it literally when I said, ""Go to hell""
Used to fuck with Young Thug, I ain't addressing this shit
C-caught him in my dressing room, stealing dresses and shit
I used to give this nigga with a lisp testers and shit
How you want the pu-thy? Can't say your S's and shit

Dreams of fucking one of these little rappers
I'm just playing, but I'm saying
Dreams of fucking one of these little rappers
I'm just playing, but I'm saying
Dreams of fucking one of these little rappers
I'm just playing, but I'm saying
Dreams of fucking one of these little rappers
I'm just playing, but I'm saying

...

******* This Lyrics is NOT for Commercial use *******
(1409622095821)"
422,422,Collide (feat. Tyga),0M8MPqaoGgkRjkG9kgZ3n4,r-n-b,https://open.spotify.com/track/0M8MPqaoGgkRjkG9kgZ3n4,"['Justine Skye', 'Tyga']","['0jUQSUOcM7lxVn5eVGTkzQ', '5LHRHt1k9lMyONurDHEdrp']","[['alternative r&b', 'chill r&b', 'indie r&b', 'pop', 'pop r&b', 'post-teen pop', 'r&b'], ['dance pop', 'hip hop', 'pop rap', 'rap', 'southern hip hop', 'trap']]",2014-08-25,260169,56,0.5710000000000001,0.309,11,-9.863999999999999,0,0.0565,0.0911,0.0,0.215,0.133,139.881,260170,4,"I been knowing you for long enough
Damn I need you right now
You can take your time, don't have to rush
This might take us a while, (yeah)
I left all the doors unlocked and you said you're on your way
When you get here don't just say a word, got no time to play

I know you think that you know me
But you ain't even see my dark side
This is for you only
So baby do me right, do me right

We can go all, the time
We can move fast, then rewind
When you put your body on mine
And collide, collide
It could be one of those nights
...

******* This Lyrics is NOT for Commercial use *******
(1409622095821)"
423,423,Say My Name,7H6ev70Weq6DdpZyyTmUXk,r-n-b,https://open.spotify.com/track/7H6ev70Weq6DdpZyyTmUXk,Destiny's Child,1Y8cdNmUJH7yBTd9yOvr5i,"['dance pop', 'girl group', 'hip pop', 'pop', 'r&b', 'urban contemporary']",1999-07-27,271333,76,0.713,0.6779999999999999,5,-3.525,0,0.102,0.273,0.0,0.149,0.7340000000000001,138.009,271333,4,"Say my name, say my name
If no one is around you, say, ""Baby I love you""
If you ain't runnin' game
Say my name, say my name
You acting kind of shady, ain't callin' me baby
Why the sudden change?
Say my name, say my name
If no one is around you, say, ""Baby I love you""
If you ain't runnin' game
Say my name, say my name
You acting kind of shady, ain't callin' me baby
Betta say my name

Any other day I would call, you would say
""Baby how's your day?"" But today it ain't the same
Every other word is ""Uh-huh"", ""Yeah okay""
Could it be that you are at the crib wit another lady?
If you took it there, first of all let me say
I am not the one to sit around and be played
So prove yourself to me, that I'm the girl that you cravin'
Why don't you say the things that you said to me yesterday?

I know you sayin' that I'm assuming things
Something's goin' down that's the way it seems
Shouldn't be no reason, why you're acting strange?
Nobody's holding you back from me
'Cause I know how you usually do
When you sayin' everything to me times two
Why can't you just tell the truth?
If somebody's there then tell me who

Say my name, say my name
If no one is around you, say, ""Baby I love you""
If you ain't runnin' game
Say my name, say my name
You acting kind of shady, ain't callin' me baby
Why the sudden change?
Say my name, say my name
If no one is around you, say, ""Baby I love you""
If you ain't runnin' game
...

******* This Lyrics is NOT for Commercial use *******
(1409622095821)"
424,424,Be Without You - Kendu Mix,2YegxR5As7BeQuVp2U6pek,r-n-b,https://open.spotify.com/track/2YegxR5As7BeQuVp2U6pek,Mary J. Blige,1XkoF8ryArs86LZvFOkbyr,"['dance pop', 'hip pop', 'neo soul', 'pop rap', 'r&b', 'urban contemporary']",2005-01-01,246333,55,0.7240000000000001,0.705,2,-5.859,0,0.11199999999999999,0.067,0.0,0.262,0.662,146.589,246333,4,"I wanna be with you, gotta be with you, need to be with you
(Oh, oh, oh, oh)
I wanna be with you, gotta be with you, need to be with you
(Oh, oh, oh, oh)
Oooo (oh, oh, oh, oh) oooo

Chemistry was crazy from the get-go
Neither one of us knew why
We didn't build nothing overnight
Cuz a love like this takes some time

People swore it off as a phase
Said we can't see that
Now from top to bottom

They see that we did that (yes)
It's so true that (yes)
We've been through it (yes)
We got real shit (yes)
See baby we been...

Too strong for too long (and I can't be without you baby)
And I'll be waiting up until you get home (cuz I can't sleep without you baby)
Anybody who's ever loved, ya know just what I feel
Too hard to fake it, nothing can replace it
Call the radio if you just can't be without your baby

...

******* This Lyrics is NOT for Commercial use *******
(1409622095821)"
425,425,Imagination,6ICb2Ew5SwF4gLk23OvYjB,r-n-b,https://open.spotify.com/track/6ICb2Ew5SwF4gLk23OvYjB,Eric Bellinger,7ibAWtDtmEfaVhc1FJ3Vl9,"['alternative r&b', 'dance pop', 'pop', 'pop r&b', 'pop rap', 'r&b', 'rap', 'urban contemporary']",2014-02-11,208531,45,0.461,0.344,7,-11.607000000000001,1,0.0526,0.7070000000000001,0.0,0.124,0.19699999999999998,119.90299999999999,208531,4,"Girl come through and let's do what we do in your imagination
When I'm gone, show me how you pretend
How do you bend your knees?
How do you arch your back?
How do you scream my name when we're in your imagination?

I know that you hate how much I be on the road
And how I be working late all night at the studio
I know you're a woman and I know you've got needs
But I know that you never, never sneak out on me

...

******* This Lyrics is NOT for Commercial use *******
(1409622095821)"
426,426,Neighbors Know My Name,6jvvpPJQJy5rMOEkLlADl6,r-n-b,https://open.spotify.com/track/6jvvpPJQJy5rMOEkLlADl6,Trey Songz,2iojnBLj0qIMiKPvVhLnsH,"['dance pop', 'hip pop', 'pop', 'post-teen pop', 'r&b', 'trap', 'urban contemporary']",2009-08-31,186306,58,0.6629999999999999,0.693,7,-5.776,0,0.0635,0.0379,0.0,0.162,0.391,120.02600000000001,186307,4,
427,427,Me & U,7k6IzwMGpxnRghE7YosnXT,r-n-b,https://open.spotify.com/track/7k6IzwMGpxnRghE7YosnXT,Cassie,27FGXRNruFoOdf1vP8dqcH,"['dance pop', 'hip pop', 'pop rap', 'post-teen pop', 'r&b', 'urban contemporary']",2006-08-07,192213,73,0.8029999999999999,0.45399999999999996,8,-4.802,0,0.0294,0.35200000000000004,0.0,0.0655,0.7390000000000001,99.99,192213,4,"Uh
Nextselection

You've been waiting so long
I'm here to answer your call
I know that I shouldn't have
Had you waiting at all
I've been so busy, but I've been thinking 'bout
What I wanna do with you

I know them other guys
They've been talking 'bout
The way I do what I do
They heard I was good
They wanna see if it's true
They know you're the one I wanna give it to
I can see you want me too
Now, it's me and you

It's me and you now
Uh, I've been waitin' (Waitin')
Think I wanna make that move now
Baby, tell me if you like it (Tell me if you like it)
It's me and you now
Uh, I've been waitin'
...

******* This Lyrics is NOT for Commercial use *******
(1409622095821)"
428,428,Always Be My Baby,2aBxt229cbLDOvtL7Xbb9x,r-n-b,https://open.spotify.com/track/2aBxt229cbLDOvtL7Xbb9x,Mariah Carey,4iHNK0tOyZPYnBU7nGAgpQ,"['dance pop', 'pop', 'r&b', 'urban contemporary']",1995-09-26,258133,72,0.65,0.531,4,-8.335,1,0.0364,0.457,0.0,0.249,0.48700000000000004,78.946,258133,4,"Do do doop dum
Do do doop do doop da dum
Do do doop dum
Do do doop do doop da dum
Do do doop do do do
Do do doop do doop da dum
Do do doop dum
Do do doop do doop da dum

We were as one, babe
For a moment in time
And it seemed everlasting
That you would always be mine
Now you want to be free
So I'm lettin' you fly
'Cause I know in my heart babe
Our love will never die

No you'll always be a part of me
I'm part of you indefinitely
Boy don't you know you can't escape me
Oh darlin' 'cause you'll always be my baby
And we'll linger on
Time can't erase a feelin' this strong
No way you're never gonna shake me
Oh darlin' cause you'll always be my baby

Do do doop
Do do doop do doop da dum
...

******* This Lyrics is NOT for Commercial use *******
(1409622095821)"
429,429,Close Enough,6gHQIxtN5UwHJlEaUjcViK,r-n-b,https://open.spotify.com/track/6gHQIxtN5UwHJlEaUjcViK,R.LUM.R,7JBZN2pehWRUu3fX11lP2y,['alternative r&b'],2017-07-14,167758,0,0.696,0.61,0,-7.462000000000001,1,0.0622,0.0279,0.000595,0.257,0.40299999999999997,99.98,167759,4,"Pretending to be myself
And I know that I'm somewhere else
All that's left is where you are
I've got a heart like a hotel
But you're the only clientele
Trashed the room, paid with my card

You come, you go
Whenever you please, whenever you need to
You stay cause you know it's hard for me to disagree with you

I wanna let you go but keep you close
I wanna quit you cold but overdose
I wanna mute you loud in stereo
...

******* This Lyrics is NOT for Commercial use *******
(1409622095821)"
430,430,Regret In Your Tears,0j8zLbIueSkVqB3Tl6PsjA,r-n-b,https://open.spotify.com/track/0j8zLbIueSkVqB3Tl6PsjA,Nicki Minaj,0hCNtLu0JehylgoiP8L4Gh,"['dance pop', 'hip pop', 'pop', 'pop rap', 'post-teen pop', 'queens hip hop']",2017-03-09,229573,49,0.77,0.47700000000000004,0,-10.972000000000001,0,0.0802,0.7490000000000001,0.20800000000000002,0.166,0.248,106.12799999999999,229573,4,"I just want the memories
I'm with you

Regret in your tears, now you taste 'em
'Cause you know I don't chase, I replace 'em
Don't rush, take time, take some
I just want the memories, tried to make some with you
You
Now I gotta erase some with you
You

Look at you now, stuck in the background
Silence right now sounds so loud
Tried to let you go, you come back 'round
Look at you now, stuck in the background
Two seats in my two seater-er-er
Used to pull off on me, leave me hurt
Tryna front, but I know you do your dirt
Not nice, boy you know you do your dirt

Regret in your tears, now you taste 'em
'Cause you know I don't chase, I replace 'em
Don't rush, take time, take some
I just want the memories, tried to make some with you
You
Now I gotta erase some with you
You

Baby now you know you got nerve
I know you just wanna be heard
...

******* This Lyrics is NOT for Commercial use *******
(1409622095821)"
431,431,(Lay Your Head On My) Pillow,0rRGYJSkI7v2VtxJv8n90m,r-n-b,https://open.spotify.com/track/0rRGYJSkI7v2VtxJv8n90m,Tony! Toni! Toné!,7vWlb4pM85jCHvV771qZZW,"['funk', 'hip pop', 'neo soul', 'new jack swing', 'quiet storm', 'r&b', 'soul', 'urban contemporary']",1993-01-01,372026,50,0.7070000000000001,0.48700000000000004,6,-8.948,0,0.036000000000000004,0.0466,4.71e-06,0.0643,0.568,79.071,372027,4,"Lay your head on my pillow
And just relax, relax, relax
('cause it was meant for you)
Lay your head on my pillow
And just relax, relax, relax
('cause it was made to groove)
Here we are in the room together

Holding hands and it's gonna get better
And I know that you're in the mood
So put your purse down and take off your jacket
Oh girl it's about to get nasty
...

******* This Lyrics is NOT for Commercial use *******
(1409622095821)"
432,432,Still Down,5uy3x8NcEg03jLdj7GecOz,r-n-b,https://open.spotify.com/track/5uy3x8NcEg03jLdj7GecOz,H.E.R.,3Y7RZ31TRPVadSFVy1o8os,"['alternative r&b', 'dance pop', 'pop', 'r&b']",2017-06-16,169133,34,0.429,0.39799999999999996,7,-12.424000000000001,0,0.13,0.6409999999999999,1.92e-05,0.0986,0.126,101.73100000000001,169133,4,"When you need the time, I won't have it
I'll try not to make it a habit
But I can't promise that
Wish I could do that
Cause you deserve
Actions and not words
And you know that I'm worth
Waiting for
While I'm out on tour

Tell me right now
Are you still down?
Are you still down?
Tell me right now
Are you still down? (Are you?)
...

******* This Lyrics is NOT for Commercial use *******
(1409622095821)"
433,433,Ride Wit Me,06iMqWThw4w8fTFyccvOwr,r-n-b,https://open.spotify.com/track/06iMqWThw4w8fTFyccvOwr,"['Nelly', 'City Spud']","['2gBjLmx6zQnFGQJCAQpRgw', '3L2SIGZah4QZSvN4wC8rHl']","[['dance pop', 'hip hop', 'pop rap', 'rap', 'southern hip hop', 'st louis rap', 'urban contemporary'], []]",2000-06-27,291781,0,0.8540000000000001,0.6920000000000001,7,-6.625,1,0.0479,0.0668,0.0,0.247,0.753,101.865,291782,4,"Where they at

If you want to go and take a ride with me
We 3-wheeling in the fo' with the gold D's
Oh why do I live this way? (Hey, must be the money!)

If you want to go and get high with me
Smoke a L in the back of the Benz-E
Oh why must I feel this way? (Hey, must be the money!)

In the club on the late night, feeling right
Looking, trying to spot something real nice
Looking for a little shorty I noticed so that I can take home
(I can take home)
She can be 18 (18) with an attitude
Or 19, kinda snotty, acting real rude
But as long as you a thicky-thicky-thick girl you know that it's on
(Know that it's on)
I peep something coming towards me on the dance floor
Sexy and real slow
Saying she was peeping and I dig the last video
""So when Nelly, can we go?"" How could I tell her no
Her measurements were 36-25-34
I like the way you brush your hair
And I like those stylish clothes you wear
I like the way the light hit the ice and glare
And I can see you, boo, from way over there

If you want to go and take a ride with me
We 3-wheeling in the fo' with the gold D's
Oh why do I live this way? (Hey, must be the money!)

If you want to go and get high with me
Smoke a L in the back of the Benz-E
Oh why must I feel this way? (Hey, must be the money!)

Face and body Frontenac, don't know how to act
Without no vouchers on her boots she's bringing nothing back
You should feel the impact, shop on plastic
When the sky's the limit and them haters can't get past that
...

******* This Lyrics is NOT for Commercial use *******
(1409622095821)"
