,Unnamed: 0,song_name,song_id,song_genre,url,artist,artist_id,artist_genre,release_date,duration_ms,popularity,danceability,energy,key,loudness,mode,speechiness,acousticness,instrumentalness,liveness,valence,tempo,duration_ms_,time_signature,lyrics
628,628,Bruk Off Yuh Back (feat. Chris Brown),4gKy5k5bhga2GFa7svTfbd,r-n-b,https://open.spotify.com/track/4gKy5k5bhga2GFa7svTfbd,"['Konshens', 'Chris Brown']","['3nwYsifpwrKmCIpw4i0HDW', '7bXgB6jMjp9ATFy66eO08Z']","[['dancehall', 'modern reggae'], ['dance pop', 'pop', 'pop rap', 'r&b', 'rap']]",2018-03-02,194583,53,0.58,0.748,7,-6.393,1,0.299,0.27399999999999997,0.0,0.127,0.9390000000000001,202.05200000000002,194583,4,lyrics not found
629,629,Sleeping With The One I Love,2C4WbJzwqzCFza9rhZ9S6M,r-n-b,https://open.spotify.com/track/2C4WbJzwqzCFza9rhZ9S6M,Fantasia,7xAcVHPiirnUqfdqo0USb1,"['dance pop', 'hip pop', 'neo soul', 'pop r&b', 'quiet storm', 'r&b', 'urban contemporary']",2016-07-29,303493,24,0.331,0.5670000000000001,10,-6.625,0,0.0756,0.348,0.0,0.166,0.424,65.547,303493,4,"I'm sleeping with the one I love
Said I'm sleeping with the one I love
Cause the one I'm with is good to me
He just ain't good enough, oh, oh, oh

I strive to do right but I'm doing so wrong
I'm living in this house but I can't call it home
He gives me what I want but it's not what I need
My mind is telling me to stay but my heart wants to leave

Said I'm sleeping, sleeping, sleeping with the one I love
Oh, because the one I'm with is good to me
But he just ain't good enough, oh

Yes, I've tried to shake it off, and I even tried to pray
But I'm still waking up in a bed that don't belong to me
See he offered me the Earth, but instead chose space
I found about the cost, but it's a price I'm willing to pay
...

******* This Lyrics is NOT for Commercial use *******
(1409622095821)"
630,630,7 Days,0gPQTLaqHDgdupKEok7J2x,r-n-b,https://open.spotify.com/track/0gPQTLaqHDgdupKEok7J2x,Craig David,2JyWXPbkqI5ZJa3gwqVa0c,"['british soul', 'dance pop', 'pop rap', 'r&b', 'urban contemporary']",2000-08-14,235133,70,0.659,0.812,4,-7.499,0,0.0487,0.23,0.0,0.0951,0.888,83.014,235133,4,"You know what?
Got something to say
Craig David
7 days
Check it out, yeah

On my way to see my friends
Who lived a couple blocks away from me (Oh)
As I walked through the subway
It must have been about quarter past three
In front of me
Stood a beautiful honey with a beautiful body
She asked me for the time
I said it'd cost her a name
A six digit number and a date with me tomorrow at nine

Did she decline? No
Didn't she mind? I don't think so
Was it for real? Damn sure
What was the deal? A pretty girl, age 24
So was she keen? She couldn't wait
Cinnamon queen? Let me update
What did she say?
She said she'd love to rendezvous
She asked me what we were gonna do
Said we'd start with a bottle of Moet for two

Monday
Took her for a drink on Tuesday
We were making love by Wednesday
And on Thursday and Friday and Saturday
We chilled on Sunday

...

******* This Lyrics is NOT for Commercial use *******
(1409622095821)"
631,631,Good Love,7FeDTQDPmRSftPQhOn43M8,r-n-b,https://open.spotify.com/track/7FeDTQDPmRSftPQhOn43M8,11:11,5gsyao2Qm21EKylbVIuRQ3,"['alternative r&b', 'canadian contemporary r&b', 'indie r&b', 'pop r&b', 'r&b', 'trap soul']",2017-06-13,263201,0,0.47,0.304,11,-9.271,0,0.0344,0.53,1.7100000000000002e-05,0.0828,0.33899999999999997,128.04,263202,4,"Do I ever cross your mind?
Even though I crossed the line?
Do you ever think 'bout me?

Yeah, I know we had good times
Baby, I was dumb and blind
To open my eyes and see...
Ooh yeah

There was good love, waiting for me
Too much, time and energy
On someone, that ain't you
Ooh woah

There was good love, waiting for me
Too much, time and energy
On someone, that ain't you
Woah

Do I ever cross your mind? (Cross your mind?)
...

******* This Lyrics is NOT for Commercial use *******
(1409622095821)"
632,632,"Touchin, Lovin (feat. Nicki Minaj)",3eqT34f3rxmm4dR7madDIM,r-n-b,https://open.spotify.com/track/3eqT34f3rxmm4dR7madDIM,"['Trey Songz', 'Nicki Minaj']","['2iojnBLj0qIMiKPvVhLnsH', '0hCNtLu0JehylgoiP8L4Gh']","[['dance pop', 'hip pop', 'pop', 'post-teen pop', 'r&b', 'trap', 'urban contemporary'], ['dance pop', 'hip pop', 'pop', 'pop rap', 'post-teen pop', 'queens hip hop']]",2014-07-02,221971,40,0.813,0.58,11,-6.724,1,0.0746,0.0405,8.45e-06,0.349,0.44299999999999995,100.045,221972,4,"Woo
Yeah,
Young Money
Trigga Trey
Let's get it
Burrr

No, I ain't tryna flex
No ceilings you can see who's in it
If we're talking about sex
Girl, you know that I invented that
And I'm onto the next
That's unless you bring a friend who with it

Oh, I'm sorry, oh you mad that I came to the party?
Like, no no no
You took your girl to the club and now she gone, gone, gone
Now she asking me when I'm taking her home, home, home
I tell her ""let's go"" long as you know
Cause I know when we get alone

...

******* This Lyrics is NOT for Commercial use *******
(1409622095821)"
633,633,SLAY (feat. Quavo),33NEAJosK5zyLY2D4OG7AE,r-n-b,https://open.spotify.com/track/33NEAJosK5zyLY2D4OG7AE,"['YG', 'Quavo']","['0A0FS04o6zMoto8OKPsDwY', '0VRj0yCOv2FXJNP47XQnx5']","[['cali rap', 'gangster rap', 'hip hop', 'pop rap', 'rap', 'southern hip hop', 'trap'], ['atl hip hop', 'hip hop', 'melodic rap', 'pop rap', 'rap', 'southern hip hop', 'trap']]",2018-08-03,284693,52,0.735,0.44,10,-7.647,0,0.0469,0.0682,0.0,0.33,0.239,87.985,284693,4,"I see you baby
Swear to God you don't go unnoticed
You killin' these bitches
You killin' these bitches
(Mustard on the beat hoe)
Ayy, it's YG, 4hunnid
It's YG, 4hunnid

One time if you a bad bitch (One time)
Two times just for the savage (Two time)
All you wanna do is just slay, yeah
All you wanna do is just slay, just slay
All you wanna do is just slay (Uh)
All you wanna do is just slay (Whoop)
Just slay
Aww yeah

Ayy, my bad for a bad bitch (One time)
Complement your swag with a bad bitch (One time)
I don't spend too much time without my savages
So I fuckin' bought the Rollies for my savages
In a four-door Bentley truck, just us
I treat it like a coupe, damn, what the fuck?
Walk in the club, savage to the front, savage to the back
Got my savages holdin' you-know-what
Bet you like the way I do it
I been talkin' all this shit, girl I'm tryna prove it (One time)
...

******* This Lyrics is NOT for Commercial use *******
(1409622095821)"
634,634,Addicted,3EtcFN5ZxXQYvUYWQGvKEo,r-n-b,https://open.spotify.com/track/3EtcFN5ZxXQYvUYWQGvKEo,VanJess,0Ek89uaJyo6NfWK22awFvI,"['alternative r&b', 'chill r&b', 'indie r&b', 'indie soul', 'pop r&b', 'r&b']",2018-07-27,297986,38,0.725,0.428,2,-9.435,0,0.145,0.43,0.0,0.149,0.376,105.025,297987,4,"I got what you need every season
Giving you the keys, you can keep 'em
Got me in your seat, pull me deeper
And every time we hit I'm addic-, I'm addicted
Rolling in your trees, I'ma feen out
Seeing everything I could dream 'bout
And no one's gonna bring what I need now
I'm waiting for the heat, don't you hold-, don't you hold out

Ooh you bring me out, you turn me to a heathen babe
Can't fake it now I'm calling for you daily
So take this crown, I'll be the throne
And put it down every type of way, yeah

I got what you need every season
Giving you the keys, you can keep 'em (keep em)
...

******* This Lyrics is NOT for Commercial use *******
(1409622095821)"
635,635,Party (feat. André 3000),42qh86p7TLXyumxSHn65kc,r-n-b,https://open.spotify.com/track/42qh86p7TLXyumxSHn65kc,"['Beyoncé', 'André 3000']","['6vWDO969PvNqNYHIOW5v0m', '74V3dE1a51skRkdII8y2C6']","[['dance pop', 'pop', 'post-teen pop', 'r&b'], ['atl hip hop', 'dirty south rap', 'southern hip hop']]",2011-06-24,245480,62,0.648,0.593,10,-6.267,1,0.0506,0.0188,0.0,0.16899999999999998,0.7120000000000001,160.97899999999998,245480,4,lyrics not found
636,636,Something About You,1y5g6vIm7KVdebf5bVyjWX,r-n-b,https://open.spotify.com/track/1y5g6vIm7KVdebf5bVyjWX,Majid Jordan,4HzKw8XcD0piJmDrrPRCYk,"['alternative r&b', 'canadian contemporary r&b', 'pop', 'r&b', 'trap soul']",2016-02-05,261792,49,0.575,0.6809999999999999,1,-8.15,0,0.127,0.0888,0.0,0.21899999999999997,0.23199999999999998,110.09100000000001,261793,4,"... About you (oh, oh, oh, oh)
Something about you (oh, oh, oh, oh, oh, oh, oh) about you
Something about you (oh, oh, oh)
About you, about you
Something about you, about you
There's something about you

You won't hit me up
I'm running out of luck
Talk to me like you mean it
Share with me all your secrets (something about you)
I'm not afraid of love (something about you)
Soon as you call me up
I can't help what I'm feeling
Something about you is different

The way the light lies on your face, when you look at me
And the silhouette of your shape when you dance with me
It's the way you move, it's the way you move
...

******* This Lyrics is NOT for Commercial use *******
(1409622095821)"
637,637,Fire We Make,5VIUVUvwHPM2vJaQpznd5W,r-n-b,https://open.spotify.com/track/5VIUVUvwHPM2vJaQpznd5W,"['Alicia Keys', 'Maxwell']","['3DiDSECUqqY1AuBP8qtaIa', '2AOt5htsbtyaHd5Eq3kl3j']","[['hip pop', 'neo soul', 'pop', 'r&b', 'urban contemporary'], ['funk', 'hip pop', 'neo soul', 'new jack swing', 'quiet storm', 'r&b', 'soul', 'urban contemporary']]",2012-11-26,321360,55,0.434,0.40299999999999997,10,-11.790999999999999,1,0.205,0.402,3.81e-06,0.0617,0.38299999999999995,67.363,321360,4,"Yeah, it's crazy, it's crazy, come on, come on
Yeaa hee hee, I wanna tell you really,
Oh yeah, wanna know yeah
I wanna know yeah

Hey baby how you doing tonight
I wanna let you know, I wanna tell just how I feel
Don't wanna love you baby and it's going so right
I wanna burn a candle, turn the darkness to the light
With the fire we make, it's getting hotter and hotter
Like a moth to a flame, I can't stay away
From the fire we make,
It's getting higher and higher
Like the night to the day
I can't stay away, no no no
...

******* This Lyrics is NOT for Commercial use *******
(1409622095821)"
638,638,Trust And Believe,7GpF0Bh1yvTUA0nyAAIfm5,r-n-b,https://open.spotify.com/track/7GpF0Bh1yvTUA0nyAAIfm5,Keyshia Cole,1vfezMIyCr4XUdYRaKIKi3,"['dance pop', 'hip pop', 'neo soul', 'pop', 'pop r&b', 'pop rap', 'r&b', 'urban contemporary']",2012-01-01,253386,45,0.353,0.562,0,-5.983,1,0.0907,0.0787,0.0,0.0591,0.11699999999999999,178.997,253387,3,"When we were together
I held you down
I gave you all of me
But look at us now
Thinking of all your excuses
But they don't add up
Now it's so easy to see
You don't deserve my love
You pushed me far
You brought me to this
You had my heart
But then you blew it

And I'm so over you
Go get lost
Boy who do you think that you are
Trust and believe me
You're gonna need me
Trust and believe me
She'll never be me
And I'm so over you
Go get lost
Boy I don't know, who do you think that you are?

...

******* This Lyrics is NOT for Commercial use *******
(1409622095821)"
639,639,Show Me (feat. Jeremih),7Fj8XxQUekUiPfgwX8hIIW,r-n-b,https://open.spotify.com/track/7Fj8XxQUekUiPfgwX8hIIW,"['Omarion', 'Jeremih']","['0f5nVCcR06GX8Qikz0COtT', '3KV3p5EY4AvKxOlhGHORLg']","[['dance pop', 'hip hop', 'hip pop', 'pop r&b', 'r&b', 'rap', 'southern hip hop', 'trap', 'urban contemporary'], ['chicago rap', 'dance pop', 'hip hop', 'pop', 'pop rap', 'r&b', 'southern hip hop', 'trap', 'urban contemporary']]",2014-12-02,234990,42,0.632,0.284,6,-15.34,1,0.124,0.4,1.39e-06,0.138,0.17,100.00299999999999,234990,4,"Seen you on Saturday in the taxi
But you ain't nothin' like the girls that you playin' with
No eye contact, keep me clocked in
Then I put you in my phone as my MAIN CHICK
I can tell btw, you the type to cook a nigga meal by the way
You the type to pay a nigga bill, by the way
Twerkin' it like you do a nigga real by the way

One hotel, five star suit
Sun goes down, but you're turning into a freak
Hundred bad bitches, all I see
It's you (you you you you)

Get me spontaneous and wrecking all the girls
'Cause I can't hit
When you on top and no me can't help but understand
When you get tip by a nigga that I be lookin' for a friend
With you keep it daily, and ya know we talk some of days weekly

...

******* This Lyrics is NOT for Commercial use *******
(1409622095821)"
640,640,Jukai,4dwNcnCoPnz1x83AWu1kAa,r-n-b,https://open.spotify.com/track/4dwNcnCoPnz1x83AWu1kAa,Jhené Aiko,5ZS223C6JyBfXasXxrRqOk,"['alternative r&b', 'dance pop', 'pop', 'pop rap', 'r&b', 'urban contemporary']",2017-09-22,256253,46,0.42200000000000004,0.369,11,-9.998,0,0.0303,0.898,0.0258,0.134,0.151,145.006,256253,4,"Oh I, oh I
Oh I, oh I
Oh I, oh I

If anyone should try and find me
Just know I'm where I wanna be
I left the house all clean and tidy
Don't come searchin', please
I've made my way down to the forest
Way down to the sea of trees (the sea of trees)
The eagle grows, it gets enormous
And then it has to bleed
All the way out
All the way out
On my way out
I found a way out
Up in a tree
Up in a tree
Could you believe it?
...

******* This Lyrics is NOT for Commercial use *******
(1409622095821)"
641,641,Maybe,7z5cJ9Z3Kwm9DazJp0kJ1P,r-n-b,https://open.spotify.com/track/7z5cJ9Z3Kwm9DazJp0kJ1P,"['Teyana Taylor', 'Pusha T', 'Yo Gotti']","['4ULO7IGI3M2bo0Ap7B9h8a', '0ONHkAv9pCAFxb0zJwDNTy', '6Ha4aES39QiVjR0L2lwuwq']","[['alternative r&b', 'dance pop', 'hip pop', 'neo soul', 'pop', 'pop r&b', 'pop rap', 'r&b', 'urban contemporary'], ['alternative hip hop', 'gangster rap', 'hip hop', 'pop rap', 'rap', 'southern hip hop', 'trap', 'underground hip hop', 'virginia hip hop'], ['dirty south rap', 'gangster rap', 'hip hop', 'memphis hip hop', 'pop rap', 'rap', 'southern hip hop', 'tennessee hip hop', 'trap']]",2014-11-04,245000,46,0.478,0.505,0,-7.635,1,0.298,0.647,0.0,0.161,0.369,131.642,245000,4,"Yuh, yuh, ay you know what it is, shawty
Maybe, maybe it's the money, baby, or maybe not
Maybe I fell in love with ya on the spot, never lie
I keep it G, I told you that there off the top
Maybe you never met a street nigga thuggin' on the block
And I ain't fuckin' with no thot shawty
Powerball, this your shot shawty
And if they hatin' let them talk, shawty
And I been drinking too much, and it got me thinking too much
You in my head what the fuck

I say boy you done did it
Love how you kiss it
Ooh you can get it
I never felt like that before
Ooh, you the realest
Yeah, I admit it
All in my feelings, damn

Had to pause, nigga wait a minute
Almost tapped out when you started swimmin'
A little cocky, I can deal with that
'Cause you put it down and I need lots of that
Just text your phone nigga where you at?
Give me rounds, I need all of that
Ain't even gotta knock, left the door unlocked
So is you tryna take it down or nah?
...

******* This Lyrics is NOT for Commercial use *******
(1409622095821)"
642,642,Can't Raise a Man,0vvKyFjX1hzSwpNtVwnJ2H,r-n-b,https://open.spotify.com/track/0vvKyFjX1hzSwpNtVwnJ2H,K. Michelle,2retT7MFwHDVTeGKDdybEx,"['dance pop', 'hip pop', 'neo soul', 'pop r&b', 'pop rap', 'post-teen pop', 'r&b', 'urban contemporary']",2013-08-05,208040,57,0.623,0.677,5,-5.215,1,0.0639,0.0233,0.0,0.0724,0.182,151.804,208040,4,
643,643,"Any Time, Any Place",2yOm4lN7aTygtXanJFNFWU,r-n-b,https://open.spotify.com/track/2yOm4lN7aTygtXanJFNFWU,Janet Jackson,4qwGe91Bz9K2T8jXTZ815W,"['dance pop', 'hip pop', 'neo soul', 'new jack swing', 'r&b', 'urban contemporary']",1993-05-18,428200,61,0.5710000000000001,0.23199999999999998,10,-11.309000000000001,1,0.0699,0.604,0.000246,0.11900000000000001,0.207,128.785,428200,4,"In the thundering rain
You stare into my eyes
I can feel your hand
Moving up my thighs
Skirt around my waist
Wall against my face
I can feel your lips

I don't wanna stop just because
People walking by are watching us
I don't give a damn what they think
I want you now
I don't wanna stop just because
You feel so good inside of my love
I'm not gonna stop no, no, no
I want you
All I wanna say is

Any time
...

******* This Lyrics is NOT for Commercial use *******
(1409622095821)"
644,644,Hello Ego,2kt06ZsD735FYBZO8yAAQs,r-n-b,https://open.spotify.com/track/2kt06ZsD735FYBZO8yAAQs,"['Jhené Aiko', 'Chris Brown']","['5ZS223C6JyBfXasXxrRqOk', '7bXgB6jMjp9ATFy66eO08Z']","[['alternative r&b', 'dance pop', 'pop', 'pop rap', 'r&b', 'urban contemporary'], ['dance pop', 'pop', 'pop rap', 'r&b', 'rap']]",2017-06-19,228133,51,0.528,0.466,0,-9.494,1,0.11699999999999999,0.157,0.0,0.22,0.41,119.135,228133,4,"Hi, Hello
Hi, Hi

I'ma be real, real, real, real, real, real honest
Man I got some real, real, real, real, real, real problems
I just do what I feel like, I don't deal with no logic
I need to chill, I really need to chill, I need to stop it
Need to stop it now, stop it now
And yeah, I know I'm supposed to be about my money
'Cause that baby gotta eat when she get hungry
And anything my family need they get it from me
So when shit get ugly

I can't stop, I won't stop, I don't
Don't stop, don't stop, don't stop, don't stop
Don't stop now
Ooh, you know I won't stop
Won't stop, won't stop, won't stop, won't stop
I don't know how
Don't stop now

I should stop drinking, I should stop smoking
I need to focus
I am the dopest, I'm the dopest
You already know this
Chosen, I've been chosen
And I know you noticed it
I got that potion, hocus pocus shit, yeah
'Cause I got these vic-good and verses
For all these bitches you hurt when
...

******* This Lyrics is NOT for Commercial use *******
(1409622095821)"
645,645,Kissin' You,1e5DTpM1WeggytDXbphivX,r-n-b,https://open.spotify.com/track/1e5DTpM1WeggytDXbphivX,Total,1urjDGTd4iBze91Z1W1gu7,"['hip hop', 'hip pop', 'neo soul', 'new jack swing', 'r&b', 'urban contemporary']",1996-01-30,282333,55,0.746,0.493,11,-9.427,0,0.0997,0.302,0.00957,0.109,0.878,82.04,282333,4,"Kissin' you is all that I been thinking of
Kissin' you is ooh, ooh

Don't matter who knows
I don't care who sees me
And thinking about you makes my life complete
And what I mean by that
That my whole world changes
You make me feel things that I never felt
I wanna kiss you

Kissin' you is all that I been thinking of
Kissin' you is ooh, ooh
Oh yeah, I wanna kiss you
Kissin' you is all that I been thinking of
Kissin' you is ooh, ooh

When I'm with my friends
I'm trying to figure out a way
To leave 'em behind just to get back to you
Oh, you're my best kept secret
And that's the way I like it
You're my pride and joy boy
That's why I'm dreaming of you
I wanna kiss you
...

******* This Lyrics is NOT for Commercial use *******
(1409622095821)"
646,646,Late Night Lover,1rfZBdkf4fCGvulu6boQTI,r-n-b,https://open.spotify.com/track/1rfZBdkf4fCGvulu6boQTI,Walter Beasley,6tBzJqpqRAPyJFR4Rq0yBP,"['jazz saxophone', 'smooth jazz', 'smooth saxophone']",2018-01-19,197013,30,0.715,0.662,5,-5.761,0,0.188,0.445,0.0,0.0813,0.626,87.904,197013,4,lyrics not found
647,647,Where Were You In The Morning?,376Gg7Oxo5C5jUWDWpVXeI,r-n-b,https://open.spotify.com/track/376Gg7Oxo5C5jUWDWpVXeI,Shawn Mendes,7n2wHs1TKAczGzO7Dd2rGr,"['canadian pop', 'dance pop', 'pop', 'post-teen pop', 'viral pop']",2018-05-25,200600,62,0.716,0.519,7,-7.472,1,0.0554,0.5539999999999999,0.0,0.0993,0.466,87.963,200600,4,"You said I want to get to know ya
Why you gotta get my hopes up?
You said that you were staying over
But then I woke up to the cold air

How could you make me believe
That there was something in between you and me, yeah?
I look around and I don't see you

Where were you in the morning, baby?
You didn't leave your number for me
Left me without a warning, baby
Where were you in the morning, baby?
How do you, how do you just walk away?
How do you, how do you just walk away?

And I thought you really felt this
When we were talking about breakfast
...

******* This Lyrics is NOT for Commercial use *******
(1409622095821)"
648,648,South of the River,5w3yxRRxy5pvZdUvBJF6ve,r-n-b,https://open.spotify.com/track/5w3yxRRxy5pvZdUvBJF6ve,Tom Misch,1uiEZYehlNivdK3iQyAbye,"['indie soul', 'jazz pop']",2018-04-06,269815,57,0.845,0.57,0,-8.441,1,0.0802,0.0957,0.414,0.0813,0.466,113.00299999999999,269815,4,"I want to stay South of the River
With the chains and the gold
We could be out here together
But, you have places to go

Watching the sunshine blaze the gray
I don't know why you wouldn't stay
...

******* This Lyrics is NOT for Commercial use *******
(1409622095821)"
649,649,Never Call Me (feat. YG) - Remix,2ZbvTTHaZIYu9XhnRO44mr,r-n-b,https://open.spotify.com/track/2ZbvTTHaZIYu9XhnRO44mr,"['Jhené Aiko', 'YG']","['5ZS223C6JyBfXasXxrRqOk', '0A0FS04o6zMoto8OKPsDwY']","[['alternative r&b', 'dance pop', 'pop', 'pop rap', 'r&b', 'urban contemporary'], ['cali rap', 'gangster rap', 'hip hop', 'pop rap', 'rap', 'southern hip hop', 'trap']]",2018-08-03,232240,52,0.595,0.419,2,-8.122,0,0.276,0.6940000000000001,0.0,0.12,0.33,120.14,232240,4,"Oh boy, I'ma have to call them boys on you
Oh damn, oh damn, I'ma have to call that man on you
Something, something, something must be really wrong with you
Why can't you just tell the fuckin' truth now?
Yes your mama did, she raised a fool, wow
What the fuck did you learn in that schoolhouse?
Chasing girls to chasin' thrills
Takin' pills in the hills,
Slauson Hills, Overhills might get you killed
And I won't come 'round them parts no more
Do not run your mouth no more
I can't protect you no more
It's out of my hands for sure

You should've called me
Why you never call me?
Why you never call me?
Oh, oh, oh, oh you should've called me
Why you never call me?
Why you never call me?
Oh, oh, oh, oh, oh

Okay, now you wanna say all that I done to ya
You knew all along that I wasn't the one for you
So let's stop pretending like we were in love
We never shared anything but the drugs
We were both numb, never had anything real between us
You really must
...

******* This Lyrics is NOT for Commercial use *******
(1409622095821)"
650,650,Bootylicious,31CsLSgn0HdZEVC8Bnnmvr,r-n-b,https://open.spotify.com/track/31CsLSgn0HdZEVC8Bnnmvr,Destiny's Child,1Y8cdNmUJH7yBTd9yOvr5i,"['dance pop', 'girl group', 'hip pop', 'pop', 'r&b', 'urban contemporary']",2001-05-01,207733,56,0.835,0.833,1,-4.364,0,0.284,0.00247,0.0,0.171,0.586,103.35799999999999,207733,4,"Kelly, can you handle this?
Michelle, can you handle this?
Beyoncé, can you handle this?
I don't think they can handle this

Better move, 'cuz we've arrived
Lookin' sexy, lookin' fly
The baddest chick, check this out
DJ, jam tonight
Spotted me, a tender thang
There you are, come on, baby
Don't you wanna dance with me?
Can you handle, handle me?

You gotta do much better
If you gon' dance with me tonight
You gotta work your jelly
If you gon' dance with me tonight
Read my lips carefully if you like what you see
Move, groove, prove you can hang with me
By the looks I got you shook up and scared of me
Buckle your seatbelt, it's time for takeoff

I don't think you're ready for this jelly
I don't think you're ready for this jelly
I don't think you're ready for this
'Cause my body too bootylicious for ya, babe
I don't think you're ready for this jelly
I don't think you're ready for this jelly
I don't think you're ready for this
...

******* This Lyrics is NOT for Commercial use *******
(1409622095821)"
651,651,"Slow Down - 12"" Version",3SfZpKjMwvUQKGCty1dJ0T,r-n-b,https://open.spotify.com/track/3SfZpKjMwvUQKGCty1dJ0T,Bobby V.,4HgF4KnohByNElYid7iCNb,"['hip hop', 'hip pop', 'new jack swing', 'pop r&b', 'pop rap', 'r&b', 'urban contemporary']",2005-01-01,258666,0,0.563,0.746,11,-4.832,0,0.10099999999999999,0.17,5.58e-06,0.33799999999999997,0.598,186.118,258667,4,"I saw you walking down on Melrose
You looked like an angel
Straight out of heaven, girl
I was blown away by your sexiness
All I have to do is catch up to you

Slow down I just wanna get to know you
But don't turn around
'Cause that pretty round thing looks good to me
Slow down never seen anything so lovely
Now turn around
And bless me with your beauty, cutie

A butterfly tattoo
Right above your navel
Your belly button's pierced too just like I like it girl
Come take a walk with me
You'll be impressed by
The game that I kick to you
It's over and for real...

Like a flower fully bloomed in the summertime, you're ready
To be watered by this conversation, you're ready
I'm in awe cause you shine like the Sun
Let me be the one to enjoy you (enjoy you)
...

******* This Lyrics is NOT for Commercial use *******
(1409622095821)"
652,652,Hypnotizing,0l1TQyZPwAJ9aOTUpUtMal,r-n-b,https://open.spotify.com/track/0l1TQyZPwAJ9aOTUpUtMal,Aaron Camper,6BX9j7UsymFKsVPpNy5PTP,[],2016-11-18,331560,29,0.319,0.626,11,-8.816,0,0.0925,0.868,6.14e-05,0.109,0.13699999999999998,139.886,331560,4,"Said she was coming to my hotel tonight
She just flew in on a flight
She got a new man at home
Because I can't treat her right
She
She said that I can't complain
Now that she doin' the same
Expensive tasting in wine
But need a shot on the side
She
She just a link line(link line)
Calling me up when she feel lonely (lonely)
Actin' like she don't be hating on me
Still trying to prove she the best for me
She'll cuss me out
Then turn around
Take off her blouse
Push me down on the couch
And then she'll turn the lights out
Take off my clothes that I'm wearing around
...

******* This Lyrics is NOT for Commercial use *******
(1409622095821)"
