,Unnamed: 0,song_name,song_id,song_genre,url,artist,artist_id,artist_genre,release_date,duration_ms,popularity,danceability,energy,key,loudness,mode,speechiness,acousticness,instrumentalness,liveness,valence,tempo,duration_ms_,time_signature,lyrics
195,195,Promise,1X1KDnhTnb28tpJlgOV3lD,r-n-b,https://open.spotify.com/track/1X1KDnhTnb28tpJlgOV3lD,Jagged Edge,7Aq8lpLMSt1Zxu56pe9bmp,"['atl hip hop', 'dance pop', 'hip hop', 'hip pop', 'neo soul', 'new jack swing', 'pop rap', 'quiet storm', 'r&b', 'southern hip hop', 'urban contemporary']",2000-01-18,246720,56,0.7509999999999999,0.568,5,-5.431,0,0.0872,0.136,0.0,0.0288,0.6459999999999999,128.002,246720,4,"Nothing is promised to me and you
So why will we let this thing go
Baby I promise that I'll stay true
Don't let nobody say it ain't so
And baby I promise
That I will never leave
And everything will be alright, I
I promise these things to you
Girl just believe
I promise

Should've known the things you said been right
Forever is such a very long time
We never even had a fight
Don't let no one change your mind
'Cause they don't know how much I care
They don't know the things we share unless they're here babe
But since they're not
How can they say that I'm not true, oh, oh, oh

If you need a love, I got the love that you need
Ain't no way they can take that from me
And I pray to God one day they will see
...

******* This Lyrics is NOT for Commercial use *******
(1409622095821)"
196,196,If I Ever Fall In Love,1jCsCYgzQQHk3bDJDuFbNi,r-n-b,https://open.spotify.com/track/1jCsCYgzQQHk3bDJDuFbNi,Shai,72y3ZI95ctkQC2O4mjBaU3,"['boy band', 'hip pop', 'new jack swing', 'quiet storm', 'r&b', 'urban contemporary']",1992-01-01,189026,56,0.402,0.205,6,-11.232000000000001,1,0.038,0.758,0.0,0.147,0.42,143.994,189027,4,"The very first time that I saw your brown eyes
Your lips said ""Hello"" and I said ""Hi""
I knew right then you were the one
But I was caught up
In physical attraction
But to my satisfaction
Baby, you were more than just a phase

And if I ever (Ever fall)
In love again (Again)
I will be sure that the lady is a friend
And if I ever (Ever fall)
In love so true (So true)
I will be sure that the lady's just like you

Oh, yeah, yeah, y-y-y-yeah
The very next time she'll be my friend
...

******* This Lyrics is NOT for Commercial use *******
(1409622095821)"
197,197,The First Night,5rWzxloNXvbRPhlC1O2b6T,r-n-b,https://open.spotify.com/track/5rWzxloNXvbRPhlC1O2b6T,Monica,6nzxy2wXs6tLgzEtqOkEi2,"['dance pop', 'hip hop', 'hip pop', 'neo soul', 'new jack swing', 'pop r&b', 'pop rap', 'quiet storm', 'r&b', 'urban contemporary']",1998-07-13,235573,48,0.6709999999999999,0.7659999999999999,1,-9.218,0,0.0634,0.139,0.0,0.26,0.9059999999999999,152.088,235573,4,"Baby, baby, tell me what's up
Can you hear me, or do I, do I need to turn it up, huh? Huh?
Baby, baby, tell me what's up
Can you hear me, or do I, do I need to turn it up, huh? What?
Baby, baby, tell me what's up
Can you hear me, or do I, do I need to turn it up, huh? Huh?
Baby, baby, tell me what's up
Can you hear me, or do I, do I need to turn it up, huh? What?

Boy, this evening, was it only me
Feeling completely down to be open
Down to be open for some satisfaction
Didn't wanna say yes, 'fraid of your reaction
I knew it was wrong for feeling this way
Especially the thought of giving in on the first date
Couldn't let go, it stayed on my mind
At the end of the night, I had to decide
I was thinkin'

I should make a move, but I won't (I should, I should)
I know you're probably thinkin' something is wrong
...

******* This Lyrics is NOT for Commercial use *******
(1409622095821)"
198,198,Options,32TWMnseTK5gEfQSN3LkWm,r-n-b,https://open.spotify.com/track/32TWMnseTK5gEfQSN3LkWm,Toni Romiti,0taUqKeI9JbGZECxu5bVV0,"['pop r&b', 'r&b', 'social media pop', 'trap queen']",2018-03-16,149613,47,0.7120000000000001,0.708,10,-7.334,1,0.0763,0.35200000000000004,0.0,0.12,0.6629999999999999,145.947,149613,4,"If you gotta choose between me and her
Then don't choose me
If you gotta choose between me and her
Then don't choose me

You got options
Well baby, I got options too
You got options
Well baby, I got options too
If you gotta choose

Look baby I never been an option
My L's are lessons, no I never take no losses
N- don't you forget that I made you poppin'
You heard I was a dog so baby just be cautious

Aye, if you wanna give it to her
You and I both know, she can't take my place
I ain't got no words for you
Glad I haven't heard from you
Hope I never see your face
...

******* This Lyrics is NOT for Commercial use *******
(1409622095821)"
199,199,Sexy,3WkUwJLIGSD9Azkekq2NJW,r-n-b,https://open.spotify.com/track/3WkUwJLIGSD9Azkekq2NJW,Tank,4mwXUEKaW4ftbncf9Hi58l,"['alternative r&b', 'pop r&b', 'r&b', 'urban contemporary']",2017-09-29,270823,39,0.331,0.578,6,-6.195,0,0.0942,0.307,0.00434,0.109,0.16,185.773,270824,5,"I been thinkin' bout'cha
Thinkin' bout you feel like foreplay
I'ma do whatever you say; Sexy
And without you, gone like 4 days
Don't know how much that I'm gon' take
If it's mine then baby don't play; Sexy, yeah

All I do is trip about the way you look
When you ain't got no makeup
Ooooon
Sexy
All I do is wish that it was me and you
And you ain't have to ever go
Hoooome
Sexy
Cuz I'ma need it in my life
Now babe I got a thirst to da real
Somethin' bout it feels so right
And I'm in love with how it make me feel
Can you tell me what it is you do
That be drivin' me so crazy
And can you tell me when you coming through
...

******* This Lyrics is NOT for Commercial use *******
(1409622095821)"
200,200,Lovers & Friends,22iOO39QpOuEE9Igz2PxyG,r-n-b,https://open.spotify.com/track/22iOO39QpOuEE9Igz2PxyG,"['Lil Jon', 'Eastside Boyz', 'Usher', 'Ludacris']","['7sfl4Xt5KmfyDs2T3SVSMK', '79Pqjevn76nsm1KiEgWuyS', '23zg3TcAtWQy7J6upgbUnj', '3ipn9JLAPI5GUEo4y4jcoi']","[['atl hip hop', 'crunk', 'dance pop', 'dirty south rap', 'pop rap', 'southern hip hop'], [], ['atl hip hop', 'dance pop', 'pop', 'r&b', 'south carolina hip hop', 'urban contemporary'], ['atl hip hop', 'dirty south rap', 'hip hop', 'pop rap', 'rap', 'southern hip hop', 'trap']]",2004-01-01,260613,0,0.569,0.49,10,-6.191,1,0.261,0.0625,0.0,0.46399999999999997,0.496,69.955,260613,4,"Usher (Lil Jon, Ludacris)
Yeah, man, once again it's on (It's on)
You know we had to do it again right?
(We had to do it again boy!)
Uh-huh, uh, yeah
(I want you to sing to these niggas man)
Uh-oh-oh-oh (I guess I'm up first, let me at 'em)
Uh-oh-oh-oh (Check me out, let's get it)

Baby, how you doing? Hope that you're fine
Wanna know what you got in mind, and I
Got me feenin' like Jodeci, girl, I can't leave you alone
Take a shot of this here Patron and it's gon' be on
V.I.P done got way too crowded
I'm about to end up callin' it a night
She should, holla at your girl, tell her that you're shaking the scene
Pulled off, beep beep, shotgun in the GT with me
She said, ""Oh-oh I'm ready to ride""
(I was like) Yeah
'Cause once you get inside, you can't change you mind
Don't mean to sound impatient but you gotta promise, baby, oh

Tell me again (Tell me again, my baby)
That we'll be lovers and friends (Oh, I gotta know baby, oh yeah)
Tell me again (Make sure you're right, oh, before we begin)
That we'll be lovers and friends (Oh, oh, it's a good look, baby)
(It's a really good look baby, look here)
...

******* This Lyrics is NOT for Commercial use *******
(1409622095821)"
201,201,Ocean (feat. Jacquees),2yI8omCrTAyrTcK7NRppu7,r-n-b,https://open.spotify.com/track/2yI8omCrTAyrTcK7NRppu7,"['TK Kravitz', 'Jacquees']","['65rDIPdQD7ijLSOq32cMXo', '4tMm1dU6Gn04VAZ9ClHcIZ']","[['pop r&b'], ['atl hip hop', 'dance pop', 'pop', 'pop r&b', 'pop rap', 'r&b', 'rap', 'urban contemporary']]",2018-06-22,219437,57,0.7090000000000001,0.264,1,-17.695999999999998,0,0.18600000000000003,0.268,0.0,0.24,0.341,133.858,219437,4,"I'm lying if I said I didn't want it
I can tell by your eyes that you focused
Come and hop on this pony
Can I dive in your ocean
Can I take a dive in your ocean
Can I take a dive in your ocean

I swear I'm drowing, yeah I'm drowing, yeah I'm drowing babe
You fuck me good and I mean good till I'm lazy babe
Never had no pussy like yours it got me crazy babe
It got me crazy babe

I'm in your ocean
It got me floating, it got you talking shit
It got me slapping on that ass like I'm owing it
And when I'm gone you call my phone and say I'm wrong for this
That pussy good
They might catch on to this

I'm in my zone for this
...

******* This Lyrics is NOT for Commercial use *******
(1409622095821)"
202,202,Blame It,08uGhvS5MfBk7crUCpnjva,r-n-b,https://open.spotify.com/track/08uGhvS5MfBk7crUCpnjva,"['Jamie Foxx', 'T-Pain']","['7LnaAXbDVIL75IVPnndf7w', '3aQeKQSyrW4qWr35idm0cy']","[['hip hop', 'hip pop', 'neo soul', 'pop rap', 'r&b', 'southern hip hop', 'urban contemporary'], ['dance pop', 'hip hop', 'pop', 'pop rap', 'r&b', 'rap', 'southern hip hop', 'urban contemporary']]",2008-12-11,289746,65,0.6729999999999999,0.614,7,-5.426,1,0.10300000000000001,0.0782,0.0,0.139,0.36200000000000004,176.05200000000002,289747,4,"Blame it on the goose
Got you feeling loose
Blame it on patron
Got you in the zone

Blame it on the a-a-a-a-a-alcohol
Blame it on the a-a-a-a-a-a-alcohol

Ay she say she usually don't
But I know that she front
Cause shawty know what she want
But she don't wanna seem
Like she easy
I ain't sayin what ya wont do
But you know we probably gon do
What you been feenin
Deep insi-i-i-ide
Don't li-i-i-ie now

Girl what you drinking?
Gon let sink in
Here for the weekend thinkin we can
See what we can be if we
Press fast forward
Just one more round
If you're down I'm for it
Fill another cup up
Feelin on yo butt what?

You don't even care now
I was unaware of how
Fine
You was before my buzz set
In my buzz set inn

Blame it on the goose
Got you feeling loose
Blame it on patron
Got you in the zone

Blame it on the a-a-a-a-a-alcohol
Blame it on the a-a-a-a-a-alcohol

Blame it on the vodka
Blame it on the henny
Blame it on the blue tap
Got you feeling dizzy

Blame it on the a-a-a-a-a-alcohol
Blame it on the a-a-a-a-a-a-alcohol

Oooo, see
She spilled some drank on me
...

******* This Lyrics is NOT for Commercial use *******
(1409622095821)"
203,203,Know,4xyoLXrUb0cpROQwZe1ggb,r-n-b,https://open.spotify.com/track/4xyoLXrUb0cpROQwZe1ggb,Syd,3jk39CGeaaSO3FPKNx1RUx,"['alternative r&b', 'chill r&b', 'indie r&b', 'indie soul', 'lgbtq+ hip hop', 'r&b']",2017-02-03,214706,40,0.496,0.65,5,-3.867,1,0.10300000000000001,0.254,8.68e-06,0.10099999999999999,0.551,134.9,214707,4,"Baby don't, let me go babe
Baby don't, don't say no babe
Can't nobody know, nobody, no
Keep it between us, can't let 'em see us
It'll be our secret, don't wanna get caught creeping
Is it really cheating, who says we're cheating

Don't let nobody know
Let's keep it on the low
And as long as he don't
Long as she don't
We'll lay back and play the game
And as long as he don't
Long as she don't
Ain't no need to play it safe

Here we are, all alone babe
If we had a little more time, I'd take it slow babe
...

******* This Lyrics is NOT for Commercial use *******
(1409622095821)"
204,204,Should've Been,27IbTtJDyvoezAn0aQWSMd,r-n-b,https://open.spotify.com/track/27IbTtJDyvoezAn0aQWSMd,Zonnique,2pWk5BYgN6HXwIHrZsA1YZ,['pop r&b'],2017-03-24,213124,28,0.643,0.53,3,-9.097000000000001,1,0.0505,0.0244,0.0,0.0837,0.187,120.035,213125,4,"Lately ive been tryna tell you bout me
What im going through
You dont never listen
You go do what you wanna do
And i aint tryna hear that
Im on one and u did that
And now im back on my get back shit
Lil bih
Worry who hittin it
Cause im riding round
And he gettin it
And now you at home missing this shit
Lil bih
A bitch feeling herself right now
Im going on
Going on
Hard for me to turn down
Should've been
Kissing and touching
And loving me right
UMM HMM
THAT RIGHT
You know just what i like
Should've been
Kissing and touching
And loving me right
Hell yea
That right
Cuz thats the shit i like
Should've been
Kissing and touching
And loving me right
UMM HMM
THAT RIGHT
You know just what i like
You know just what i like
Should've been
Kissing and touching
...

******* This Lyrics is NOT for Commercial use *******
(1409622095821)"
205,205,Love Faces,5rX60GiR64Epgri9Ubjzg9,r-n-b,https://open.spotify.com/track/5rX60GiR64Epgri9Ubjzg9,Trey Songz,2iojnBLj0qIMiKPvVhLnsH,"['dance pop', 'hip pop', 'pop', 'post-teen pop', 'r&b', 'trap', 'urban contemporary']",2010-09-13,243800,1,0.654,0.599,11,-6.699,1,0.0563,0.0599,0.0,0.161,0.33299999999999996,119.77799999999999,243800,4,
206,206,Let Me Know (feat. Future),7wA4XiTQOWByeF6DGWoxkt,r-n-b,https://open.spotify.com/track/7wA4XiTQOWByeF6DGWoxkt,"['Tamar Braxton', 'Future']","['1MT1Wz4G9Z9EVOg4L5zZMS', '1RyvyyTE3xzB2ZywiAwp0i']","[['dance pop', 'hip pop', 'neo soul', 'pop r&b', 'r&b', 'urban contemporary'], ['atl hip hop', 'pop rap', 'rap', 'southern hip hop', 'trap']]",2014-10-07,238653,48,0.55,0.667,2,-5.362,1,0.0346,0.0958,0.0,0.138,0.433,78.01899999999999,238653,4,"Do you feel it in your heart?
Do you, do you feel it?
Do you feel it? like I feel it?
Do you feel it in your soul?
Do you, do you feel it?
Do you feel it? like I feel it?
When you know when it's right
You don't let go
You don't let go
We've been through so many things
Ups and downs and in-betweens
If you mean for more love for me
I give you more, just let me know

It's like a love when you never tell somebody
Same love and put you through hell sometimes
You don't give it up to nobody when you love somebody
When you love somebody

And when it breaks your heart
...

******* This Lyrics is NOT for Commercial use *******
(1409622095821)"
207,207,Could've Been (feat. Bryson Tiller),6lzLjIOyWTyTJvk0jraYee,r-n-b,https://open.spotify.com/track/6lzLjIOyWTyTJvk0jraYee,"['H.E.R.', 'Bryson Tiller']","['3Y7RZ31TRPVadSFVy1o8os', '2EMAnMvWE2eb56ToJVfCWs']","[['alternative r&b', 'dance pop', 'pop', 'r&b'], ['kentucky hip hop', 'pop', 'pop rap', 'r&b', 'rap', 'trap']]",2018-08-03,248466,0,0.545,0.33,1,-11.719000000000001,0,0.16399999999999998,0.64,7.000000000000001e-06,0.22,0.39899999999999997,103.553,248467,4,lyrics not found
208,208,Anytime,2gQ3lDcFYa3yFOkaw8PtuO,r-n-b,https://open.spotify.com/track/2gQ3lDcFYa3yFOkaw8PtuO,Brian McKnight,6k0IBR0lU42s2GYpNX7kA9,"['dance pop', 'neo soul', 'new jack swing', 'quiet storm', 'r&b', 'urban contemporary']",1997-01-01,273438,54,0.747,0.44,6,-8.463,1,0.0314,0.0188,0.000817,0.0397,0.507,129.834,273438,4,"I can't remember why we fell apart
From something that was so meant to be
Forever was the promise in our hearts
Now more and more I wonder where you are
Do I ever cross your mind, anytime?
Do you ever wake up reaching out for me?
Do I ever cross your mind, anytime?
I miss you
Still have your picture in a frame
Hear your footsteps down the hall
I swear I hear your voice driving me insane
How I wish that you would call, to say
...

******* This Lyrics is NOT for Commercial use *******
(1409622095821)"
209,209,Am I Wrong (feat. ScHoolboy Q),1UjyF6okUHhnVxaLV8ojsA,r-n-b,https://open.spotify.com/track/1UjyF6okUHhnVxaLV8ojsA,"['Anderson .Paak', 'ScHoolboy Q']","['3jK9MiCrA42lLAdMGUZpwa', '5IcR3N7QB1j6KBL8eImZ8m']","[['escape room'], ['gangster rap', 'hip hop', 'pop rap', 'rap', 'southern hip hop', 'trap', 'underground hip hop']]",2016-01-15,253520,58,0.7290000000000001,0.799,11,-7.377999999999999,0,0.0779,0.0588,0.00218,0.0948,0.532,115.04,253520,4,"Well I
Well I, yeah

I'm only comin' out to play
Nothin' more that I hate in this life
The wrong impression, I only have one to make
You can open your palm, waiting to catch a break
The cards will fall where they may
And what about me?
I believe in fate, huh
They wanna know where I'll be in five, huh
What about today? What about tonight?

Only one at a time
So precious, is yours, is mine
Only one at a time
My life, my life, yeah

Am I wrong to assume
If she can't dance, then she can't ooh?
Am I wrong to say
...

******* This Lyrics is NOT for Commercial use *******
(1409622095821)"
210,210,Vault,70HkIp80HSqDJsXY1oUd1x,r-n-b,https://open.spotify.com/track/70HkIp80HSqDJsXY1oUd1x,Keyshia Cole,1vfezMIyCr4XUdYRaKIKi3,"['dance pop', 'hip pop', 'neo soul', 'pop', 'pop r&b', 'pop rap', 'r&b', 'urban contemporary']",2017-10-20,251386,29,0.552,0.307,11,-8.812000000000001,0,0.0285,0.49,0.0013599999999999999,0.111,0.0431,77.285,251387,4,"I know there's love in my vault
Only thing that I want is someone to want me, yeah
Put your ear to my thoughts
Only thing that I want is someone to hold me, hold me

You know my heart's been defeated
Yeah, it's beat to the core
Who'll be there for my healing
When I open that door?
Boy, don't play with my feelings
Just to fill in a void
Put your love in my safe
Oh, I'll keep it safe
...

******* This Lyrics is NOT for Commercial use *******
(1409622095821)"
211,211,Rock Wit U (Awww Baby),6pWzCKTrKrwbUPzY8RLCoP,r-n-b,https://open.spotify.com/track/6pWzCKTrKrwbUPzY8RLCoP,Ashanti,5rkVyNGXEgeUqKkB5ccK83,"['dance pop', 'hip hop', 'hip pop', 'pop', 'r&b', 'urban contemporary']",2003-01-01,209120,65,0.71,0.797,4,-3.0060000000000002,0,0.0582,0.408,0.0,0.16,0.8490000000000001,94.99799999999999,209120,4,"Aw baby (Aw baby)
Yeah, murda inc
I wanna love you babe
Hahahahhaha
Wanna love you babe, ooh baby
Ashanti, chapter two, let's rock it

Can you rock with me (Aw baby)
Non-stop with me
Can you take it to the top with me
I just wanna love you baby (Love ya babe)
Always thinking of you babe

Can you roll with me (Ooh baby)
All over me
Can you take control of me
I just wanna love you baby
Always thinking of you baby

I think I like how your body feel next to me
Aw baby when you kissing me, aw baby when you loving me
I can't describe what I want to do to you tonight
Aw baby when you come to me, I'll make it so you'll never leave

Can you rock with me (Aw baby)
Non-stop with me (Stop with me)
Can you take it to the top with me
I just wanna love you baby (Love ya babe)
Always thinking of you babe (Wanna love you babe)
...

******* This Lyrics is NOT for Commercial use *******
(1409622095821)"
212,212,Hey Daddy (Daddy's Home),14k416suPcOHMZ7HyGWtxh,r-n-b,https://open.spotify.com/track/14k416suPcOHMZ7HyGWtxh,Usher,23zg3TcAtWQy7J6upgbUnj,"['atl hip hop', 'dance pop', 'pop', 'r&b', 'south carolina hip hop', 'urban contemporary']",2010-03-29,224093,0,0.59,0.698,11,-4.262,1,0.0286,0.000176,0.0,0.107,0.35200000000000004,95.975,224093,4,"Usher, baby

I just wanna get your attention (Ay girl, ay girl)
I really wanna be all up in your head (Turn the lights on)
'Cause what I got, you gon' wanna get some, yeah
But girl, that's only if you ain't scared

And I won't knock, won't ring no bells
You just float bottom up in the air
I'll get you hot, I know you oh so well
And when I walk in, all that I wanna hear

Is you say, ""Daddy's home, home for me""
And I know you've been waiting for this lovin' all day
You know your daddy's home (Daddy's home)
And it's time to play (It's time to play)
So you ain't got to give my loving away
So all my ladies, say, hey, hey, hey, daddy
Hey, hey, hey daddy
So all my ladies, say, hey, hey, hey, daddy
Hey, hey, hey daddy

I ain't gotta do a lot of flexin'
...

******* This Lyrics is NOT for Commercial use *******
(1409622095821)"
213,213,Only Love,3ikWUJso9QP3frQKgBM03p,r-n-b,https://open.spotify.com/track/3ikWUJso9QP3frQKgBM03p,Mary J. Blige,1XkoF8ryArs86LZvFOkbyr,"['dance pop', 'hip pop', 'neo soul', 'pop rap', 'r&b', 'urban contemporary']",2018-07-12,226426,42,0.589,0.753,11,-5.807,0,0.10099999999999999,0.0238,0.0,0.0932,0.828,114.964,226427,4,"I remember when I was lost
Down for the count, was done
Yeah
No one around to pick me up
I was so over love
Till you came right in
And you brought me hope
I ain't never felt this feeling, oooh I'm in yeah

It's crazy
The way you've got the beat of my heart racing
Only love (only love!)
It will build you up
Break you down
Only love (only love)
I will sacrifice, for your heart I'll fight
All for love (Only love)
To your arms I'll run
'Cause I know you're mine
Only love (only love)
Can we share one soul
Make me whole
Only Love (only love)

I found a home, I'm not alone
...

******* This Lyrics is NOT for Commercial use *******
(1409622095821)"
214,214,Lost Souls (feat. DJ Scratch),0gcbRbAXm1T1labe7eeBFX,r-n-b,https://open.spotify.com/track/0gcbRbAXm1T1labe7eeBFX,"['H.E.R.', 'D.J. Scratch']","['3Y7RZ31TRPVadSFVy1o8os', '4NQ6S4R2Je5WEy8saflYPB']","[['alternative r&b', 'dance pop', 'pop', 'r&b'], []]",2018-08-03,152933,0,0.6970000000000001,0.794,7,-6.351,1,0.34299999999999997,0.142,0.0,0.109,0.823,94.93700000000001,152933,4,"Confusing self-conscious with self-confidence
Confusing self-conscious with self-confidence
Confusing self-conscious with self-confidence, uh, yeah

Confusing self-conscious with self-confidence
So you monogamous, but body positive
Post pills you swallowing for a following
What he got to offer? He don't see the kids that he fathering
If you won't bother then, why you responding then?
Careful where you plant them seeds before you water them
Say you empower women (Ayy)
But don't acknowledge them (Nah, nah)
Feminism not what you embodyin'
You false hope, you false positive, uh
But eat your fruit and drink your water then, uh

I don't clique up, I don't clique up, nah
I don't clique up, I don't clique up, that's why
I don't clique up, I don't clique up, ayy
...

******* This Lyrics is NOT for Commercial use *******
(1409622095821)"
215,215,Suffocate - Superclean,3nJjIYchBNkYm7B8XfJf5N,r-n-b,https://open.spotify.com/track/3nJjIYchBNkYm7B8XfJf5N,J. Holiday,7G6hXrjGpi6I7waNl4wxAk,"['bassline', 'hip pop', 'new jack swing', 'pop r&b', 'pop rap', 'r&b', 'urban contemporary']",2007-01-01,220053,57,0.45799999999999996,0.445,9,-8.391,0,0.361,0.64,0.0,0.11800000000000001,0.447,82.82,220053,5,lyrics not found
216,216,Ring (feat. Kehlani),5DfWF0jqMgZDCiu9zJENTA,r-n-b,https://open.spotify.com/track/5DfWF0jqMgZDCiu9zJENTA,"['Cardi B', 'Kehlani']","['4kYSro6naA4h99UJvo89HB', '0cGUm45nv7Z6M6qdXYQGTX']","[['dance pop', 'pop', 'pop rap', 'rap'], ['dance pop', 'pop', 'pop rap', 'post-teen pop', 'r&b']]",2018-04-06,177139,65,0.767,0.5429999999999999,1,-7.881,0,0.10300000000000001,0.049,0.0,0.115,0.485,106.029,177140,4,"Ooh, ooh
Ring, ring, ring, ring

You don't hit my line no more, oh, oh
You don't make it ring, ring, ring, ring
I can't keep this on the low
I want you to make it ring, ring, ring, ring

Should I call first? I can't decide
I want to, but a b- got pride
The switchin' up sh- is what I can't f- with
I'm feelin' you but you hard to get in touch with

And you ain't hit me up in a while
Actin' like you don't know what number to dial
You quit, then that's it, I'ma throw in the towel
'Cause a n- only gon' do what you allow

You don't want this gun smoke
Learn to text with your nose if your thumb broke
I don't care if we gettin' to it and I stall on your a-
But I still wake up to missed calls from your a-
...

******* This Lyrics is NOT for Commercial use *******
(1409622095821)"
217,217,Back & Forth,5bXLxmqFpKDPbbpkAa9m6V,r-n-b,https://open.spotify.com/track/5bXLxmqFpKDPbbpkAa9m6V,Aaliyah,0urTpYCsixqZwgNTkPJOJ4,"['dance pop', 'hip hop', 'hip pop', 'neo soul', 'pop', 'pop rap', 'r&b', 'urban contemporary']",1994-05-24,229400,37,0.7040000000000001,0.7240000000000001,5,-8.045,1,0.0313,0.0747,7.17e-06,0.125,0.894,92.928,229400,4,"Let me see you go back (Move, it's the L-I-Y-A-H)
Let me see you come forth
Now let me see you go back (Move, it's the L-I-Y-A-H)
Let me see you come forth
Uh, now let me see you go back (Move, it's the L-I-Y-A-H)
Let me see you come forth
Uh, let me see you go back (Move, it's the L-I-Y-A-H)
Let me see you come forth, yeah

It's Friday (Hey)
And I'm ready to swing, pick up my girls
And hit the party scene
Tonight, oh, it's alright, mhm
So get up and let this funky mellow grove get you in the mood
'Cause you know it's alright, yeah

(So Mr. DJ keep the music groovin')
Keep on groovin'
(Don't stop movin')
Don't stop movin'
Let me see you, let me see you go

Back, back, forth, and forth (Go back)
Let me see you go
Back, back, forth, and forth (Alright)
I wanna see you go
...

******* This Lyrics is NOT for Commercial use *******
(1409622095821)"
218,218,Nobody's Supposed to Be Here,4PBbgYOjKW0Urs0eppefpf,r-n-b,https://open.spotify.com/track/4PBbgYOjKW0Urs0eppefpf,Deborah Cox,601893mmW5hl1FBOykWZHG,"['canadian pop', 'hip pop', 'neo soul', 'new jack swing', 'quiet storm', 'r&b', 'urban contemporary', 'vocal house']",1998,262333,14,0.662,0.531,8,-5.3,1,0.0361,0.20199999999999999,1.1599999999999999e-05,0.595,0.39899999999999997,119.95700000000001,262333,4,"How did you get here? Nobody's supposed to be here
I've tried that love thing for the last time
My heart says no, no, nobody's supposed to be here
But you came along and changed my mind

I've spent all my life on a search to find
The love who'll stay for eternity
The heaven sent to fulfill my needs
But when I turn around
Again love has knocked me down
My heart got broken oh, it hurt so bad
I'm sad to say, ""Love wins again""

So I placed my heart under lock and key
To take some time and take care of me
...

******* This Lyrics is NOT for Commercial use *******
(1409622095821)"
219,219,Down for You (feat. BJ The Chicago Kid),6DkmFhzJrkVhDlcgcEy7Pc,r-n-b,https://open.spotify.com/track/6DkmFhzJrkVhDlcgcEy7Pc,"['Kehlani', 'BJ The Chicago Kid']","['0cGUm45nv7Z6M6qdXYQGTX', '07d5etnpjriczFBB8pxmRe']","[['dance pop', 'pop', 'pop rap', 'post-teen pop', 'r&b'], ['alternative r&b', 'chicago rap', 'hip hop', 'indie r&b', 'indie soul', 'neo soul', 'pop r&b', 'r&b', 'underground hip hop']]",2015-04-28,227754,49,0.479,0.711,6,-4.977,0,0.23600000000000002,0.456,0.0,0.215,0.34700000000000003,79.54,227755,5,
