,Unnamed: 0,song_name,song_id,song_genre,url,artist,artist_id,artist_genre,release_date,duration_ms,popularity,danceability,energy,key,loudness,mode,speechiness,acousticness,instrumentalness,liveness,valence,tempo,duration_ms_,time_signature,lyrics
489,489,Red Cold River,6ZfPmIbwzz6fopTNwAJTPs,rock,https://open.spotify.com/track/6ZfPmIbwzz6fopTNwAJTPs,Breaking Benjamin,5BtHciL0e0zOP7prIHn3pP,"['alternative metal', 'nu metal', 'post-grunge']",2018-04-13,200906,59,0.376,0.9670000000000001,3,-3.2769999999999997,0,0.166,0.000248,2.64e-06,0.0575,0.226,91.58200000000001,200907,4,"Days reborn
Fight with folded hands
Pain left below
The lifeless live again

Run, run, run
Red cold river
Run, run, run
Red cold river

I can't feel anything at all
This life has left me cold and damned
I can't feel anything at all
...

******* This Lyrics is NOT for Commercial use *******
(1409622095821)"
490,490,Is There Anybody out There?,25xREK7GqfuUWvqEumOVK3,rock,https://open.spotify.com/track/25xREK7GqfuUWvqEumOVK3,Machine Head,0lVlNsuGaOr9vMHCZIAKMt,"['alternative metal', 'groove metal', 'hard rock', 'industrial metal', 'melodic groove metal', 'melodic metalcore', 'metal', 'nu metal', 'progressive groove metal', 'rap rock', 'rock']",2016-06-03,272665,0,0.408,0.953,7,-3.883,1,0.226,0.00532,0.0,0.33799999999999997,0.29100000000000004,177.94,272666,4,"Is There Anybody Out There
Is There Anybody Out There
Is There Anybody Out There
Is There Anybody Out There

I was born as a bastard, no father, no master,
A shadow in silence left searching for answers
Put up for adoption and left with no option
Another kid fostered to fester forgotten
Take a look into these desperate eyes
As they're cast into the wretched hive
But I ain't going down alone

Is there anybody out there?
Anybody listening to me?
Is anybody else scared?
The paranoia, drops me to my knees
Does anybody feel lonely?
Disconnected from the things I see
Is there anybody out there?
Anybody out there just like me?
I'm choking on these words and I can't breathe

...

******* This Lyrics is NOT for Commercial use *******
(1409622095821)"
491,491,(I Can't Get No) Satisfaction - Mono Version,2PzU4IB8Dr6mxV3lHuaG34,rock,https://open.spotify.com/track/2PzU4IB8Dr6mxV3lHuaG34,The Rolling Stones,22bE4uQ6baNwSHPVcDxLCe,"['british invasion', 'classic rock', 'rock']",1965-07-30,222813,77,0.723,0.863,2,-7.89,1,0.0338,0.0383,0.0317,0.128,0.9309999999999999,136.30200000000002,222813,4,"I can't get no satisfaction
I can't get no satisfaction
'Cause I try and I try and I try and I try
I can't get no, I can't get no

When I'm drivin' in my car
And the man comes on the radio
He's tellin' me more and more
About some useless information
Supposed to fire my imagination

I can't get no, oh, no, no, no
Hey, hey, hey, that's what I say

I can't get no satisfaction
I can't get no satisfaction
...

******* This Lyrics is NOT for Commercial use *******
(1409622095821)"
492,492,Du hast,1dS1SUD3vr0McKwez9MqAY,rock,https://open.spotify.com/track/1dS1SUD3vr0McKwez9MqAY,Rammstein,6wWVKhxIU2cEi0K81v7HvP,"['alternative metal', 'german metal', 'industrial', 'industrial metal', 'industrial rock', 'neue deutsche harte', 'nu metal']",1997-08-25,234226,0,0.638,0.9179999999999999,9,-6.294,0,0.0385,0.004370000000000001,0.0706,0.331,0.723,125.066,234227,4,"Du
Du hast
Du hast mich

Du
Du hast
Du hast mich

Du
Du hast
Du hast mich

Du
Du hast
Du hast mich

Du
Du hast
Du hast mich
Du hast mich
Du hast mich gefragt
...

******* This Lyrics is NOT for Commercial use *******
(1409622095821)"
493,493,Black,5Xak5fmy089t0FYmh3VJiY,rock,https://open.spotify.com/track/5Xak5fmy089t0FYmh3VJiY,Pearl Jam,1w5Kfo2jwwIPruYS2UWh56,"['alternative rock', 'grunge', 'permanent wave', 'pop rock', 'rock']",1991-08-27,342653,73,0.36,0.684,4,-6.457000000000001,0,0.0308,0.32299999999999995,0.0,0.34,0.2,77.15,342653,4,"Hey, hey, yeah, uh

Sheets of empty canvas, untouched sheets of clay
Were laid spread out before me as her body once did
All five horizons revolved around her soul, as the earth to the sun
Now the air I tasted and breathed has taken a turn, ooh

Ooh, and all I taught her was everything
Ooh, I know she gave me all that she wore
And now my bitter hands chafe beneath the clouds
Of what was everything
...

******* This Lyrics is NOT for Commercial use *******
(1409622095821)"
494,494,Alive - Chris Lord-Alge Mix,1X4Ntw6Lbaa1ACgilCqMpr,rock,https://open.spotify.com/track/1X4Ntw6Lbaa1ACgilCqMpr,P.O.D.,6KO6G41BBLTDNYOLefWTMU,"['alternative metal', 'funk metal', 'nu metal', 'rap metal', 'rap rock']",2001-09-11,205026,62,0.42100000000000004,0.95,10,-3.985,1,0.0768,1.21e-05,0.00021400000000000002,0.314,0.5529999999999999,80.91199999999999,205027,4,
495,495,Money for Nothing,4yqtwO7MQIIXqoiRBPHAgR,rock,https://open.spotify.com/track/4yqtwO7MQIIXqoiRBPHAgR,Dire Straits,0WwSkZ7LtFUFjGjMZBMt6T,"['album rock', 'classic rock', 'mellow gold', 'rock', 'soft rock']",1985-05-13,506400,64,0.667,0.655,2,-9.339,0,0.0367,0.0491,0.0008939999999999999,0.0641,0.657,134.21200000000002,506400,4,"I want my
I want my, I want my MTV
I want my, I want my MTV
I want my, I want my MTV

Now look at them yo-yos, that's the way you do it
You play the guitar on the MTV
That ain't workin', that's the way you do it
Money for nothin' and your chicks for free

Now that ain't workin', that's the way you do it
Lemme tell ya, them guys ain't dumb
Maybe get a blister on your little finger
Baby, get a blister on your thumb

We gotta install microwave ovens
Custom kitchen deliveries
We've got to move these refrigerators
We've got to move these colour TVs

See the little faggot with the earring and the makeup
Yeah buddy, that's his own real hair
The little faggot got his own jet airplane
The little faggot, he's a millionaire

We gotta install microwave ovens
Custom kitchen deliveries
We've got to move these refrigerators
We've got to move these colour TVs

Got to install microwave ovens
Custom kitchen deliveries
...

******* This Lyrics is NOT for Commercial use *******
(1409622095821)"
496,496,Nothing Else Matters,0nLiqZ6A27jJri2VCalIUs,rock,https://open.spotify.com/track/0nLiqZ6A27jJri2VCalIUs,Metallica,2ye2Wgw4gimLv2eAKyk1NB,"['hard rock', 'metal', 'old school thrash', 'rock', 'thrash metal']",1991-08-12,388266,79,0.5529999999999999,0.36200000000000004,4,-11.218,0,0.0263,0.0458,6.01e-06,0.075,0.158,142.352,388267,3,"So close no matter how far
Couldn't be much more from the heart
Forever trusting who we are
And nothing else matters

Never opened myself this way
Life is ours, we live it our way
All these words I don't just say
And nothing else matters

Trust I seek and I find in you
Every day for us something new
Open mind for a different view
And nothing else matters

Never cared for what they do
...

******* This Lyrics is NOT for Commercial use *******
(1409622095821)"
497,497,Beast Of Burden - Remastered 1994,77oU2rjC5XbjQfNe3bD6so,rock,https://open.spotify.com/track/77oU2rjC5XbjQfNe3bD6so,The Rolling Stones,22bE4uQ6baNwSHPVcDxLCe,"['british invasion', 'classic rock', 'rock']",1978-06-09,265173,73,0.7829999999999999,0.878,1,-3.864,0,0.0308,0.39,0.000778,0.0426,0.885,100.626,265173,4,"I'll never be your beast of burden
My back is broad, but it's hurting
All I want, for you to make love to me

I'll never be your beast of burden
I've walked for miles, my feet are hurting
All I want, for you to make love to me

Am I hard enough?
Am I rough enough?
Am I rich enough?
I'm not too blind to see

I'll never be your beast of burden
So let's go home and draw the curtains
Music on the radio, come on, baby, sweet love to me

Am I hard enough?
Am I rough enough?
Am I rich enough?
I'm not too blind to see

...

******* This Lyrics is NOT for Commercial use *******
(1409622095821)"
498,498,Re-Education (Through Labor),6c1Bdvp208X0jbLmFnWbkC,rock,https://open.spotify.com/track/6c1Bdvp208X0jbLmFnWbkC,Rise Against,6Wr3hh341P84m3EI8qdn9O,"['chicago hardcore', 'chicago punk', 'hardcore punk', 'pop punk', 'punk']",2008-01-01,222453,61,0.243,0.9470000000000001,11,-3.388,1,0.102,0.000417,3.41e-05,0.133,0.33799999999999997,147.586,222453,4,"To the sound of a heartbeat pounding away
To the rhythym of the awful, rusting machines
We toss and turn but don't sleep
Each breath we take makes us thieves
Like causes without rebels
Just talk but promise nothing else

We crawl on our knees for you
Under a sky no longer blue
We sweat all day long for you
But we sow seeds to see us through
'Cause sometimes dreams just don't come true
We wait to reap what we are due

To the rhythm of a timebomb ticking away
And the blare of the sirens combing the streets
...

******* This Lyrics is NOT for Commercial use *******
(1409622095821)"
499,499,Absolute Zero,14EORgkbXqIx5K4Haucmnb,rock,https://open.spotify.com/track/14EORgkbXqIx5K4Haucmnb,Stone Sour,49qiE8dj4JuNdpYGRPdKbF,"['alternative metal', 'nu metal', 'post-grunge', 'rap rock', 'rock']",2012-10-17,229840,67,0.552,0.988,1,-2.555,0,0.0787,0.00010800000000000001,0.309,0.846,0.619,139.941,229840,4,"The bloody angle, the symmetry
Your cheap adhesive isn't holding me
My mouth is a gun I can shoot
I can show you the truth
And I don't need a reason to lie to you

No pun intended, no punishment
If I offended you, you needed it!
Ideas are the bombs in your mind
A fissure in time
If you don't have a weapon
You can't have mine!

I can bleed if I wanna bleed
I can fail if I feel the need
This face, it's my last confession
This life, it feels like a prison

Ooh hoo, I'm not afraid!
I'm giving into grievances again
...

******* This Lyrics is NOT for Commercial use *******
(1409622095821)"
500,500,Right Here,6S7mmHgyWOG6pIYuL4YrfQ,rock,https://open.spotify.com/track/6S7mmHgyWOG6pIYuL4YrfQ,Staind,5KDIH2gF0VpelTqyQS7udb,"['alternative metal', 'nu metal', 'post-grunge', 'rap rock', 'rock']",2005-08-08,253933,59,0.49200000000000005,0.6459999999999999,10,-5.334,0,0.0303,0.0013599999999999999,2.2100000000000002e-05,0.121,0.214,112.228,253933,4,"I know I've been mistaken
But just give me a break and see the changes that I've made
I've got some imperfections
But how can you collect them all and throw them in my face?

But you always find a way
To keep me right here waiting
You always find the words to say
To keep me right here waiting
And if you chose to walk away
I'd still be right here waiting
Searching for the things to say
To keep you right here waiting

I hope you're not intending
To be so condescending it's as much as I can take
...

******* This Lyrics is NOT for Commercial use *******
(1409622095821)"
501,501,Over You,2R5uY1gbIKzGB1yAOH067s,rock,https://open.spotify.com/track/2R5uY1gbIKzGB1yAOH067s,Daughtry,5P5FTygHyx2G57oszR3Wot,"['alternative metal', 'neo mellow', 'pop rock', 'post-grunge']",2006,204853,58,0.425,0.922,3,-2.6,1,0.0412,0.0174,0.0,0.10400000000000001,0.564,156.045,204661,4,"Now that it's all said and done
I can't believe you were the one
To build me up and tear me down
Like an old abandoned house
And what you said when you left
Just left me cold and out of breath
I fell too far, was in way too deep
Guess I let you get the best of me

Well, I never saw it coming
I should've started running
A long long time ago
And I never thought to doubt you, I'm better off without you
More than you, more than you know
I'm slowly getting closure, I guess it's really over
I'm finally getting better
And now I'm picking up the pieces and spending all of these years
Putting my heart back together 'cause
The day I thought I'd never get through
I got over you
...

******* This Lyrics is NOT for Commercial use *******
(1409622095821)"
502,502,I Don't Love You,05eWggqE1dGTn8HcB9GeOY,rock,https://open.spotify.com/track/05eWggqE1dGTn8HcB9GeOY,Moose Blood,5fEKZRCUa0JApec5Xy095q,"['alternative emo', 'anthem emo', 'emo', 'kent indie', 'modern alternative rock']",2017-05-19,231771,0,0.319,0.401,0,-18.908,1,0.0326,0.00015,0.0,0.149,0.253,174.78599999999997,231771,4,"Well, when you go
Don't ever think I'll make you try to stay
And maybe when you get back
I'll be off to find another way

And after all this time that you still owe
You're still the good-for-nothing I don't know
So take your gloves and get out
Better get out
While you can

When you go
Would you even turn to say
I don't love you
Like I did
Yesterday
...

******* This Lyrics is NOT for Commercial use *******
(1409622095821)"
503,503,Run To You,0HqNyWt20oyqntGSOf4lY9,rock,https://open.spotify.com/track/0HqNyWt20oyqntGSOf4lY9,Bryan Adams,3Z02hBLubJxuFJfhacLSDc,"['album rock', 'canadian pop', 'canadian singer-songwriter', 'classic canadian rock', 'heartland rock', 'mellow gold', 'pop rock', 'rock', 'soft rock']",1984-01-01,233440,36,0.5670000000000001,0.6629999999999999,4,-11.725,1,0.0272,0.0027300000000000002,1.7e-05,0.215,0.648,126.476,233440,4,"She says her love for me could never die
But that'd change if she ever found out about you and I

Oh, but her love is cold
Wouldn't hurt her if she didn't know, cause
When it gets too much
I need to feel your touch

I'm gonna run to you
I'm gonna run to you
Cause when the feeling's right I'm gonna run all night
I'm gonna run to you

She's got a heart of gold, she'd never let me down
But you're the one that always turns me on
...

******* This Lyrics is NOT for Commercial use *******
(1409622095821)"
504,504,"""99""",6YQUuoMnRIMaOmouYoMfQr,rock,https://open.spotify.com/track/6YQUuoMnRIMaOmouYoMfQr,Barns Courtney,5tFRohaO5yEsuJxmMnlCO9,"['modern alternative rock', 'modern rock', 'rock']",2018-08-24,199413,54,0.552,0.804,8,-4.2989999999999995,1,0.0303,0.00598,0.0,0.111,0.7140000000000001,95.98,199413,4,"Hot, strong, young and dumb
Yeah, we had no fear
Way back when we said
We'd both be millionaires
Now those days are over
And we are all ghosts

We used to sleep all day and talk all night
Stay up by the TV light (oh, oh)
When your baby teeth ain't milky white
Wipe the stardust from your eyes (oh, oh)
I said ""Oh come on love, we'll be just fine
We're gonna live just like it's 1999""

In 1990
In 1999
In 1990
In 1999

...

******* This Lyrics is NOT for Commercial use *******
(1409622095821)"
505,505,Even Flow,6QewNVIDKdSl8Y3ycuHIei,rock,https://open.spotify.com/track/6QewNVIDKdSl8Y3ycuHIei,Pearl Jam,1w5Kfo2jwwIPruYS2UWh56,"['alternative rock', 'grunge', 'permanent wave', 'pop rock', 'rock']",1991-08-27,292580,74,0.39399999999999996,0.9440000000000001,10,-6.506,0,0.0761,0.0017800000000000001,4.54e-06,0.298,0.265,105.338,292581,4,"Freezin'
Rests his head on a pillow made of concrete again
Oh, feelin'
Maybe he'll see a little betters, any days

Oh, hand out
Faces that he sees time again ain't that familiar
Oh, dark grin
He can't help, when he's happy, he looks insane

Even flow, thoughts arrive like butterflies
Oh, he don't know, so he chases them away
Oh, someday yet he'll begin his life again
...

******* This Lyrics is NOT for Commercial use *******
(1409622095821)"
506,506,Higher,1ZozJfi8u9cO2Ob8KwiwNT,rock,https://open.spotify.com/track/1ZozJfi8u9cO2Ob8KwiwNT,Creed,43sZBwHjahUvgbx1WNIkIz,"['alternative metal', 'nu metal', 'pop rock', 'post-grunge', 'rock']",1999-01-01,316733,70,0.45899999999999996,0.83,2,-6.254,1,0.0364,5.15e-05,0.00014,0.20600000000000002,0.431,155.827,316733,4,"When dreaming
I'm guided to another world
Time and time again

At sunrise, I fight to stay asleep
'Cause I don't want to leave the comfort of this place
'Cause there's a hunger, a longing to escape

From the life I live when I'm awake
So let's go there
Let's make our escape
Come on, let's go there
Let's ask can we stay

Can you take me higher
To a place where blind men see
Can you take me higher
To a place with golden streets

Although I would like our world to change
It helps me to appreciate
...

******* This Lyrics is NOT for Commercial use *******
(1409622095821)"
507,507,Come Out And Play (Keep ‘Em Separated),0Yb5Kfpf3boElZNa61wPdJ,rock,https://open.spotify.com/track/0Yb5Kfpf3boElZNa61wPdJ,The Offspring,5LfGQac0EIXyAN8aUwmNAQ,"['alternative metal', 'permanent wave', 'punk', 'rock', 'skate punk', 'socal pop punk']",2005-06-21,197800,35,0.48100000000000004,0.856,7,-3.764,1,0.162,0.0535,6.75e-06,0.0847,0.847,158.405,197800,4,"You gotta keep 'em separated

Like the latest fashion
Like a spreading disease
The kids are strappin' on their way to the classroom
Getting weapons with the greatest of ease
The gangs stake out their own campus locale
And if they catch you slippin' then it's all over pal
If one guy's colors and the other's don't mix
They're gonna bash it up, bash it up, bash it up, bash it up

Hey, man you talkin' back to me?
Take him out (you gotta keep 'em separated)
Hey, man you disrespecting me?
Take him out (you gotta keep 'em separated)
Hey, they don't pay no mind
...

******* This Lyrics is NOT for Commercial use *******
(1409622095821)"
508,508,Breaking Point,4uUQRXBBqtUNstHF4q5L4u,rock,https://open.spotify.com/track/4uUQRXBBqtUNstHF4q5L4u,Dead by April,2otRZcOVNcmdkZ5nEoogy6,"['alternative metal', 'melodic metalcore', 'metalcore', 'swedish metalcore', 'trancecore']",2017-04-07,228666,42,0.36200000000000004,0.9229999999999999,4,-4.685,0,0.237,9.76e-05,0.138,0.185,0.303,147.466,228667,4,"My breaking point
My breaking point

I'm not close to the edge
I'm standing right at it
When I turn, turn the page
It is still unwritten

I'm giving up, I'm giving up, I'm giving up

I'm at my breaking point, cannot take it another day
I'm at my breaking point, never gonna make it out alive
This is me giving up because I have had enough
I'm at my breaking point, my breaking point
My breaking point
...

******* This Lyrics is NOT for Commercial use *******
(1409622095821)"
509,509,Somebody Told Me,7HGTkn2aX7MNdKs7nV2xBt,rock,https://open.spotify.com/track/7HGTkn2aX7MNdKs7nV2xBt,The Killers,0C0XlULifJtAgn6ZNCW2eu,"['dance rock', 'modern rock', 'permanent wave', 'rock']",2004-06-15,197160,66,0.509,0.987,10,-3.198,0,0.0886,8.05e-05,0.0009279999999999999,0.11900000000000001,0.647,138.039,197160,4,"Breaking my back just to know your name
Seventeen tracks, and I've had it with this game
A-breaking my back just to know your name
But heaven ain't close in a place like this
Anything goes, but don't blink, you might miss
'Cause heaven ain't close in a place like this
I said, a-heaven ain't close in a place like this
Bring it back down, bring it back down tonight
(Ooh, ooh, ooh)
Never thought I'd let a rumor ruin my moonlight

Well, somebody told me you had a boyfriend
Who looked like a girlfriend
That I had in February of last year
It's not confidential, I've got potential

Ready let's roll onto something new
...

******* This Lyrics is NOT for Commercial use *******
(1409622095821)"
510,510,Beyond,1Omt5bfz1tZUCqd26HxbS0,rock,https://open.spotify.com/track/1Omt5bfz1tZUCqd26HxbS0,Leon Bridges,3qnGvpP8Yth1AqSBMqON5x,"['modern blues', 'soul']",2018-05-04,240600,73,0.581,0.687,6,-5.4,1,0.105,0.22899999999999998,0.0,0.109,0.187,76.014,240600,4,
511,511,Buddy Holly,7GptbanebPZYkLPvjNfd6m,rock,https://open.spotify.com/track/7GptbanebPZYkLPvjNfd6m,Weezer,3jOstUTkEu2JkjvRdBA5Gu,"['alternative rock', 'modern power pop', 'modern rock', 'permanent wave', 'pop rock', 'rock']",1994-05-10,159586,0,0.535,0.9309999999999999,8,-4.012,1,0.0451,0.00611,7.26e-05,0.0887,0.825,120.958,159587,4,
512,512,Runnin' with the Devil - 2015 Remaster,3KhF2YiNpJvGpfiCW45R6D,rock,https://open.spotify.com/track/3KhF2YiNpJvGpfiCW45R6D,Van Halen,2cnMpRsOVqtPMfq7YiFE6K,"['album rock', 'classic rock', 'hard rock', 'metal', 'rock']",1978-02-10,214960,70,0.47200000000000003,0.9,8,-6.406000000000001,0,0.0582,0.14800000000000002,0.000297,0.34,0.42,95.82600000000001,214960,4,"(Ahh, ye-ah!)
I live my life like there's no tomorrow
All I've got, I had to steal
Least I don't need to beg or borrow
Yes, I'm livin' at a pace that kills

(Ooh, yeah!)
(Ahh!) Runnin' with the devil (Ahh-hah! Yeah-ah!)
(Woo-hoo-oo!) Runnin' with the devil
(I Tell Ya All About It)
I found the simple life ain't so simple
When I jumped out, on that road
I got no love, no love you'd call real

Ain't got nobody, waitin' at home
(Ah, yeah-ah!)
...

******* This Lyrics is NOT for Commercial use *******
(1409622095821)"
513,513,Times Like These,67vYdAAM3oGsEImCRfbtsF,rock,https://open.spotify.com/track/67vYdAAM3oGsEImCRfbtsF,Foo Fighters,7jy3rLJdDQY21OgRLCZ9sD,"['alternative metal', 'alternative rock', 'modern rock', 'permanent wave', 'post-grunge', 'rock']",2002-10-22,265560,67,0.376,0.9079999999999999,4,-3.793,0,0.0879,1.4000000000000001e-05,1.4000000000000001e-05,0.24100000000000002,0.266,144.58100000000002,265560,4,"I, I'm a one way motorway
I'm the one that drives away
Then follows you back home
I, I'm a street light shining
I'm a wild light blinding bright
Burning off and on
Ah-ah-ahh

It's times like these you learn to live again
It's times like these you give and give again
It's times like these you learn to love again
It's times like these time and time again

...

******* This Lyrics is NOT for Commercial use *******
(1409622095821)"
514,514,Oh No,6PCuVdPENYbYwSnoWxxeTM,rock,https://open.spotify.com/track/6PCuVdPENYbYwSnoWxxeTM,Bring Me The Horizon,1Ffb6ejR6Fe5IamqA5oRUF,"['melodic metalcore', 'metalcore', 'rock', 'uk metalcore']",2015-09-04,301026,0,0.503,0.836,0,-5.476,1,0.0484,0.00551,1.82e-05,0.11199999999999999,0.106,115.016,301027,4,"You don't have to lie, I know exactly where you've been
'Cause you're chewing off my ear while you're chewing on your chin

No, we're not on the level, you're just off your face
It's not a state of mind, no, your head's just in a state
I may be on the outside, but you're empty within
It's getting kind of old now, I think it's time to pack it in

Don't call it a party 'cause it never stops
Now one is too many, but it's never enough
Don't tell me you're happy 'cause this isn't love
So be careful what you wish for
So be careful what you wish for

...

******* This Lyrics is NOT for Commercial use *******
(1409622095821)"
515,515,Fell On Black Days,6B4JGMaqe1LaEMlsVzNdNM,rock,https://open.spotify.com/track/6B4JGMaqe1LaEMlsVzNdNM,Soundgarden,5xUf6j4upBrXZPg6AI4MRK,"['alternative metal', 'alternative rock', 'blues rock', 'grunge', 'hard rock', 'modern rock', 'nu metal', 'rock']",1994-01-01,281800,38,0.389,0.6409999999999999,4,-9.623,0,0.0328,0.00126,0.0009429999999999999,0.18,0.546,203.015,281800,4,"Whatsoever I've feared has come to life
Whatsoever I've fought off became my life
Just when every day seemed to greet me with a smile
Sunspots have faded and now I'm doing time
Now I'm doing time

'Cause I've fell on black days
I've fell on black days (black days)

Whomsoever I've cured, I've sickened now
Whomsoever I've cradled, I've put you down
Searchlight so they say, but I can't see it in the night
I'm only faking when I get it right
When I get it right
...

******* This Lyrics is NOT for Commercial use *******
(1409622095821)"
516,516,Born in the U.S.A.,0dOg1ySSI7NkpAe89Zo0b9,rock,https://open.spotify.com/track/0dOg1ySSI7NkpAe89Zo0b9,Bruce Springsteen,3eqjTLE0HfPfh78zjh6TqT,"['classic rock', 'heartland rock', 'mellow gold', 'permanent wave', 'rock', 'singer-songwriter']",1984-06-04,278680,76,0.39799999999999996,0.9520000000000001,4,-6.042000000000001,1,0.061,0.000373,7.75e-05,0.1,0.584,122.09299999999999,278680,4,
517,517,Word Up!,4D05EjPFWFx3BEQNeB7Vct,rock,https://open.spotify.com/track/4D05EjPFWFx3BEQNeB7Vct,Korn,3RNrq3jvMZxD9ZyoOZbQOD,"['alternative metal', 'funk metal', 'nu metal', 'rap metal', 'rock']",2004-01-03,172666,25,0.58,0.9390000000000001,6,-4.425,0,0.0369,2.6700000000000002e-05,0.0644,0.349,0.804,116.042,172667,4,"Y'all pretty ladies around the world
Got a weird thing to show ya
So tell all the boys and girls
Tell your brother, your sister and your mama too
We're about to go down and you know just what to do
Wave your hands in the air like you don't care
Glide by the people as they stop to look and stare
Do your dance, do your dance
Do your dance quick
Mama, come on baby tell me what's the word

Word up
(Up, up)
Everybody say
When you hear the call you've got to get it underway
Word up
(Up, up)

It's the code word

No matter where you say it, you know that you'll be heard

...

******* This Lyrics is NOT for Commercial use *******
(1409622095821)"
518,518,The Red,1gyee1JuFFiP476LQpRMYU,rock,https://open.spotify.com/track/1gyee1JuFFiP476LQpRMYU,Chevelle,56dO9zeHKuU5Gvfc2kxHNw,"['alternative metal', 'christian rock', 'modern rock', 'nu metal', 'post-grunge', 'rap rock', 'rock']",2002,238400,69,0.509,0.843,1,-3.318,0,0.0488,0.000671,0.0008029999999999999,0.348,0.332,140.055,238400,3,"They say freak
When you're singled out
The red
Well, it filters through

So lay down, the threat is real
When his sight goes red again

Seeing red again
Seeing red again

This change
He won't contain
Slip away
...

******* This Lyrics is NOT for Commercial use *******
(1409622095821)"
519,519,Youth,1CF426318xBsb8ZaGrP94H,rock,https://open.spotify.com/track/1CF426318xBsb8ZaGrP94H,Hundredth,2rtsR8zno5naTxY0iJr7M0,"['dreamo', 'grungegaze', 'melodic hardcore', 'modern alternative rock', 'progressive post-hardcore', 'screamocore']",2017-06-16,210480,0,0.365,0.978,8,-4.567,0,0.11900000000000001,2.9600000000000005e-05,0.483,0.0763,0.348,179.99,210480,4,"Will I wish I would have stayed?
Is the other side charades?
By the time I tie the braid
Will it be worth the fray?

When I decide to leave
Will it be everything I dreamed?
When I swallow before I speak
Will I hate to see a different side of me?

And I hope it's just a phase
Just a dull side of the blade
Under the stone
...

******* This Lyrics is NOT for Commercial use *******
(1409622095821)"
