,Unnamed: 0,song_name,song_id,song_genre,url,artist,artist_id,artist_genre,release_date,duration_ms,popularity,danceability,energy,key,loudness,mode,speechiness,acousticness,instrumentalness,liveness,valence,tempo,duration_ms_,time_signature,lyrics
249,249,Undead,4U0p10TUdRyhQ06ZqGAtxx,rock,https://open.spotify.com/track/4U0p10TUdRyhQ06ZqGAtxx,Hollywood Undead,0CEFCo8288kQU7mJi25s6E,"['alternative metal', 'modern rock', 'nu metal', 'pop punk', 'rap metal', 'rap rock']",2008,265053,64,0.512,0.943,2,-5.185,0,0.106,0.0138,0.0,0.261,0.485,163.128,265053,4,"Undead
Undead
Undead
Undead

Undead
You better get up out the way
Tomorrow we'll rise, so let's fight today
You know I don't give a fuck what you think and say
'Cause we're gonna rock this whole place anyway
Undead
You better get up out the way
Tomorrow we'll rise, so let's fight today
You know I don't give a fuck what you think and say
'Cause we're gonna rock this whole place anyway

Look up and see that motherfuckin' writing on the wall
When you see J3T thirty deep, he's down to brawl
Fuck all haters I see 'cause I hate that you breathe
I see you duck, you little punk, you little fucking disease
I got HU tatted on the front of my arms
The boulevard, brass knuckles in the back of the car
'Cause we drunk-drive Cadillacs, we never go far
But when you see us, motherfuckers, better know who we are

I got one thing to say to punk-asses who hate
Motherfuckers don't know, but you better watch what you say
From these industry fucks to these faggot-ass punks
You don't know what it takes to get this motherfucking drunk
I'm already loud, maybe it's a little too late
Johnny's taking heads off of all faggots who hate
'Cause I'm like God, motherfucker, there's a price to pay
Yeah, I'm a God, motherfucker, and it's Judgment Day

Undead
You better get up out the way
...

******* This Lyrics is NOT for Commercial use *******
(1409622095821)"
250,250,What I Got,5nkYHBWXu7KCgcdwP6jcB1,rock,https://open.spotify.com/track/5nkYHBWXu7KCgcdwP6jcB1,Sublime,0EdvGhlC1FkGItLOWQzG4J,"['reggae fusion', 'ska mexicano', 'ska punk']",1996-07-30,171066,50,0.799,0.696,7,-7.513,1,0.0859,0.0128,0.000333,0.331,0.62,95.637,171067,4,"Early in the morning, risin' to the street
Light me up that cigarette and I'll strap shoes on my feet
Got to find the reason, reason things went wrong
Got to find a reason why my money's all gone
I got a Dalmatian and I can still get high
I can play the guitar like a motherfuckin' riot

Well, life is too short, so love the one you got
'Cause you might get run over or you might get shot
Never start no static, I just get it off my chest
Never had to battle with no bulletproof vest
Take a small example, take a tip from me
Take all of your money, give it all to charity
Love is what I got, it's within my reach
And the Sublime style's still straight from Long Beach
It all comes back to you, you're bound to get what you deserve
Try and test that, you're bound to get served
...

******* This Lyrics is NOT for Commercial use *******
(1409622095821)"
251,251,Middle Fingers,1RgvTl4vQN4qECtnO1guEp,rock,https://open.spotify.com/track/1RgvTl4vQN4qECtnO1guEp,MISSIO,2HOMW1liAxI3URnEq95SMS,"['alt z', 'electropop', 'indie poptimism', 'modern alternative rock', 'modern rock', 'rock']",2017-05-19,215200,49,0.517,0.5529999999999999,1,-5.135,1,0.0329,0.00010400000000000001,3.7000000000000006e-06,0.133,0.0775,139.26,215200,4,"I am tired of seeing pretty people everywhere
I am not a model, middle fingers in the air
I used to drink whiskey, now I'm stuck with Perrier
I'm an alcoholic, middle fingers in the air

I'll just keep on throwing middle fingers in the air
I'll just keep on throwing middle fingers in the air

I don't like the music other people tend to share
Hate your loser lyrics, middle fingers in the air
...

******* This Lyrics is NOT for Commercial use *******
(1409622095821)"
252,252,Ain't Talkin' 'Bout Love - 2015 Remaster,6fybp4N6eW3bsFAvARxyVe,rock,https://open.spotify.com/track/6fybp4N6eW3bsFAvARxyVe,Van Halen,2cnMpRsOVqtPMfq7YiFE6K,"['album rock', 'classic rock', 'hard rock', 'metal', 'rock']",1978-02-10,227800,66,0.518,0.938,8,-5.9639999999999995,0,0.0416,0.021,0.000305,0.28800000000000003,0.71,139.138,227800,4,"I heard the news baby
All about your disease
Yeah, you may have all you want baby
But I got somethin' you need, oh yeah!

Ain't talkin' 'bout love
My love is rotten to the core
Ain't talkin' 'bout love
Just like I told you before! Yeah, before!

You know you're semi-good lookin'
And on the streets again
Ooh yeah, you think you're really cookin' baby
You better find yourself a friend, my friend

Ain't talkin' 'bout love
My love is rotten to the core
Ain't gonna talk about love
...

******* This Lyrics is NOT for Commercial use *******
(1409622095821)"
253,253,6/8,3McsQb9vsF9snVh2ku101H,rock,https://open.spotify.com/track/3McsQb9vsF9snVh2ku101H,blink-182,6FBDaR13swtiWwGhX1WQsP,"['pop punk', 'punk', 'socal pop punk']",2017-05-19,227895,42,0.528,0.937,2,-2.986,0,0.0758,0.0142,0.0,0.382,0.368,107.48200000000001,227895,3,"You live in a world I cannot believe
You create a world I don't want to see
And your forest's a stand of dead trees lost in the night
Did you ever think you'd live down the past
You just want to tie yourself to the mast
All your nightmares have come to at last
At least in your mind

Learn to swim in rushing rivers
Breaking on the shore
Make your peace with broken streets
Your face turned towards the storm

Your hollow accusations no one ever hears
...

******* This Lyrics is NOT for Commercial use *******
(1409622095821)"
254,254,The Lonesome Boatman,1eX5SoCjIWCIS3TGoZ6upR,rock,https://open.spotify.com/track/1eX5SoCjIWCIS3TGoZ6upR,Dropkick Murphys,7w9jdhcgHNdiPeNPUoFSlx,"['boston punk', 'boston rock', 'celtic punk', 'celtic rock', 'punk', 'skate punk']",2017-01-06,162853,38,0.146,0.593,6,-5.984,0,0.0378,0.0115,0.838,0.0913,0.205,140.026,162853,4,
255,255,Can't Deny Me,4PwGt5dBTmdRu4HTN8ZWgR,rock,https://open.spotify.com/track/4PwGt5dBTmdRu4HTN8ZWgR,Pearl Jam,1w5Kfo2jwwIPruYS2UWh56,"['alternative rock', 'grunge', 'permanent wave', 'pop rock', 'rock']",2018-03-13,163920,45,0.6629999999999999,0.972,9,-4.931,0,0.0393,0.0007,0.0,0.0943,0.9179999999999999,120.025,163920,4,"And now you want me to breathe
And be so grateful
Ah, for the air that I need (haha)
Don't make me pitiful

And in the morning light
We're just the same you and me
Out on the go, send officials
Our propensity to breed

The higher, the farther, the faster you fly
You may be rich, but you can't deny me
Got nothing, got nothing but the will to survive
You can't control, and you can't deny me
Your lies are sick, they're sick and they're vile
You can't deny me
...

******* This Lyrics is NOT for Commercial use *******
(1409622095821)"
256,256,Man On The Moon,4jLv3tDBu8ww2R07DvL12s,rock,https://open.spotify.com/track/4jLv3tDBu8ww2R07DvL12s,R.E.M.,4KWTAlx2RvbpseOGMEmROg,"['alternative rock', 'athens indie', 'classic rock', 'permanent wave', 'pop rock', 'rock']",1992-10-05,314173,67,0.667,0.6990000000000001,7,-7.574,1,0.026000000000000002,0.42,0.000442,0.201,0.655,118.56700000000001,314173,4,lyrics not found
257,257,Streets of Philadelphia - Single Edit,3fbnbn6A5O5RNb08tlUEgd,rock,https://open.spotify.com/track/3fbnbn6A5O5RNb08tlUEgd,Bruce Springsteen,3eqjTLE0HfPfh78zjh6TqT,"['classic rock', 'heartland rock', 'mellow gold', 'permanent wave', 'rock', 'singer-songwriter']",1995-02-27,195080,71,0.741,0.29,5,-13.251,1,0.0302,0.294,0.11800000000000001,0.0924,0.44299999999999995,93.699,195080,4,
258,258,Pretty,3qKle2dRbjUW5kt9XKLsr0,rock,https://open.spotify.com/track/3qKle2dRbjUW5kt9XKLsr0,DON BROCO,1aOt6LvXOV6I8dv1A5Diia,"['british alternative rock', 'modern alternative rock', 'modern rock', 'pop punk', 'rock']",2018-02-02,215613,0,0.7040000000000001,0.8740000000000001,9,-4.8660000000000005,0,0.094,0.0144,3.73e-05,0.42200000000000004,0.607,107.54899999999999,215613,4,"Pretty boy looking over
Pretty girl gets the boys
Pretty things can be evil
Pretty tough to avoid
Pretty hard on it eight days a week
Causing a fuss up in the big city
Eight days a week, eight days a week sucker
Eight days a week

Spilling drinks down my shirt, wasted
Hooligan trying to flirt, basic
Home on my own
Let the good times roll
Yeah I'm far too gone
But now she wanna talk to me
Thing about foreigners they
Taking our jobs we should send 'em away
I can't believe what I heard
How she's saying these words
But I'm far too gone

You should let me love you
I could make you change I could
...

******* This Lyrics is NOT for Commercial use *******
(1409622095821)"
259,259,Beth,1cPXOzyeZauSAsT1yy7aBp,rock,https://open.spotify.com/track/1cPXOzyeZauSAsT1yy7aBp,KISS,07XSN3sPlIlB2L2XNcTwJw,"['album rock', 'classic rock', 'glam rock', 'hard rock', 'metal', 'rock']",1976-03-15,165666,60,0.387,0.23800000000000002,0,-13.495999999999999,1,0.0339,0.878,0.000715,0.19399999999999998,0.27899999999999997,115.354,165667,4,"Beth, I hear you calling
But I can't come home right now
Me and the boys are playing
And we just can't find the sound

Just a few more hours
And I'll be right home to you
I think I hear them callin'
...

******* This Lyrics is NOT for Commercial use *******
(1409622095821)"
260,260,More Than Words,1gVgkQFOKa8Wc1HYsJtPdH,rock,https://open.spotify.com/track/1gVgkQFOKa8Wc1HYsJtPdH,Extreme,6w7j5wQ5AI5OQYlcM15s2L,"['album rock', 'funk metal', 'glam metal', 'hard rock', 'rock']",1990-01-01,334106,72,0.626,0.134,6,-14.898,1,0.0298,0.467,0.0,0.113,0.239,91.89299999999999,334107,4,"Saying ""I love you""
Is not the words
I want to hear from you
It's not that I want you
Not to say
But if you only knew
How easy
It would be to
Show me how you feel
More than words
Is all you have to do
To make it real
Then you wouldn't
Have to say
That you love me
Cause I'd already know
What would you do?
If my heart
Was torn in two
More than words
To show you feel
That your love
For me is real
What would you say
...

******* This Lyrics is NOT for Commercial use *******
(1409622095821)"
261,261,Atlantic,3wiYAlqOqmABujoeBFxBWL,rock,https://open.spotify.com/track/3wiYAlqOqmABujoeBFxBWL,Grayscale,6Xq9CIMYWK4RCrMVtfEOM0,"['anthem emo', 'pop punk']",2017-05-05,233360,47,0.546,0.94,4,-2.41,1,0.0401,0.000863,4.16e-06,0.0791,0.542,110.98,233360,4,"My eyes are tired, blood pumped with caffeine
This place feels more and more like nowhere to me
I'm sick of waiting for a fire to ignite
I could just leave here without a goodbye

I'll burn down this bridge
And set my life up in smoke
You used to be mine
My world used to shine like gold

I want to go
I want to go
Run from this panic
I need the unknown

I've had enough
I've had enough
Run to Atlantic
Away from this home

Was never strong without you here
...

******* This Lyrics is NOT for Commercial use *******
(1409622095821)"
262,262,Click Click Boom,1LMVGL3030W3mGmRrd2hCm,rock,https://open.spotify.com/track/1LMVGL3030W3mGmRrd2hCm,Saliva,5S6hjAxgxjsLylsTtMIimO,"['alternative metal', 'nu metal', 'rap metal', 'rap rock', 'wrestling']",2001-01-01,252400,1,0.607,0.935,6,-2.918,1,0.0506,0.00259,0.000221,0.195,0.51,95.97,252400,4,"C'mon, c'mon!
C'mon, c'mon!

On those saturdays when kids go out and play
Yo, I was up in my room, I let the stereo blaze
Wasn't faded, not jaded, just a kid
With a pad and a pen and a big imagination

All this, I seek, I find
I push the envelope to the line
Make it, break it, take it
Until I'm overrated!

Click, click, boom!
I'm coming down on the stereo, hear me on the radio
Click, click, boom!
I'm coming down with the new style and you know it's buck wild
Click, click, boom!
I'm on the radio station, touring 'round the nation
Leaving the scene in devastation

I can see it in my mind
I can see it in their eyes
It's close enough to touch it now
But far away enough to die...

...

******* This Lyrics is NOT for Commercial use *******
(1409622095821)"
263,263,Next Contestant,3nCqvNZj68zVlT3Dy7fJ3b,rock,https://open.spotify.com/track/3nCqvNZj68zVlT3Dy7fJ3b,Nickelback,6deZN1bslXzeGvOLaLMOIF,"['alternative metal', 'canadian rock', 'nu metal', 'post-grunge']",2005-09-26,214706,55,0.557,0.862,0,-4.029,1,0.0636,0.00041600000000000003,0.000314,0.0577,0.531,174.114,214707,4,"I judge by what she's wearing
Just how many heads I'm tearing
Off of assholes coming on to her
(Each night seems like it's getting worse)

And I wish she'd take the night off
So I don't have to fight off
Every asshole coming on to her
(It happens every night she works)

They'll go and ask the DJ
Find out just what would she say
If they all tried coming on to her
(Don't they know it's never going to work)

They think they'll get inside her
With every drink they buy her
As they all try coming on to her
(This time somebody's getting hurt)

Here comes the next contestant

Is that your hand on my girlfriend?
...

******* This Lyrics is NOT for Commercial use *******
(1409622095821)"
264,264,The Logical Song - Remastered 2010,6mHOcVtsHLMuesJkswc0GZ,rock,https://open.spotify.com/track/6mHOcVtsHLMuesJkswc0GZ,Supertramp,3JsMj0DEzyWc0VDlHuy9Bx,"['album rock', 'art rock', 'classic rock', 'glam rock', 'mellow gold', 'piano rock', 'progressive rock', 'rock', 'soft rock']",1979-03-29,251253,72,0.625,0.758,5,-6.212999999999999,0,0.0463,0.512,0.00022,0.153,0.695,119.719,251253,4,"When I was young
I seemed that life was so wonderful
A miracle, oh it was beautiful, magical
And all the birds in the trees
Well they'd be singing so happily
Oh, joyfully, oh, playfully watching me

But then they send me away
To teach me how to be sensible
Oh, logical, oh, responsible, practical
And then they showed me a world
...

******* This Lyrics is NOT for Commercial use *******
(1409622095821)"
265,265,Indestructible,42ZVk59gT4tMlrZmd8Ijxf,rock,https://open.spotify.com/track/42ZVk59gT4tMlrZmd8Ijxf,Disturbed,3TOqt5oJwL9BE2NG9MEwDa,"['alternative metal', 'nu metal', 'rap metal']",2008-04-29,278026,70,0.429,0.966,8,-4.605,1,0.0733,0.00020899999999999998,0.124,0.371,0.525,179.956,278027,4,"Another mission
The powers have called me away
Another time to carry the colors again
My motivation
An oath I've sworn to defend
To win the honor of coming back home again
No explanation will matter after we begin
Unlock the dark destroyer that's buried within
My true vocation and now my unfortunate friend
You will discover a war you're unable to win

I'll have you know
That I've become

Indestructible
Determination that is incorruptible
From the other side
A terror to behold
Annihilation will be unavoidable
Every broken enemy will know
That their opponent had to be invincible
...

******* This Lyrics is NOT for Commercial use *******
(1409622095821)"
266,266,All I Want,3imITUqEhkebNbOoS1yrWm,rock,https://open.spotify.com/track/3imITUqEhkebNbOoS1yrWm,A Day To Remember,4NiJW4q9ichVqL1aUsgGAN,"['metalcore', 'modern rock', 'pop punk', 'screamo']",2010,202640,36,0.342,0.981,2,-3.228,0,0.14,2.5300000000000002e-05,0.0,0.34299999999999997,0.207,160.083,202640,4,"I'm always screaming my lungs out 'til my head starts spinning
Playing my songs is the way I cope with life
Won't keep my voice down
Know the words I speak are the thoughts I think out loud
I like to keep things honest
I'm a safe bet like your life's staked on it, for real
I'd hate to keep you all wondering
I'm constant like the seasons
And I will never be forgotten, man

Let's leave no words unspoken and save regrets for the broken
Will you even look back when you think of me?

All I want is a place to call my own
To mend the hearts of everyone who feels alone
Whoa, you know to keep your hopes up high, and your head down low
Keep your hopes up high and your head down low
...

******* This Lyrics is NOT for Commercial use *******
(1409622095821)"
267,267,Midnight Crusade,4sykUbPIpLYRfZk1ljZcpj,rock,https://open.spotify.com/track/4sykUbPIpLYRfZk1ljZcpj,Dance Gavin Dance,6guC9FqvlVboSKTI77NG2k,"['metalcore', 'pixie', 'pop punk', 'sacramento indie', 'screamo', 'swancore']",2018-06-08,209027,51,0.42100000000000004,0.982,11,-3.569,1,0.171,0.00123,2.25e-06,0.162,0.502,195.93400000000003,209028,4,"Used to be so judgemental
Now I respect the ones who dare to be sinful
Always searching for my pride, now I know it's all fleeting
Just glad to be alive

Brontosaurs fear of art is torn apart by making
Good mistakes and branching out, he switch it up like baking
The more I tried to sleep it off, the more I started thinking
I wanna live in Mushroom Park, do unrestricted shrinking

You're salty, can't fault you
I'm numb to the rhythm that guides you
Take all your confetti away

I know, I know what's killing me
Don't need your love or sympathy
I know, I know just what you'll say
Don't you try to rescue me

...

******* This Lyrics is NOT for Commercial use *******
(1409622095821)"
268,268,Africa,2374M0fQpWi3dLnB54qaLX,rock,https://open.spotify.com/track/2374M0fQpWi3dLnB54qaLX,TOTO,0PFtn5NtBbbUNbU9EAmIWF,"['album rock', 'classic rock', 'mellow gold', 'rock', 'soft rock', 'yacht rock']",1982-04-08,295893,83,0.6709999999999999,0.373,9,-18.064,1,0.0323,0.257,8.01e-05,0.0481,0.732,92.71799999999999,295893,4,"I hear the drums echoing tonight
But she hears only whispers of some quiet conversation
She's coming in, 12:30 flight

The moonlit wings reflect the stars that guide me towards salvation
I stopped an old man along the way
Hoping to find some long forgotten words or ancient melodies
He turned to me as if to say, ""Hurry boy, it's waiting there for you""

It's gonna take a lot to take me away from you
There's nothing that a hundred men or more could ever do
I bless the rains down in Africa
Gonna take some time to do the things we never had
...

******* This Lyrics is NOT for Commercial use *******
(1409622095821)"
269,269,Home Sweet Home,3WkcMGvPPcTquk9i9ZpTgG,rock,https://open.spotify.com/track/3WkcMGvPPcTquk9i9ZpTgG,Mötley Crüe,0cc6vw3VN8YlIcvr1v7tBL,"['glam metal', 'hard rock', 'metal', 'rock', 'sleaze rock']",1985,239666,0,0.40399999999999997,0.778,5,-6.184,1,0.0351,0.0781,3.63e-06,0.18100000000000002,0.14400000000000002,76.34,239667,4,
270,270,Still Counting,1znGxpojJSjxZZEWA5zWva,rock,https://open.spotify.com/track/1znGxpojJSjxZZEWA5zWva,Volbeat,0L5fC7Ogm2YwgqVCRcF1bT,"['alternative metal', 'danish metal', 'danish rock']",2008,261813,71,0.309,0.919,2,-3.1310000000000002,1,0.0609,0.00039,0.000225,0.423,0.322,103.891,261813,4,"Counting all the assholes in the room
Well, I'm definitely not alone
Well, I'm not alone
You're a liar, you're a cheater, you're a fool
Well, that's just like me, ooh, hoo
And I know you too

Mr. Perfect don't exist, my little friend
And I tell you that again
And I do it again
Counting all the assholes in the room
Well, I'm definitely not alone
Well, I'm not alone, zah

Look deep into yourself before you blame
...

******* This Lyrics is NOT for Commercial use *******
(1409622095821)"
271,271,Ghost,1bnswV3i4J3u9QVcdVMd39,rock,https://open.spotify.com/track/1bnswV3i4J3u9QVcdVMd39,Badflower,3T55D3LMiygE9eSKFpiAye,"['modern alternative rock', 'modern hard rock', 'modern rock', 'post-grunge', 'rock']",2018-09-28,259427,49,0.505,0.848,11,-5.172999999999999,0,0.0575,0.0106,0.0,0.18,0.282,140.055,259428,4,"I tried it once before, but I didn't get too far
I felt a lot of pain, but it didn't stop my heart
And all I really wanted was someone to give a little fuck
But I waited there forever and nobody even looked up

I tried it once before, and I think I might have messed up
I struggled with the veins, and I guess I didn't bleed enough
But maybe I'm alive 'cause I didn't really wanna die
But nothing very special ever happens in my life

Take the blade away from me
I am a freak, I am afraid that
All the blood escaping me won't end the pain
And I'll be haunting all the lives that cared for me
I died to be the white ghost
Of the man that I was meant to be
...

******* This Lyrics is NOT for Commercial use *******
(1409622095821)"
272,272,"My My, Hey Hey (Out of the Blue) - 2016 Remaster",6VltRkmJbCTqgKrTHk4Ulw,rock,https://open.spotify.com/track/6VltRkmJbCTqgKrTHk4Ulw,"['Neil Young', 'Crazy Horse']","['6v8FB84lnmJs434UJf2Mrm', '0oi7g8NUnlLh5tJvg2y5e3']","[['album rock', 'canadian singer-songwriter', 'classic canadian rock', 'classic rock', 'mellow gold', 'permanent wave', 'rock', 'roots rock', 'singer-songwriter'], ['country rock', 'folk rock', 'roots rock']]",1979-06-27,227705,66,0.502,0.4,7,-13.697000000000001,0,0.0294,0.856,0.000375,0.33299999999999996,0.435,127.182,227706,4,
273,273,All Along the Watchtower,2aoo2jlRnM3A0NyLQqMN2f,rock,https://open.spotify.com/track/2aoo2jlRnM3A0NyLQqMN2f,Jimi Hendrix,776Uo845nYHJpNaStv1Ds4,"['acid rock', 'album rock', 'blues rock', 'classic rock', 'hard rock', 'psychedelic rock', 'rock']",1968-10-25,240800,77,0.43799999999999994,0.805,8,-6.237,1,0.0624,0.00255,5.6899999999999994e-05,0.0842,0.564,113.25299999999999,240800,4,
274,274,Jeremy,62nQ8UZVqR2RMvkJHkcO2o,rock,https://open.spotify.com/track/62nQ8UZVqR2RMvkJHkcO2o,Pearl Jam,1w5Kfo2jwwIPruYS2UWh56,"['alternative rock', 'grunge', 'permanent wave', 'pop rock', 'rock']",1991-08-27,318226,71,0.285,0.846,2,-6.472,1,0.0438,0.0404,0.0,0.182,0.287,108.80799999999999,318227,4,"At home drawing pictures
Of mountain tops
With him on top
Lemon yellow sun
Arms raised in a V
And the dead lay in pools of maroon below

Daddy didn't give attention
Oh, to the fact that mommy didn't care
King Jeremy the wicked
Oh, ruled his world

Jeremy spoke in class today
Jeremy spoke in class today

Clearly I remember
...

******* This Lyrics is NOT for Commercial use *******
(1409622095821)"
275,275,Livin' On A Prayer,0J6mQxEZnlRt9ymzFntA6z,rock,https://open.spotify.com/track/0J6mQxEZnlRt9ymzFntA6z,Bon Jovi,58lV9VcRSjABbAbfWS6skp,"['glam metal', 'hard rock', 'rock']",1986-01-01,249293,1,0.534,0.887,0,-3.7769999999999997,1,0.0345,0.0768,9.93e-05,0.325,0.72,122.494,249293,4,"Once upon a time
(Not so long ago)

Tommy used to work on the docks
Union's been on strike
He's down on his luck
It's tough, so tough

Gina works the diner all day
Working for her man
She brings home her pay for love
Mmm, for love

She says, we've gotta hold on to what we've got
It doesn't make a difference if we make it or not
We got each other and that's a lot for love
We'll give it a shot

Whoa
We're half way there
Whoa-oh
Livin' on a prayer
Take my hand, we'll make it, I swear
Whoa-oh
...

******* This Lyrics is NOT for Commercial use *******
(1409622095821)"
276,276,Immigrant Song - Remaster,78lgmZwycJ3nzsdgmPPGNx,rock,https://open.spotify.com/track/78lgmZwycJ3nzsdgmPPGNx,Led Zeppelin,36QJpDe2go2KgaRleHCDTp,"['album rock', 'classic rock', 'hard rock', 'rock']",1970,146250,77,0.564,0.932,11,-10.068,1,0.0554,0.013000000000000001,0.16899999999999998,0.349,0.619,112.93700000000001,146250,4,"Ah! Ah!
Ah! Ah!

We come from the land of the ice and snow
From the midnight sun, where the hot springs flow

The hammer of the gods will drive our ships to new land
To fight the horde and sing, and cry
Valhalla, I am coming

...

******* This Lyrics is NOT for Commercial use *******
(1409622095821)"
277,277,Hell Yeah,2qABxQZhfAthNxszLiSsUw,rock,https://open.spotify.com/track/2qABxQZhfAthNxszLiSsUw,Rev Theory,10n5DVRlZbjbZ5ffpwpn6l,"['alternative metal', 'gymcore', 'nu metal', 'post-grunge', 'rap rock', 'rebel blues', 'wrestling']",2008-01-01,247613,65,0.35700000000000004,0.982,3,-3.41,0,0.107,0.000105,3.64e-06,0.0222,0.368,167.889,247613,4,"Can you feel that?
You better hold on
This one's about to get bumpy
Hahahahahahaha...

She's a ten, hellbent, I'm in heaven tonight
Six speed sex scene playin' out in my mind
One look, I'm hooked, motor runnin'
Rev'd up, my heart startin' pumpin'
Are you ready for the best damn ride of your life?

Gimme a ""hell""
Gimme a ""yeah""
Stand up right now
And gimme a ""hell""
Gimme a ""yeah""
Stand up right now
Get ready to go
She ain't movin' slow
She's takin' control
Pushin' the pedal to the floor
I'm beggin' for more
You better hold on tight

Hey, hey, hey, hey
...

******* This Lyrics is NOT for Commercial use *******
(1409622095821)"
278,278,Semi-Charmed Life,42et6fnHCw1HIPSrdPprMl,rock,https://open.spotify.com/track/42et6fnHCw1HIPSrdPprMl,Third Eye Blind,6TcnmlCSxihzWOQJ8k0rNS,"['alternative rock', 'neo mellow', 'pop rock', 'post-grunge', 'rock']",1997-04-08,268360,75,0.64,0.8640000000000001,7,-6.5760000000000005,1,0.0314,0.008320000000000001,0.0,0.12300000000000001,0.701,102.02600000000001,268360,4,"I'm packed and I'm holdin'
I'm smilin', she's livin', she's golden
She lives for me, says she lives for me
Ovation, her own motivation
She comes round and she goes down on me

And I make her smile, like a drug for you
Do ever what you wanna do, comin' over you
Keep on smilin' what we go through
One stop to the rhythm, that divides you

And I speak to you like the chorus to the verse
Chop another line like a coda with a curse
Come on like a freak show takes the stage
We give them the games to play, she said

I want somethin' else
To get me through this
Semi-charmed kinda life
Baby, baby
I want somethin' else
I'm not listenin' when you say
Goodbye

The sky was gold, it was rose
I was takin' sips of it through my nose
And I wish I could get back there, someplace back there
Smilin' in the pictures you would take
Doin' crystal meth, will lift you up until you break

...

******* This Lyrics is NOT for Commercial use *******
(1409622095821)"
