,Unnamed: 0,song_name,song_id,song_genre,url,artist,artist_id,artist_genre,release_date,duration_ms,popularity,danceability,energy,key,loudness,mode,speechiness,acousticness,instrumentalness,liveness,valence,tempo,duration_ms_,time_signature,lyrics
0,0,Novacaine,0uyDAijTR0tOuH24hxDhE5,rock,https://open.spotify.com/track/0uyDAijTR0tOuH24hxDhE5,10 Years,0REMf7H0VP6DwfZ9MbuWph,"['alternative metal', 'christian rock', 'nu metal', 'post-grunge', 'rap rock']",2017-10-27,169520,54,0.444,0.865,11,-2.4330000000000003,1,0.0464,0.000106,1.55e-05,0.0366,0.74,188.03599999999997,169520,4,"With dirt on your knees and blood in your teeth
You want life to lead you to believe in something
But it's coming
Oh oh, the numbing
So we dive on in to the deeper end
For a blissful kiss from Judas' lips
But it's coming
Oh yeah, the numbing

Super novacaine
(You're dead as dead can be)
You won't feel a thing
Sleepwalking
(You're dead as dead can be)
You won't feel a thing
...

******* This Lyrics is NOT for Commercial use *******
(1409622095821)"
1,1,Crosstown Traffic,1ntxpzIUbSsizvuAy6lTYY,rock,https://open.spotify.com/track/1ntxpzIUbSsizvuAy6lTYY,Jimi Hendrix,776Uo845nYHJpNaStv1Ds4,"['acid rock', 'album rock', 'blues rock', 'classic rock', 'hard rock', 'psychedelic rock', 'rock']",1968-10-25,146573,59,0.486,0.963,0,-5.586,0,0.129,0.248,2.39e-06,0.158,0.5329999999999999,113.133,146573,4,
2,2,Cowboys from Hell,2SgbR6ttzoNlCRGQOKjrop,rock,https://open.spotify.com/track/2SgbR6ttzoNlCRGQOKjrop,Pantera,14pVkFUHDL207LzLHtSA18,"['alternative metal', 'groove metal', 'hard rock', 'metal', 'nu metal', 'old school thrash', 'rock', 'texas metal', 'wrestling']",1990-07-20,243533,70,0.415,0.9079999999999999,2,-9.701,1,0.0765,0.004370000000000001,0.0345,0.08199999999999999,0.43700000000000006,114.816,243533,4,"Oh, come on!

Under the lights where we stand tall
Nobody touches us at all
Showdown, shootout, spread fear within, without
We're gonna take what's ours to have
Spread the word throughout the land
They say bad guys wear black
We're tagged and can't turn back

You see us comin'
And you all together run for cover
We're taking over this town

Here we come reach for your gun
And you better listen well, my friend, you see
It's been slowed down below
Aimed at you, we're the cowboys from hell
...

******* This Lyrics is NOT for Commercial use *******
(1409622095821)"
3,3,Voodoo,5uGsG0LfotfWDq6hql4h53,rock,https://open.spotify.com/track/5uGsG0LfotfWDq6hql4h53,Godsmack,6gZq1Q6bdOxsUPUG1TaFbF,"['alternative metal', 'nu metal', 'post-grunge', 'rap metal']",1998-01-01,282653,65,0.778,0.613,10,-9.897,0,0.0488,0.17,2.56e-06,0.102,0.853,120.005,282653,4,"I'm not the one who's so far away
When I feel the snakebite enter my veins
Never did I wanna be here again
And I don't remember why I came

Candles raise my desire
Why I'm so far away
No more meaning to my life
No more reason to stay

Freezing feeling
Breathe in, breathe in
I'm coming back again

I'm not the one who's so far away
When I feel the snakebite enter my veins
Never did I wanna be here again
And I don't remember why I came

...

******* This Lyrics is NOT for Commercial use *******
(1409622095821)"
4,4,Entre dos tierras,7BYqVvoXpQFhs4jJ0qqNZt,rock,https://open.spotify.com/track/7BYqVvoXpQFhs4jJ0qqNZt,Heroes Del Silencio,3qAPxVwIQRBuz5ImPUxpZT,"['latin alternative', 'latin rock', 'musica aragonesa', 'rock en espanol', 'spanish rock']",1990,368320,66,0.45799999999999996,0.746,11,-9.443999999999999,0,0.0318,0.0351,0.0,0.172,0.511,166.095,368320,4,"Te puedes vender
Cualquier oferta es buena, si quieres poder, uh
Y qué fácil es
Abrir tanto la boca para opinar

Y si te piensas echar atrás
Ya tienes muchas huellas que borrar, uh

Déjame, que yo no tengo la culpa de verte caer
Si yo no tengo la culpa de verte caer

Pierdes la fe
Cualquier esperanza es vana y no sé qué creer
Pe-pe-pe-pero, olvídame
Que nadie te ha llamado y ya estás otra vez, uh
...

******* This Lyrics is NOT for Commercial use *******
(1409622095821)"
5,5,There's A Reason Why (I Never Returned Your Calls),5pVbLYTdihSKd8Kylfhwa7,rock,https://open.spotify.com/track/5pVbLYTdihSKd8Kylfhwa7,Blossoms,22RISwgVJyZu9lpqAcv1F5,"['english indie rock', 'modern alternative rock', 'modern rock', 'rock']",2018-04-27,222488,56,0.493,0.882,11,-5.37,1,0.046,0.0166,2.97e-06,0.188,0.685,123.985,222489,4,"I wanna know
Since you've been gone
Have I been on
Your mind?
'Cause I know I was for a while

Late last night
I saw you out
For a moment I
Turned to stone
'Cause there's still something only we see

Don't talk
I'd have run to kiss your mouth
Is it me or
Just a dream that never dies?

There's a reason why
I never returned your calls
...

******* This Lyrics is NOT for Commercial use *******
(1409622095821)"
6,6,Somewhere I Belong,3agtg0x11wPvLIWkYR39nZ,rock,https://open.spotify.com/track/3agtg0x11wPvLIWkYR39nZ,Linkin Park,6XyY86QOPPrYVGvF9ch6wz,"['alternative metal', 'nu metal', 'post-grunge', 'rap metal']",2003-03-24,213933,64,0.451,0.951,1,-3.7539999999999996,1,0.0645,0.00037999999999999997,2.39e-06,0.261,0.442,162.065,213933,4,"When this began
I had nothing to say
And I get lost in the nothingness inside of me
(I was confused)
And I let it all out to find
That I'm not the only person with these things in mind

(Inside of me)
But all that they can see the words revealed
Is the only real thing that I've got left to feel
(Nothing to lose)
Just stuck, hollow and alone
And the fault is my own, and the fault is my own

I wanna heal, I wanna feel what I thought was never real
I wanna let go of the pain I've felt so long
(Erase all the pain 'til it's gone)
I wanna heal, I wanna feel like I'm close to something real
I wanna find something I've wanted all along
Somewhere I belong
...

******* This Lyrics is NOT for Commercial use *******
(1409622095821)"
7,7,Go With The Flow,0wzRcekWyVCSyPtlPOeJau,rock,https://open.spotify.com/track/0wzRcekWyVCSyPtlPOeJau,Queens of the Stone Age,4pejUc4iciQfgdX6OKulQn,"['alternative metal', 'alternative rock', 'blues rock', 'modern rock', 'nu metal', 'palm desert scene', 'rock', 'stoner metal', 'stoner rock']",2002-01-01,187146,66,0.24600000000000002,0.991,9,-3.903,1,0.087,0.00944,0.0753,0.867,0.415,159.39,187147,4,"She said I'll throw myself away
They're just photos, after all
I can't make you hang around
I can't wash you off my skin

Outside the frame
Is what we're leaving out
You won't remember anyway

I can go with the flow
Don't say it doesn't matter (with the flow), matter anymore
I can go with the flow (I can go)
...

******* This Lyrics is NOT for Commercial use *******
(1409622095821)"
8,8,Warrior,2TNPagu8Z4zvDOpmnktF00,rock,https://open.spotify.com/track/2TNPagu8Z4zvDOpmnktF00,Disturbed,3TOqt5oJwL9BE2NG9MEwDa,"['alternative metal', 'nu metal', 'rap metal']",2010-08-20,204826,62,0.5489999999999999,0.9690000000000001,1,-2.763,1,0.049,1.1599999999999999e-05,0.106,0.10400000000000001,0.348,101.055,204827,4,"I am now, an instrument of violence
I am a vessel of invincibility
I cannot leave this undecided
Stepping down to battle another day
Remember me for all time this
Determination is a vital part of me
Surrender now or be counted
With the endless masses that I will defeat

Come on bring it
Don't sing it
Better believe it
Broken down till your hope has died
Beat down till victory's mine
Stand up and show me some pride
And now, are you ready?

I'm the one with the warrior inside

My dominance can't be denied
Your entire world will turn
Into a battlefield tonight
As I look upon you, through the warrior's eyes now
I can see the fear
That will ensure my victory this time
...

******* This Lyrics is NOT for Commercial use *******
(1409622095821)"
9,9,On My Teeth,11kXjnwkLFOCGZJoRmlBHe,rock,https://open.spotify.com/track/11kXjnwkLFOCGZJoRmlBHe,Underoath,3GzWhE2xadJiW8MqRKIVSK,"['christian metal', 'christian metalcore', 'melodic metalcore', 'metalcore', 'pop punk', 'post-hardcore', 'screamo', 'tampa indie']",2018-04-06,190840,47,0.414,0.9440000000000001,1,-4.215,1,0.0739,4.61e-05,0.0004980000000000001,0.201,0.131,165.047,190840,4,"Let's get this straight!

I'm fine without you
I'm not your fucking prey
So save yourself
And no one else

What you believe
What you believe
What you believe
Your life is a lie
Get over it
Get over it
Get over it

You got the best of me
And stabbed me in the back
I taste you on my teeth
You're like a heart attack
And I'm not okay
...

******* This Lyrics is NOT for Commercial use *******
(1409622095821)"
10,10,Can't You See,4fUU9WKxEgJXyrZJsUA2iP,rock,https://open.spotify.com/track/4fUU9WKxEgJXyrZJsUA2iP,The Marshall Tucker Band,59QxeZBL6k9L4oJBGSyukd,"['album rock', 'blues rock', 'classic rock', 'country rock', 'folk rock', 'mellow gold', 'rock', 'roots rock', 'soft rock', 'southern rock']",1973,365093,71,0.406,0.713,7,-5.49,1,0.0348,0.276,0.0035399999999999997,0.11199999999999999,0.5770000000000001,164.44400000000002,365093,4,"I'm gonna take a freight train
Down at the station, Lord
I don't care where it goes
Gonna climb a mountain
The highest mountain
I'll jump off, nobody gonna know

Can't you see, whoa, can't you see
What that woman, Lord, she been doin' to me
Can't you see, can't you see
What that woman, she been doin' to me

I'm gonna find me
A hole in the wall
I'm gonna crawl inside and die
'Cause my lady, now
A mean ol' woman, Lord
...

******* This Lyrics is NOT for Commercial use *******
(1409622095821)"
11,11,My Generation - Stereo Version,4u9f8hqstB7iITDJNzKhQx,rock,https://open.spotify.com/track/4u9f8hqstB7iITDJNzKhQx,The Who,67ea9eGLXYMsO2eYQRui3w,"['album rock', 'art rock', 'blues rock', 'british invasion', 'classic rock', 'folk rock', 'hard rock', 'mellow gold', 'rock', 'roots rock']",1965-12-03,198706,67,0.41200000000000003,0.782,2,-9.186,0,0.057999999999999996,0.308,0.00822,0.0775,0.705,96.73200000000001,198707,4,"People try to put us d-down
(Talkin' 'bout my generation)
Just because we get around
(Talkin' 'bout my generation)
Things they do look awful c-c-cold
(Talkin' 'bout my generation)
I hope I die before I get old
(Talkin' 'bout my generation)

My generation
This is my generation, baby

Why don't you all f-fade away
(Talkin' 'bout my generation)
Don't try to dig what we all s-s-say
(Talkin' 'bout my generation)
I'm not trying to cause a big s-s-sensation
(Talkin' 'bout my generation)
I'm just talkin' 'bout my g-g-generation
(Talkin' 'bout my generation)

My generation
...

******* This Lyrics is NOT for Commercial use *******
(1409622095821)"
12,12,Every Breath You Take - Remastered 2003,5C0LFQARavkPpn7JgA4sLk,rock,https://open.spotify.com/track/5C0LFQARavkPpn7JgA4sLk,The Police,5NGO30tJxFlKixkPSgXcFE,"['album rock', 'art rock', 'classic rock', 'mellow gold', 'new wave', 'permanent wave', 'rock', 'soft rock']",1983-06-01,253250,1,0.82,0.452,1,-9.796,1,0.0348,0.5429999999999999,0.00294,0.0701,0.74,117.40100000000001,253250,4,"Every breath you take
Every move you make
Every bond you break
Every step you take
I'll be watching you

Every single day
Every word you say
Every game you play
Every night you stay
I'll be watchin' you

Oh, can't you see
You belong to me
How my poor heart aches
With every step you take

Every move you make
Every vow you break
Every smile you fake
Every claim you stake
I'll be watchin' you
...

******* This Lyrics is NOT for Commercial use *******
(1409622095821)"
13,13,Dust in the Wind,6zeE5tKyr8Nu882DQhhSQI,rock,https://open.spotify.com/track/6zeE5tKyr8Nu882DQhhSQI,Kansas,2hl0xAkS2AIRAu23TVMBG1,"['album rock', 'art rock', 'bow pop', 'classic rock', 'hard rock', 'heartland rock', 'mellow gold', 'progressive rock', 'rock', 'soft rock', 'symphonic rock']",1977,206266,77,0.475,0.322,7,-10.687000000000001,1,0.0283,0.36700000000000005,0.00056,0.11,0.387,93.50299999999999,206267,4,"I close my eyes

Only for a moment and the moment's gone
All my dreams
Pass before my eyes, a curiosity

Dust in the wind
All they are is dust in the wind

Same old song
...

******* This Lyrics is NOT for Commercial use *******
(1409622095821)"
14,14,Roots,5wBaNy59nK8hJnx8AB2zRe,rock,https://open.spotify.com/track/5wBaNy59nK8hJnx8AB2zRe,In This Moment,6tbLPxj1uQ6vsRQZI2YFCT,"['alternative metal', 'melodic metalcore', 'nu metal']",2017-07-21,249133,55,0.428,0.9590000000000001,6,-3.727,1,0.256,0.0319,0.0,0.0888,0.262,144.39600000000002,249133,4,"I thank you for all the lives you've led
I thank you for every word you said
I thank you for walking away
I thank you for the promises you broke
For always watching, watching while I choke
I thank you for teaching me
Yes, I thank you for your hurting

I bite down a little harder
My blade's a little sharper
My roots, my roots run deep into the hollow
Strike back a little harder
I scream a little louder
My roots, my roots run deep into the hollow
I'm stronger than I ever knew
I'm strong because of you
I hit back a little louder
Fuck you a little harder
My roots, my roots run deep into the hollow

I thank you for the hole you dug in me
Filled it with cement, sunk me in your sea
Thank you for being so obscene
...

******* This Lyrics is NOT for Commercial use *******
(1409622095821)"
15,15,The Stroke - Remastered,52KvuGmgcgRdrLMXOtda0E,rock,https://open.spotify.com/track/52KvuGmgcgRdrLMXOtda0E,Billy Squier,3Fz2GbraVXhcpXnoi2Oe1r,"['album rock', 'classic rock', 'country rock', 'glam metal', 'hard rock', 'heartland rock', 'mellow gold', 'rock', 'soft rock']",1981,217613,67,0.67,0.591,7,-6.0120000000000005,1,0.0646,0.62,0.0,0.373,0.8,91.439,217613,4,"Now everybody
Have you heard
If you're in the game
Then the stroke's the word

Don't take no rhythm
Don't take no style
Gotta thirst for killin'
Grab your vial
Wow

Put your right hand out
Give a firm handshake
Talk to me
About that one big break

Spread your ear pollution
Both far and wide
Keep your contributions
By your side and

Stroke me, stroke me
Could be a winner, boy you move mighty well
Stroke me, stroke me
(Stroke)
Stroke me, stroke me
You got your number down
...

******* This Lyrics is NOT for Commercial use *******
(1409622095821)"
16,16,One,3G69vJMWsX6ZohTykad2AU,rock,https://open.spotify.com/track/3G69vJMWsX6ZohTykad2AU,U2,51Blml2LZPmy7TTiAg47vQ,"['irish rock', 'permanent wave', 'rock']",1991-11-18,276186,75,0.392,0.534,0,-8.793,1,0.0369,0.245,0.0010400000000000001,0.155,0.325,181.305,276187,4,"Is it getting better?
Or do you feel the same?
Will it make it easier on you now?
You got someone to blame

You say, one love, one life
When it's one need in the night
One love, we get to share it
Leaves you baby if you don't care for it

Did I disappoint you?
Or leave a bad taste in your mouth?
You act like you never had love
And you want me to go without

...

******* This Lyrics is NOT for Commercial use *******
(1409622095821)"
17,17,She's Out Of Her Mind,6EE19skJ32p58xihYj2Waa,rock,https://open.spotify.com/track/6EE19skJ32p58xihYj2Waa,blink-182,6FBDaR13swtiWwGhX1WQsP,"['pop punk', 'punk', 'socal pop punk']",2016-07-01,162720,61,0.447,0.9670000000000001,0,-2.7060000000000004,1,0.0793,0.00448,0.0,0.48700000000000004,0.606,179.99099999999999,162720,4,"I said, ""settle down, settle down, everything is fine...
Take your eyes off the floor""
She said, ""no, i'm not, no, i'm not, no, i'm not alright...
I lost my head on the door""

She's a-a-a-antisocial, a-a-a-antisocial
A-a-a she's an angel, yeah

I'm in deep with this girl, but she's out of her mind (woah)
She said, ""babe, i'm sorry but i'm crazy tonight"" (woah)
She got a black shirt, black skirt and Bauhaus stuck in her head
I'm in deep with this girl, but she's out of her mind (woah)

...

******* This Lyrics is NOT for Commercial use *******
(1409622095821)"
18,18,Pumped Up Kicks,7w87IxuO7BDcJ3YUqCyMTT,rock,https://open.spotify.com/track/7w87IxuO7BDcJ3YUqCyMTT,Foster The People,7gP3bB2nilZXLfPHJhMdvc,"['indietronica', 'modern alternative rock', 'modern rock', 'pop', 'rock']",2011-05-23,239600,83,0.733,0.71,5,-5.849,0,0.0292,0.145,0.115,0.0956,0.965,127.975,239600,4,"Robert's got a quick hand
He'll look around the room he won't tell you his plan
He's got a rolled cigarette
Hanging out his mouth, he's a cowboy kid

Yeah, he found a six shooter gun
In his dad's closet, in a box of fun things
And I don't even know what
But he's coming for you, yeah, he's coming for you

All the other kids with the pumped up kicks
You better run, better run, outrun my gun
All the other kids with the pumped up kicks
You better run, better run faster than my bullet

All the other kids with the pumped up kicks
You better run, better run, outrun my gun
All the other kids with the pumped up kicks
...

******* This Lyrics is NOT for Commercial use *******
(1409622095821)"
19,19,The Final Countdown,3MrRksHupTVEQ7YbA0FsZK,rock,https://open.spotify.com/track/3MrRksHupTVEQ7YbA0FsZK,Europe,7Js6Lde8thlIHXggv2SCBz,"['album rock', 'glam metal', 'hard rock', 'rock', 'swedish hard rock', 'swedish melodic rock']",1986,310333,76,0.529,0.843,6,-6.9079999999999995,0,0.0616,0.0628,0.0008269999999999999,0.0608,0.188,117.662,310333,4,"We're leaving together
But still it's farewell
And maybe we'll come back
To earth, who can tell?
I guess there is no one to blame
We're leaving ground (leaving ground)
Will things ever be the same again?

It's the final countdown

The final countdown

Oh-oh
...

******* This Lyrics is NOT for Commercial use *******
(1409622095821)"
20,20,Simple Man,1ju7EsSGvRybSNEsRvc7qY,rock,https://open.spotify.com/track/1ju7EsSGvRybSNEsRvc7qY,Lynyrd Skynyrd,4MVyzYMgTwdP7Z49wAZHx0,"['album rock', 'blues rock', 'classic rock', 'country rock', 'hard rock', 'mellow gold', 'rock', 'southern rock']",1973-01-01,356626,72,0.42200000000000004,0.752,6,-8.682,1,0.0449,0.0366,0.00011899999999999999,0.129,0.40299999999999997,120.471,356627,4,"Mama told me when I was young
Come sit beside me my only son
And listen closely to what I say
And if you do this it'll help you
Some sunny day oh yeah

Oh take your time don't live too fast
Troubles will come and they will pass
Go find a woman yeah and you'll find love
And don't forget son there is someone up above

And be a simple kind of man
Oh be something you love and understand
...

******* This Lyrics is NOT for Commercial use *******
(1409622095821)"
21,21,The Doomed,44OUZyiPnJc4pOZw4J6pid,rock,https://open.spotify.com/track/44OUZyiPnJc4pOZw4J6pid,A Perfect Circle,4DFhHyjvGYa9wxdHUjtDkc,"['alternative metal', 'alternative rock', 'nu metal', 'rap rock', 'rock', 'supergroup']",2018-04-20,281780,53,0.36700000000000005,0.903,4,-5.956,0,0.175,0.0477,0.00124,0.235,0.239,106.329,281781,3,"Behold a new Christ
Behold the same old horde
Gather at the altering
New beginning, new word

And the word was death
And the word was without light
The new beatitude
Good luck, you're on your own

Blessed are the fornicants
May we bend down to be their whores
Blessed are the rich
May we labor, deliver them more
Blessed are the envious
Bless the slothful, the wrathful, the vain
...

******* This Lyrics is NOT for Commercial use *******
(1409622095821)"
22,22,The Weight - Remastered,0P7DoyGrr4Wp9w5TotEtUC,rock,https://open.spotify.com/track/0P7DoyGrr4Wp9w5TotEtUC,The Band,4vpDg7Y7fU982Ds30zawDA,"['album rock', 'blues rock', 'classic canadian rock', 'classic rock', 'cosmic american', 'country rock', 'folk', 'folk rock', 'heartland rock', 'jam band', 'mellow gold', 'rock', 'roots rock', 'soft rock', 'swamp rock']",1968-07-01,274493,73,0.63,0.551,9,-9.28,1,0.0549,0.373,5.7499999999999995e-05,0.10300000000000001,0.518,143.868,274493,4,"I pulled into Nazareth, was feelin' about half past dead
I just need some place where I can lay my head
""Hey, mister, can you tell me where a man might find a bed?""
He just grinned and shook my hand, ""No"" was all he said

Take a load off Fanny
Take a load for free
Take a load off Fanny
And (and) (and) you put the load right on me

I picked up my bag, I went lookin' for a place to hide
When I saw Carmen and the Devil walkin' side by side
I said, ""Hey, Carmen, come on let's go downtown""
She said, ""I gotta go but my friend can stick around""

Take a load off Fanny
...

******* This Lyrics is NOT for Commercial use *******
(1409622095821)"
23,23,This Is War,2D52zjCyqEIQa221lhw6uk,rock,https://open.spotify.com/track/2D52zjCyqEIQa221lhw6uk,Thirty Seconds To Mars,0RqtSIYZmd4fiBKVFqyIqD,"['modern rock', 'pop punk', 'post-grunge', 'rock']",2009-01-01,326983,66,0.402,0.723,6,-5.26,1,0.0579,0.0663,2e-06,0.233,0.22399999999999998,160.047,326983,4,"A warning to the people
The good and the evil
This is war
To the soldier, the civilian
The martyr, the victim
This is war

It's the moment of truth, and the moment to lie
The moment to live and the moment to die
The moment to fight, the moment to fight
To fight, to fight, to fight

To the right, to the left
We will fight to the death
To the edge of the earth
It's a brave new world
From the last to the first

To the right, to the left
We will fight to the death
To the edge of the earth
It's a brave new world
It's a brave new world

A warning to the prophet
...

******* This Lyrics is NOT for Commercial use *******
(1409622095821)"
24,24,Black Hole Sun,7fURZRPkB2S70sYR1naKTK,rock,https://open.spotify.com/track/7fURZRPkB2S70sYR1naKTK,Soundgarden,5xUf6j4upBrXZPg6AI4MRK,"['alternative metal', 'alternative rock', 'blues rock', 'grunge', 'hard rock', 'modern rock', 'nu metal', 'rock']",1994-01-01,318000,50,0.361,0.728,6,-8.519,1,0.0368,0.000291,0.00011200000000000001,0.0701,0.155,105.76799999999999,318000,4,"In my eyes
Indisposed
In disguises no one knows
Hides the face
Lies the snake
And the sun in my disgrace
Boiling heat
Summer stench
Neath the black, the sky looks dead
Call my name
Through the cream
And I'll hear you scream again

Black hole sun
Won't you come
And wash away the rain?
Black hole sun
Won't you come
Won't you come
Won't you come

Stuttering
Cold and damp
Steal the warm wind, tired friend
Times are gone
...

******* This Lyrics is NOT for Commercial use *******
(1409622095821)"
25,25,Man of War,552BIJ9kKwwqiGf4YojYbL,rock,https://open.spotify.com/track/552BIJ9kKwwqiGf4YojYbL,Radiohead,4Z8W4fKeB5YxbusRsdQVPb,"['alternative rock', 'art rock', 'melancholia', 'oxford indie', 'permanent wave', 'rock']",2017-06-23,269093,0,0.27399999999999997,0.47200000000000003,9,-7.614,0,0.0263,0.0131,0.069,0.0802,0.14,148.996,269093,4,"Drift all you like
From ocean to ocean
Search the whole world
But drunken confessions
And hijacked affairs
Will just make you more alone

When you come home
I'll bake you a cake
Made of all their eyes
I wish you could see me
...

******* This Lyrics is NOT for Commercial use *******
(1409622095821)"
26,26,Time is Running Out,2takcwOaAZWiXQijPHIx7B,rock,https://open.spotify.com/track/2takcwOaAZWiXQijPHIx7B,Muse,12Chz98pHFMPJEknJQMWvI,"['modern rock', 'permanent wave', 'rock']",2004-03-23,237039,67,0.585,0.8420000000000001,9,-5.882999999999999,0,0.0556,0.00242,0.00686,0.0866,0.428,118.211,237040,4,"I think I'm drowning
Asphyxiated
I wanna break this spell
That you've created

You're something beautiful
A contradiction
I wanna play the game
I want the friction

You will be the death of me
You will be the death of me

Bury it
I won't let you bury it
I won't let you smother it
I won't let you murder it

Our time is running out
Our time is running out
...

******* This Lyrics is NOT for Commercial use *******
(1409622095821)"
27,27,Wolf,2S7R4trL4HITPIfvKUxcA4,rock,https://open.spotify.com/track/2S7R4trL4HITPIfvKUxcA4,Highly Suspect,2pqd3HsfsvcBGtHvPOg6eg,"['modern alternative rock', 'modern rock', 'post-grunge', 'rock']",2016-11-18,416266,50,0.405,0.539,2,-7.57,1,0.0363,0.0124,0.0033399999999999997,0.27899999999999997,0.0384,126.167,416267,4,"You think you know me
I wish I did too
'Cause everything's changing
And I am changing too

It's not a question
This shit is real
And it's hard to look back
But it's harder to move on
Funny, it's a good time
For a timeless song

I gave you my heart
...

******* This Lyrics is NOT for Commercial use *******
(1409622095821)"
28,28,Dream On,5MxNLUsfh7uzROypsoO5qe,rock,https://open.spotify.com/track/5MxNLUsfh7uzROypsoO5qe,Aerosmith,7Ey4PD4MYsKc5I2dolUwbH,"['album rock', 'classic rock', 'hard rock', 'rock']",1973-01-05,266960,78,0.307,0.433,1,-10.057,1,0.028999999999999998,0.38799999999999996,9.08e-05,0.332,0.22399999999999998,160.9,266960,4,"Every time when I look in the mirror
All these lines on my face getting clearer
The past is gone

And it went by, like dusk to dawn
Isn't that the way?
Everybody's got their dues in life to pay

Yeah, I know nobody knows
Where it comes and where it goes
I know it's everybody's sin
You got to lose to know how to win

Half my life's in books, written pages
Live and learn from fools and from sages
You know it's true, oh
All the things come back to you

Sing with me, sing for a year
...

******* This Lyrics is NOT for Commercial use *******
(1409622095821)"
29,29,Fortunate Son,4BP3uh0hFLFRb5cjsgLqDh,rock,https://open.spotify.com/track/4BP3uh0hFLFRb5cjsgLqDh,Creedence Clearwater Revival,3IYUhFvPQItj6xySrBmZkd,"['album rock', 'classic rock', 'country rock', 'rock', 'roots rock', 'southern rock', 'swamp rock']",1969-11-02,140773,81,0.64,0.6629999999999999,0,-7.516,1,0.0374,0.201,0.00806,0.152,0.6629999999999999,132.77,140773,4,"Some folks are born made to wave the flag
They're red, white and blue
And when the band plays ""Hail to the Chief""
They point the cannon at you, Lord

It ain't me, it ain't me
I ain't no senator's son, son
It ain't me, it ain't me
I ain't no fortunate one

Some folks are born silver spoon in hand
...

******* This Lyrics is NOT for Commercial use *******
(1409622095821)"
