,Unnamed: 0,song_name,song_id,song_genre,url,artist,artist_id,artist_genre,release_date,duration_ms,popularity,danceability,energy,key,loudness,mode,speechiness,acousticness,instrumentalness,liveness,valence,tempo,duration_ms_,time_signature,lyrics
703,703,The Last Of The Real Ones,6e13443Ve7RGcAUScTgYtl,rock,https://open.spotify.com/track/6e13443Ve7RGcAUScTgYtl,Fall Out Boy,4UXqAaa6dQYAk18Lv7PEgX,"['emo', 'modern rock', 'pop punk']",2018-01-19,230400,62,0.5760000000000001,0.872,8,-5.292999999999999,1,0.0471,0.00599,0.0,0.188,0.5589999999999999,115.042,230400,4,"I was just an only child of the universe
And then I found you
And then I found you
You are the sun and I am just the planets
Spinning around you
Spinning around you

You were too good to be true
Gold plated
But what's inside you?
But what's inside you?
I know this whole damn city thinks it needs you
But not as much as I do
As much as I do, yeah

'Cause you're the last of a dying breed
Write our names in the wet concrete
I wonder if your therapist knows everything about me
I'm here in search of your glory
There's been a million before me
That ultra-kind of love
You never walk away from

You're just the last of the real ones
You're just the last of the real ones
You're just the last of the real ones
You're just the last of the real ones
You're just the last of the real ones
You're just the last of the real ones
You're just the last of the real ones
...

******* This Lyrics is NOT for Commercial use *******
(1409622095821)"
704,704,Let Me Live / Let Me Die,2UKMqNCVsHrAYzBZMA0rxL,rock,https://open.spotify.com/track/2UKMqNCVsHrAYzBZMA0rxL,Des Rocs,2kO6mP0olFJGGh6kvUdNC8,"['modern alternative rock', 'modern blues rock', 'modern rock', 'rebel blues', 'rock']",2018-07-13,207141,0,0.51,0.759,9,-4.854,1,0.10099999999999999,0.034,0.0,0.077,0.237,91.12299999999999,207142,4,"Hey

Hey

I know pain, I know dread
Look his eyes, they've turned to lead
The tears don't stop the fire
It's killing time

Back from the dead
See your eyes, got nothing left
Kiss me, I am the colder
It's killing time

...

******* This Lyrics is NOT for Commercial use *******
(1409622095821)"
705,705,Born To Be My Baby,50ZpPgU81payZxI2H7QXNM,rock,https://open.spotify.com/track/50ZpPgU81payZxI2H7QXNM,Bon Jovi,58lV9VcRSjABbAbfWS6skp,"['glam metal', 'hard rock', 'rock']",1988-09-13,280106,61,0.534,0.9590000000000001,7,-4.289,1,0.0379,0.0089,0.0,0.34700000000000003,0.7559999999999999,131.278,280107,4,"Rainy night and we worked all day
We both got jobs 'cause there's bills to pay
We got something they can't take away
Our love, our lives

Close the door, leave the cold outside
I don't need nothing when I'm by your side
We got something that'll never die
Our dreams, our pride

My heart beats like a drum (all night)
Flesh to flesh, one to one (and it's alright)
And I'll never let go 'cause
There's something I know deep inside

You were born to be my baby
And baby, I was made to be your man

We got something to believe in
Even if we don't know where we stand
Only God would know the reasons
But I bet he must have had a plan
'Cause you were born to be my baby
...

******* This Lyrics is NOT for Commercial use *******
(1409622095821)"
706,706,I Will Not Bow,2yXyz4NLTZx9CLdXfLTp5E,rock,https://open.spotify.com/track/2yXyz4NLTZx9CLdXfLTp5E,Breaking Benjamin,5BtHciL0e0zOP7prIHn3pP,"['alternative metal', 'nu metal', 'post-grunge']",2009-01-01,216733,70,0.5329999999999999,0.955,8,-3.708,1,0.0653,0.000165,1.36e-05,0.38,0.55,107.984,216733,4,"Fall
Now the dark begins to rise
Save your breath, it's far from over
Leave the lost and dead behind
Now's your chance to run for cover

I don't want to change the world
I just want to leave it colder
Light the fuse and burn it up
Take the path that leads to nowhere

All is lost again
But I'm not giving in

I will not bow
I will not break
I will shut the world away
I will not fall
I will not fade
I will take your breath away
...

******* This Lyrics is NOT for Commercial use *******
(1409622095821)"
707,707,Knockin' On Heaven's Door,4JiEyzf0Md7KEFFGWDDdCr,rock,https://open.spotify.com/track/4JiEyzf0Md7KEFFGWDDdCr,Guns N' Roses,3qm84nBOXUEQ2vnTfUTTFC,"['glam metal', 'hard rock', 'rock']",1991-09-18,336000,77,0.496,0.7390000000000001,6,-7.193,1,0.0415,0.0211,0.0044399999999999995,0.106,0.37799999999999995,132.41,336000,4,
708,708,Good Riddance (Time of Your Life),6ORqU0bHbVCRjXm9AjyHyZ,rock,https://open.spotify.com/track/6ORqU0bHbVCRjXm9AjyHyZ,Green Day,7oPftvlwr6VrsViSDV7fJY,"['permanent wave', 'pop punk', 'punk']",1997-10-14,153466,75,0.475,0.43200000000000005,7,-7.843999999999999,1,0.0302,0.183,0.0,0.161,0.648,94.605,153467,4,"Another turning point
A fork stuck in the road
Time grabs you by the wrist
Directs you where to go
So make the best of this test
And don't ask why
It's not a question
But a lesson learned in time
It's something unpredictable
...

******* This Lyrics is NOT for Commercial use *******
(1409622095821)"
709,709,Hunger,6Ju28M6P8Y8sLjBgWjyUUD,rock,https://open.spotify.com/track/6Ju28M6P8Y8sLjBgWjyUUD,Florence + The Machine,1moxjboGR7GNWYIMWsRjgG,"['baroque pop', 'pop', 'uk alternative pop']",2018-06-29,214666,63,0.7290000000000001,0.675,2,-5.62,0,0.0415,0.53,0.0,0.0985,0.332,116.016,214667,4,"At seventeen I started to starve myself
I thought that love was a kind of emptiness
And at least I understood, then, the hunger I felt
And I didn't have to call it loneliness

We all have a hunger
We all have a hunger
We all have a hunger
We all have a hunger

Tell me what you need, oh, you look so free
The way you use your body, baby, come on and work it for me
Don't let them get you down, you're the best thing I've seen
We never found the answer but we knew one thing

We all have a hunger (we all have a hunger)
We all have a hunger (we all have a hunger)
We all have a hunger (we all have a hunger)
We all have a hunger (we all have a hunger)

...

******* This Lyrics is NOT for Commercial use *******
(1409622095821)"
710,710,California Dreamin' - Single Version,4s6LhHAV5SEsOV0lC2tjvJ,rock,https://open.spotify.com/track/4s6LhHAV5SEsOV0lC2tjvJ,The Mamas & The Papas,1bs7HoMkSyQwcobCpE9KpN,"['brill building pop', 'bubblegum pop', 'classic rock', 'folk', 'folk rock', 'mellow gold', 'psychedelic rock', 'rock', 'soft rock', 'sunshine pop']",1966-03,162373,77,0.552,0.608,1,-9.786,0,0.0345,0.35200000000000004,0.0,0.0533,0.637,112.367,162373,4,"All the leaves are brown (all the leaves are brown)
And the sky is gray (and the sky is gray)
I've been for a walk (I've been for a walk)
On a winter's day (on a winter's day)

I'd be safe and warm (I'd be safe and warm)
If I was in L.A. (if I was in L.A.)
California dreamin' (California dreamin')
On such a winter's day

Stopped into a church
...

******* This Lyrics is NOT for Commercial use *******
(1409622095821)"
711,711,Burn it to the Ground,4pckuF6VOu58o1pMFUdlPW,rock,https://open.spotify.com/track/4pckuF6VOu58o1pMFUdlPW,Nickelback,6deZN1bslXzeGvOLaLMOIF,"['alternative metal', 'canadian rock', 'nu metal', 'post-grunge']",2008,210946,56,0.617,0.9109999999999999,11,-3.464,1,0.0715,0.00022200000000000003,0.325,0.354,0.65,132.064,210947,4,"Well, it's midnight, damn right
We're wound up too tight
I've got a fist full of whiskey
The bottle just bit me

Oh, that shit makes me bat shit crazy
We've got no fear, no doubt
All in balls out

We're going off tonight
To kick out every light
Take anything we want
Drink everything in sight

We're going till the world stops turning
While we burn it to the ground tonight

Ooh, ooh, ooh
Ooh, ooh, ooh

We're screaming like demons
Swinging from the ceiling
I got a fist full of fifties
...

******* This Lyrics is NOT for Commercial use *******
(1409622095821)"
712,712,Rose-Colored Boy,2RJfK2pOvGpnxC255YOy5k,rock,https://open.spotify.com/track/2RJfK2pOvGpnxC255YOy5k,Paramore,74XFHRwlV6OrjEM0A2NCMF,"['candy pop', 'emo', 'pixie', 'pop emo', 'pop punk']",2017-05-12,212853,64,0.768,0.826,5,-4.904,1,0.0335,0.00199,0.00037400000000000004,0.031,0.9259999999999999,114.99700000000001,212853,4,"Low-key, no pressure
Just hang with me and my weather
Low-key, no pressure
Just hang with me and my weather

Rose-colored boy
I hear you making all that noise
About the world you want to see
And oh, I'm so annoyed
'Cause I just killed off what was left of
The optimist in me

But hearts are breaking, and wars are raging on
And I have taken my glasses off
You got me nervous
I'm right at the end of my rope
A half empty girl
Don't make me laugh, I'll choke

Just let me cry a little bit longer
I ain't gon' smile if I don't want to
Hey, man, we all can't be like you
I wish we were all rose-colored too
...

******* This Lyrics is NOT for Commercial use *******
(1409622095821)"
713,713,Whatever It Takes,6Qn5zhYkTa37e91HC1D7lb,rock,https://open.spotify.com/track/6Qn5zhYkTa37e91HC1D7lb,Imagine Dragons,53XhwfbYqKCa1cC15pYq2q,"['modern rock', 'pop', 'rock']",2017-06-23,201240,80,0.672,0.655,10,-5.021,0,0.0311,0.0362,0.0,0.11699999999999999,0.556,134.945,201240,4,"Falling too fast to prepare for this
Tripping in the world could be dangerous
Everybody circling is vulturous
Negative, nepotist

Everybody waiting for the fall of man
Everybody praying for the end of times
Everybody hoping they could be the one
I was born to run, I was born for this

Whip, whip
Run me like a race horse
Hold me like a rip cord
Break me down and build me up
I wanna be the slip, slip
Word upon your lip, lip
Letter that you rip, rip
Break me down and build me up

Whatever it takes
'Cause I love the adrenaline in my veins
I do whatever it takes
'Cause I love how it feels when I break the chains
Whatever it takes
Ya take me to the top, I'm ready for
Whatever it takes
'Cause I love the adrenaline in my veins
...

******* This Lyrics is NOT for Commercial use *******
(1409622095821)"
714,714,I Wanna Be Sedated,5NoQvINZLBV1wMYPdNmReL,rock,https://open.spotify.com/track/5NoQvINZLBV1wMYPdNmReL,Ramones,1co4F2pPNH8JjTutZkmgSm,"['classic rock', 'early us punk', 'permanent wave', 'punk', 'rock', 'skate punk']",1978,149786,66,0.56,0.965,11,-2.3409999999999997,1,0.0409,0.121,6.23e-06,0.16899999999999998,0.9640000000000001,162.825,149787,4,"20, 20, 20, 20, 4 hours to goooo
I wanna be sedated
Nothing to do nowhere to go oh
I wanna be sedated

Just get me to the airport
And put me in a plane
Hurry, hurry, hurry
Before I go insane
I can't control my fingers
I can't control my brain
Oh, no oh oh oh oooh!

20, 20, 20, 20, 4 hours to goooo
I wanna be sedated
Nothing to do nowhere to go oh
I wanna be sedated

Just put me in a wheelchair
And get me on a plane
...

******* This Lyrics is NOT for Commercial use *******
(1409622095821)"
715,715,Lookin' Out My Back Door,3GqeZK1VfO6z9MS3qmCmJk,rock,https://open.spotify.com/track/3GqeZK1VfO6z9MS3qmCmJk,Creedence Clearwater Revival,3IYUhFvPQItj6xySrBmZkd,"['album rock', 'classic rock', 'country rock', 'rock', 'roots rock', 'southern rock', 'swamp rock']",1970-07-25,152066,0,0.775,0.406,10,-14.52,1,0.0466,0.19699999999999998,0.0018800000000000002,0.0885,0.8220000000000001,105.3,152067,4,"Just got home from Illinois, lock the front door, oh boy!
Got to sit down, take a rest on the porch
Imagination sets in, pretty soon I'm singin'
Doo, doo, doo, lookin' out my back door

There's a giant doin' cartwheels, a statue wearin' high heels
Look at all the happy creatures dancin' on the lawn
Dinosaur Victrola, listenin' to Buck Owens
...

******* This Lyrics is NOT for Commercial use *******
(1409622095821)"
716,716,Lift Me Up (feat. Rob Halford of Judas Priest),1LHZMWefF9502NPfArRfvP,rock,https://open.spotify.com/track/1LHZMWefF9502NPfArRfvP,Five Finger Death Punch,5t28BP42x2axFnqOOMg3CM,"['alternative metal', 'groove metal', 'nu metal']",2013-07-26,246209,60,0.508,0.988,1,-3.613,0,0.165,8.45e-05,0.0,0.209,0.174,75.018,246209,4,"It ain't no mystery, I'm all I have left
I'm pushing back and running you over
I've been thrown down, run around, beaten 'til I hit the ground
I'm telling you right now that it's over
There's no room for mistakes, all the parts are in place
Say what you will but say it to my face
Better back the fuck up, better shut the fuck up
I'll do what I want and I'll never give up

I won't be broken
I won't be tortured
I won't be beaten down
I have the answer
I take the pressure
I will turn it all around

Lift me up above this
The flames and the ashes
Lift me up and help me
To fly away
Lift me up above this
The broken, the empty
Lift me up and help me
To fly away

...

******* This Lyrics is NOT for Commercial use *******
(1409622095821)"
717,717,Can't Knock the Hustle,1ercYdqHPbucArdgjfLraX,rock,https://open.spotify.com/track/1ercYdqHPbucArdgjfLraX,Weezer,3jOstUTkEu2JkjvRdBA5Gu,"['alternative rock', 'modern power pop', 'modern rock', 'permanent wave', 'pop rock', 'rock']",2018-10-11,222200,35,0.621,0.972,7,-2.245,0,0.05,0.0177,0.0015,0.0692,0.802,101.012,222200,4,
718,718,Prayers,2HLOsBfH6RCLq85GVodkLe,rock,https://open.spotify.com/track/2HLOsBfH6RCLq85GVodkLe,Good Charlotte,5aYyPjAsLj7UzANzdupwnS,"['alternative metal', 'pop punk']",2018-09-14,230027,37,0.365,0.867,9,-5.683,0,0.0716,0.0008029999999999999,4.85e-06,0.0755,0.257,183.912,230027,4,"Born on a lonely planet full of broken dreams
Where no one understands me
When I finally met an angel, I didn't know what to say
She just held my hand
And we would lay awake at night, looking at the stars
Thinking of the ones we've lost, and wonder where they are
When we lit another candle, she asked me who's to blame
Then she put her arms around me and held me to the flame

So why do we hurt each other?
We don't need the words for one another's

Prayers, they don't mean a thing at all
Do they answer when you call?
...

******* This Lyrics is NOT for Commercial use *******
(1409622095821)"
719,719,The River,7HrzErXq3TsKOY1gmdIShB,rock,https://open.spotify.com/track/7HrzErXq3TsKOY1gmdIShB,Bruce Springsteen,3eqjTLE0HfPfh78zjh6TqT,"['classic rock', 'heartland rock', 'mellow gold', 'permanent wave', 'rock', 'singer-songwriter']",1980-10-17,301546,66,0.5870000000000001,0.536,7,-11.248,1,0.0304,0.179,2.75e-05,0.305,0.59,117.49799999999999,301547,4,
720,720,World Away,4hRz7rOTUet8jJpXgWvoXh,rock,https://open.spotify.com/track/4hRz7rOTUet8jJpXgWvoXh,Tonight Alive,5pjCYG6hPLBO3y4swxu3dh,"['candy pop', 'neon pop punk', 'pixie', 'pop emo', 'pop punk']",2017-04-04,232368,0,0.514,0.802,7,-4.1819999999999995,0,0.0322,0.0034799999999999996,0.0,0.0952,0.35600000000000004,90.0,232369,4,"A part of me always believed
I must have brought this on myself
'Cause I'm not where I want to be
And every time I want to change my life
It just feels like trying to turn water into wine

It doesn't have to be a world away
I can hear the song like it's inside of me
I know that if I get to know my pain
I unlock a hundred different doors to better
Days

Though I take hit after hit
I realise the higher reason is accepting challenges as gifts
And through the fight
I never really knew that I would find myself
...

******* This Lyrics is NOT for Commercial use *******
(1409622095821)"
721,721,Cocaine,2udGjDmpK1dH9VGyw7nrei,rock,https://open.spotify.com/track/2udGjDmpK1dH9VGyw7nrei,Eric Clapton,6PAt558ZEZl0DmdXlnjMgD,"['album rock', 'blues rock', 'classic rock', 'electric blues', 'mellow gold', 'rock', 'soft rock']",1977-11-01,221640,70,0.6990000000000001,0.502,9,-12.526,1,0.0278,0.0607,0.0337,0.317,0.6759999999999999,105.26700000000001,221640,4,"If you want to hang out
You've gotta take her out
Cocaine

If you want to get down
Get down on the ground
Cocaine

She don't lie, she don't lie, she don't lie,
Cocaine

...

******* This Lyrics is NOT for Commercial use *******
(1409622095821)"
722,722,Break,4urxRqBRiaH0i20OKBsgxc,rock,https://open.spotify.com/track/4urxRqBRiaH0i20OKBsgxc,Three Days Grace,2xiIXseIJcq3nG7C8fHeBj,"['alternative metal', 'canadian metal', 'canadian rock', 'nu metal', 'post-grunge']",2009-09-22,193106,65,0.578,0.897,0,-3.906,1,0.0357,0.000666,0.0,0.0924,0.737,115.491,193107,4,"Tonight, my head is spinning
I need something to pick me up
I've tried, but nothing is working
I won't stop, I won't say I've had enough

Tonight, I start the fire
Tonight, I break away

Break away from everybody
Break away from everything
If you can't stand the way this place is
Take yourself to higher places

...

******* This Lyrics is NOT for Commercial use *******
(1409622095821)"
723,723,Feel Invincible,0i8JFpqe9cKwnrcvoNgl1L,rock,https://open.spotify.com/track/0i8JFpqe9cKwnrcvoNgl1L,Skillet,49bzE5vRBRIota4qeHtQM8,"['alternative metal', 'christian alternative rock', 'christian music', 'christian rock']",2016-08-05,229933,72,0.603,0.8859999999999999,5,-3.7769999999999997,0,0.0837,0.00045,0.0,0.26,0.395,126.025,229933,4,"Target on my back, lone survivor lasts
They got me in their sights
No surrender, no, trigger fingers go
Living the dangerous life

Hey-hey-hey everyday when I wake
I'm trying to get up
They're knocking me down
Chewing me up, spitting me out

Hey-hey-hey, when I need to be saved
You're making me strong
You're making me stand
Never will fall, never will end

Shot like a rocket up into the sky
Nothing can stop me tonight

You make me feel invincible
Earthquake powerful
Just like a tidal wave
You make me brave

You're my titanium
Fight song raising up
Like the roar of victory
In a stadium

Who can touch me 'cause I'm
I'm made of fire
Who can stop me tonight
I'm hard wired

You make me feel invincible
I feel, I feel it
Invincible
I feel, I feel it
Invincible

...

******* This Lyrics is NOT for Commercial use *******
(1409622095821)"
724,724,Feel like Makin' Love - 2015 Remaster,3KPwt1LBpt1jVSHz8GXERo,rock,https://open.spotify.com/track/3KPwt1LBpt1jVSHz8GXERo,Bad Company,5AEG63ajney2BoDXi0Vb84,"['album rock', 'blues rock', 'classic rock', 'country rock', 'hard rock', 'mellow gold', 'rock', 'soft rock']",1975,313840,69,0.5429999999999999,0.529,7,-9.717,1,0.0301,0.326,0.0026899999999999997,0.7090000000000001,0.746,85.126,313840,4,"Baby, when I think about you
Think about love...
Darlin' I don't live without you
And your love...

If I had those golden dreams of my yesterday (yesterday)

I would wrap you
In the heaven
Feel it dyin' (dyin', dyin') all the way

Feel like makin'
Feel like makin' love
Feel like makin' love
Feel like makin' love
Feel like makin' love to you

Baby, if I think about you
Think about love...
Darlin' if I live without you
I live without love...
...

******* This Lyrics is NOT for Commercial use *******
(1409622095821)"
725,725,Centuries,04aAxqtGp5pv12UXAg4pkq,rock,https://open.spotify.com/track/04aAxqtGp5pv12UXAg4pkq,Fall Out Boy,4UXqAaa6dQYAk18Lv7PEgX,"['emo', 'modern rock', 'pop punk']",2015-01-20,228360,80,0.39299999999999996,0.858,4,-2.8680000000000003,0,0.0729,0.00359,0.0,0.102,0.56,176.042,228360,4,"Du-du-du-du-du-du-du
Du-du-du-du-du-du-du

Some legends are told
Some turn to dust or to gold
But you will remember me
Remember me, for centuries

And just one mistake
Is all it will take
We'll go down in history
Remember me for centuries
Hey-ya, a-hey, hey-ya
Remember me for centuries

Mummified my teenage dreams
No, it's nothing wrong with me
The kids are all wrong, the story's all off
Heavy metal broke my heart

Come on, come on, and let me in
Bruises on your thighs like my fingerprints
And this is for to match
The darkness that you felt
I never meant for you to fix yourself

Du-du-du-du-du-du-du
Du-du-du-du-du-du-du

...

******* This Lyrics is NOT for Commercial use *******
(1409622095821)"
726,726,In the End,60a0Rd6pjrkxjPbaKzXjfq,rock,https://open.spotify.com/track/60a0Rd6pjrkxjPbaKzXjfq,Linkin Park,6XyY86QOPPrYVGvF9ch6wz,"['alternative metal', 'nu metal', 'post-grunge', 'rap metal']",2000-10-24,216880,83,0.556,0.8640000000000001,3,-5.87,0,0.0584,0.00958,0.0,0.209,0.4,105.14299999999999,216880,4,"It starts with one
One thing I don't know why
It doesn't even matter how hard you try
Keep that in mind, I designed this rhyme
To explain in due time

All I know
Time is a valuable thing
Watch it fly by as the pendulum swings
Watch it count down to the end of the day
The clock ticks life away

It's so unreal
Didn't look out below
Watch the time go right out the window
Tryin' to hold on, did-didn't even know
I wasted it all just to watch you go

I kept everything inside and even though I tried
It all fell apart
What it meant to me will eventually
Be a memory of a time when-
...

******* This Lyrics is NOT for Commercial use *******
(1409622095821)"
727,727,New Divide,7EbpUdQ4nQ5VnnFlZjvqYl,rock,https://open.spotify.com/track/7EbpUdQ4nQ5VnnFlZjvqYl,Linkin Park,6XyY86QOPPrYVGvF9ch6wz,"['alternative metal', 'nu metal', 'post-grunge', 'rap metal']",2007,268613,58,0.493,0.8079999999999999,5,-3.365,0,0.0362,0.00023500000000000002,0.0,0.0983,0.38,117.971,268613,4,"I remembered black skies
The lightning all around me
I remembered each flash
As time began to blur
Like a startling sign
That fate had finally found me
And your voice was all I heard
That I get what I deserve

So give me reason
To prove me wrong
To wash this memory clean
Let the floods cross
The distance in your eyes
Give me reason
To fill this hole
Connect this space between
Let it be enough to reach the truth that lies
Across this new divide
...

******* This Lyrics is NOT for Commercial use *******
(1409622095821)"
728,728,Chalk Outline,0XGV1bem5W9ICY2rgleryV,rock,https://open.spotify.com/track/0XGV1bem5W9ICY2rgleryV,Three Days Grace,2xiIXseIJcq3nG7C8fHeBj,"['alternative metal', 'canadian metal', 'canadian rock', 'nu metal', 'post-grunge']",2012-10-02,181986,60,0.59,0.792,7,-5.013,1,0.0603,0.000567,0.0,0.0448,0.6629999999999999,153.023,181987,4,"I've been cursed
I've been crossed
I've been beaten by the ones that get me off
I've been cut
I've been opened up
I've been shattered by the ones I thought I loved

You left me here like a chalk outline
On the sidewalk waiting for the rain to wash away
Wash away
You keep coming back to the scene of the crime
But the dead can't speak and there's nothing left to say anyway
All you left behind
Is a chalk outline
...

******* This Lyrics is NOT for Commercial use *******
(1409622095821)"
729,729,Had Enough,2xSC2Tvr2I44VZmCXg60dW,rock,https://open.spotify.com/track/2xSC2Tvr2I44VZmCXg60dW,Lower Than Atlantis,1kF0gYnHLUJvFuPdoowO02,"['british alternative rock', 'modern alternative rock', 'modern rock']",2017-02-03,200760,44,0.561,0.823,2,-4.851,1,0.09699999999999999,0.0029,0.00016999999999999999,0.49200000000000005,0.525,93.50399999999999,200760,4,"I hate everyone that I meet
But I'm getting better
Think before I speak because I
I know I've got a temper
(I know I've got a temper)
Screws are shaking loose
I'm bent and buckled
My teeth are clenched

Think I've blown a fuse
There's blood on my knuckles
The smile on my face is fake
And the vein on my head suggests you get running

I've had enough, had enough
Had enough, had enough yeah
Cause I've had enough
Think I'm reaching the limit
You should keep your distance
...

******* This Lyrics is NOT for Commercial use *******
(1409622095821)"
730,730,The Rover,1RTk31cNoWdx1HBRbkc02a,rock,https://open.spotify.com/track/1RTk31cNoWdx1HBRbkc02a,Interpol,3WaJSfKnzc65VDgmj2zU8B,"['alternative dance', 'alternative rock', 'indie rock', 'modern rock', 'new rave', 'rock']",2018-08-24,217693,0,0.18899999999999997,0.893,7,-3.1069999999999998,1,0.0445,3.64e-05,0.539,0.183,0.599,198.468,217693,4,"Come and see me, and maybe you'll die
But I can keep you in artwork, the fluid kind
That's enough for excitements today
Frustrated faded, it's pay-to-play

Come and see me yeah, maybe you'll try
I've been holding these pyros 'til they could fly
Open up and enlighten again
Enjoy the skyline, it's an incremental end

Walk in on your own feet
Says the rover
It's my way or they all leave
Says the rover (Ooh, ooh)
The rover

Starts to be hell, yeah, maybe it's time
...

******* This Lyrics is NOT for Commercial use *******
(1409622095821)"
731,731,Peace of Mind,1GqlvSEtMx5xbGptxOTTyk,rock,https://open.spotify.com/track/1GqlvSEtMx5xbGptxOTTyk,Boston,29kkCKKGXheHuoO829FxWK,"['album rock', 'art rock', 'classic rock', 'country rock', 'hard rock', 'mellow gold', 'rock', 'soft rock']",1976,303586,69,0.419,0.677,4,-6.183,1,0.0343,0.00101,9.990000000000002e-05,0.21100000000000002,0.684,127.678,303587,4,"Now if you're feelin' kinda low 'bout the dues you've been paying
Future's coming much too slow
And you wanna run, but somehow you just keep on stayin'
Can't decide on which way to go
Yeah, yeah, yeah

I understand about indecision
But I don't care if I get behind
People livin' in competition
All I want is to have my peace of mind

Now you're climbin' to the top of the company ladder
Hope it doesn't take too long
...

******* This Lyrics is NOT for Commercial use *******
(1409622095821)"
732,732,Say It Ain't So,4YPhn26bIFm2KUkL1VLzQG,rock,https://open.spotify.com/track/4YPhn26bIFm2KUkL1VLzQG,Weezer,3jOstUTkEu2JkjvRdBA5Gu,"['alternative rock', 'modern power pop', 'modern rock', 'permanent wave', 'pop rock', 'rock']",1994-05-10,256880,0,0.635,0.435,3,-7.521,1,0.031,0.00328,6.78e-06,0.071,0.45899999999999996,76.098,256880,4,
